35	ἀλλὰ μὴν ὅτι παρʼ ἡμῖν καὶ τοῖς λοιποῖς λοιποῖς Babington: λόγοις S. πᾶσιν εὐδοκιμεῖν αὐτοὺς ἀναγκαῖον, ἐκ τούτων φανερόν ἐστιν· ἐν Ἅιδου δὲ λογίσασθαι ἄξιον, τίνες οἱ τὸν ἡγεμόνα δεξιωσόμενοι τὸν τούτων. ἆρʼ οὐκ ἂν οἰόμεθα ὁρᾶν Λεωσθένη δεξιουμένους καὶ θαυμάζοντας τῶν ἡμιθέων καλουμένων ἡμιθέων καλουμένων Cobet: δεηγορμένων καλουμένους S: διηγμένων καὶ ὑμνουμένων in obelis Kenyon: τῶνδε ἡγούμενον καὶ καλουμένους ci. l. a. Post. τοὺς ἐπὶ Τροίαν στρατεύσαντας, τοὺς ἐπὶ Τροίαν στρατεύσαντας Babington: τοὺς ἐπὶ στρατείαν στρασαντ. ς S. ὧν οὗτος ἀδελφὰς πράξεις ἐνστησάμενος τοσοῦτον διήνεγκε, ὥστε οἱ μὲν μετὰ πάσης τῆς Ἑλλάδος μίαν πόλιν εἷλον, ὁ δὲ μετὰ τῆς ἑαυτοῦ πατρίδος μόνης πᾶσαν τὴν τῆς Εὐρώπης καὶ τῆς Ἀσίας ἄρχουσαν δύναμιν ἐταπείνωσεν. 
36	κἀκεῖνοι μὲν ἕνεκα μιᾶς γυναικὸς ὑβρισθείσης ἤμυναν, ὁ δὲ πασῶν τῶν Ἑλληνίδων τὰς ἐπιφερομένας ὕβρεις ἐκώλυσεν, μετὰ τῶν συνθαπτομένων νῦν αὐτῷ ἀνδρῶν. Sic interpunxit Sauppe%10 ἀνδρῶν, et διαπεπραγμένων. Cobet. 
37	τῶν δὲ δὲ add. Sauppe. μετʼ ἐκείνους μὲν γεγενημένων, ἄξια δὲ τῆς ἐκείνων ἀρετῆς διαπεπραγμένων, λέγω δὴ τοὺς περὶ Μιλτιάδην καὶ Θεμιστοκλέα καὶ τοὺς ἄλλους, οἳ τὴν Ἑλλάδα Column 13 ἐλευθερώσαντες ἔντιμον μὲν τὴν πατρίδα κατέστησαν, 
38	ἔνδοξον δὲ δὲ add. Babington. τὸν αὑτῶν βίον ἐποίησαν, ὧν οὗτος τοσοῦτον ὑπερέσχεν ἀνδρείᾳ καὶ φρονήσει, ὅσον οἱ μὲν ἐπελθοῦσαν τὴ ν τῶν βαρβάρων δύναμιν ἠμύναντο, ὁ δὲ μηδʼ ἐπελθεῖν ἐποίησεν. κἀκεῖνοι μὲν ἐν τῇ οἰκ ε ίᾳ τοὺς ἐχθ ρ οὺς ἐπεῖδον ἀγωνιζομένους, οὗτος δὲ ἐν τῇ τῶν ἐχθρῶν περιεγένετο τῶν ἀντιπάλων. 
39	οἶμαι δὲ καὶ τοὺς τοὺς add. Babington. τὴν πρὸς ἀλλήλους φιλίαν τῷ δήμῳ βεβαιότατα ἐνδειξαμένους, λέγω δὲ Ἁρμόδιον καὶ Ἀριστογείτονα, οὐθένας οὕτως αὑτοῖς οἰκειοτέρους ὑμῖν εἶναι νομίζειν ὡς οὐθένας usque ad ὡς locus corruptus: οὐδένας οὕτως αὑτοῖς οἰκείους ἂν εἶναι Sauppe: οὐδαμῶς αὑτοὺς οἰκειοτέρους ὑμῖν εἶναι νομίζειν ἢ Kenyon: οἰκείους ἑτέρους pro οἰκειοτέρους ci. L. A. Post. Alii alia. Λεωσθέ ν η καὶ τοὺς ἐκείνῳ συναγωνισαμένους, οὐδʼ ἔστιν οἷς ἂν μᾶλλον ἢ τούτοις πλησιάσειαν ἐν Ἅιδου. εἰκότως· οὐκ ἐλάττω γὰρ ἐκείνων ἔργα διεπράξαντο, ἀλλʼ εἰ δέον εἰπεῖν, καὶ μείζω. οἱ μὲν γὰρ τοὺς τῆς πατρίδος τυράννους κα τέλυσαν, οὗτοι δὲ τοὺς τῆς Ἑλλάδος ἁπάσης. 
40	ὢ καλῆς μὲν καὶ παραδόξου τόλμης τῆς πραχθείσης ὑπὸ τῶνδε τῶν ἀνδρῶν, ἐνδόξου δὲ καὶ μεγαλοπρεποῦς προαιρέσεως ἧς προείλοντο, ὑπερβαλλούσης δὲ ἀρετῆς καὶ ἀνδραγαθίας τῆς ἐν τοῖς κινδύνοις, ἣν οὗτοι παρασχόμενοι εἰς τὴν κοινὴν ἐλευθερίαν τῶν Ἑλλήνων 
41	χαλεπὸν Epilogus apud Stobaeum, Florileg. cxxiv. 36 servatus est. μὲν ἴσως ἐστὶ τοὺς ἐν τοῖς τοιούτοις ὄντας πάθεσι παραμυθεῖσθαι. τὰ γὰρ πένθη οὔτε λόγῳ οὔτε νόμῳ κοιμίζεται, ἀλλʼ ἡ φύσις ἑκάστου καὶ φιλία πρὸς τὸν τελευτήσαντα τὸν τὸν add. Sauppe. ὁρισμὸν ἔχει τοῦ λυπεῖσθαι. ὅμως δὲ χρὴ θαρρεῖν καὶ τῆς λύπης παραιρεῖν παραιρεῖν Gesner: παραινεῖν codd. εἰς τὸ ἐνδεχόμενον, καὶ μεμνῆσθαι μὴ μόνον τοῦ θανάτου τῶν τετελευτηκότων, ἀλλὰ καὶ τῆς ἀρετῆς ἧς καταλελοίπασιν. 
42	εἰ εἰ Leopardi: οὐ codd. γὰρ θρήνων ἄξια πεπόνθασιν, ἀλλʼ ἐπαίνων μεγάλων πεποιήκασιν. εἰ δὲ γήρως θνητοῦ μὴ μετέσχον, ἀλλʼ εὐδοξίαν ἀγήρατον εἰλήφασιν, εὐδαίμονές τε γεγόνασι κατὰ πάντα. ὅσοι μὲν γὰρ αὐτῶν ἄπαιδες τετελευτήκασιν, οἱ παρὰ τῶν Ἑλλήνων ἔπαινοι παῖδες αὐτῶν ἀθάνατοι ἔσονται. ὅσοι δὲ παῖδας καταλελοίπασιν, ἡ τῆς πατρίδος εὔνοια ἐπίτροπος αὐτοῖς τῶν παίδων καταστήσεται. 
43	πρὸς δὲ τούτοις, εἰ μέν ἐστι τὸ ἀποθανεῖν ὅμοιον τῷ μὴ γενέσθαι, ἀπηλλαγμένοι εἰσὶ νόσων καὶ λύπης καὶ τῶν ἄλλων τῶν προσπιπτόντων εἰς τὸν ἀνθρώπινον βίον· εἰ δʼ ἔστιν αἴσθησις ἐν Ἅιδου καὶ ἐπιμέλεια παρὰ τοῦ δαιμονίου, ὥσπερ ὑπολαμβάνομεν, εἰκὸς εἰκὸς Toup: εἶναι vel εἴη codd. τοὺς ταῖς τιμαῖς τῶν θεῶν καταλυομέναις βοηθήσαντας πλείστης κηδεμονίας κηδεμονίας Ruhnken: ἐπιμελείας vel εὐδαιμονίας codd.: ἐπιμελείας καὶ κηδεμονίας Fuhr. ὑπὸ τοῦ δαιμονίου τυγχάνειν
