1	Column 1 τῶν μὲν λόγων τ ῶν μελ λόντων Col. 1 plerumque restituit Blass. ῥηθήσες θαι ἐπὶ τῷδε τῷ τάφῳ περί τε περί τε Cobet. Λεωσθένους τοῦ στ ρατη γοῦ καὶ περὶ τῶν ἄ λλων τῶν μετʼ ἐκείνου τετελ ευτηκότων ἐν τ ῷ πολ έμῳ, ὡς ἦσαν ἄν δρες ἀ γαθοί, μά ρτυς μάρτυς Buecheler. αὐτὸς ὁ χ ρόνος αὐτὸς ὁ χρόνος Kenyon. ὁ ς ωι τὰς πρ άξεις τὰς πράξεις Babington: τὰ ὅπλα Kenyon. ς ἀνθρω π ν πω κα ἑ ώρακε ωρ ἐν τῷ π αντὶ αἰῶ νι γ εγενη οὔτε ἄνδρας ἀμείνους τῶν τετελευτ ηκότων οὔτε πρ άξεις μεγαλ οπρεπεστ έρας. 
2	διὸ καὶ μάλιστα νῦν φοβοῦ μαι, νῦν φοβοῦμαι Jensen in add. (φοβοῦμαι iam Babington): πεφόβημαι Herwerden. μή μοι συμ βῇ τὸν λ όγον ἐλάττ ω φαίν εσθαι τῶν ἔρ γων τῶν γεγενη μέ νων. πλὴν κατʼ ἐκεῖ νό γε πάλιν θα ρρῶ ὅ τι τὰ ὑπʼ ἐμοῦ ἐ κ λει πόμενα ἐκλειπόμενα Sudhaus: παραλειπόμενα Sauppe. ὑμεῖς οἱ ἀκούοντες προσθήσετε· οὐ γὰρ ἐ ν τοῖς τυχοῦσιν οἱ λόγοι ῥηθήσονται, ἀλλʼ ἐν αὐτοῖς τοῖς μάρτυσι τῶν ἐκ είνοι ς Column 2 π επραγμένων. 
3	ἄξιον δέ ἐς τιν ἐπαινεῖν τ ὴν μὲν πό λιν ἡμῶν τ ῆς προαιρέ σεω ς ἕνεκεν, τὸ προε λέσθ αι ὅμοια καὶ ἔτι σε μνό τερα καὶ καλλίω τῶν πρότ ερον αὐτῇ πεπρα γμέ νων, τοὺς δὲ τετε λευ τηκότας τῆς ἀνδρείας τῆς ἐν τῷ πολέμῳ, τὸ μὴ καταισχῦναι τὰς τῶν προγόνων ἀρετάς, τὸν δὲ στρατηγὸν Λεωσθένη διὰ ἀμφότερα· τῆς τε γὰρ προαιρέσεως εἰσηγητὴς τῇ πόλει ἐγένετο, καὶ τῆς στρατείας ἡγεμὼν τοῖς πολίταις κατέστη. 
4	περὶ μὲν οὖν τῆς πόλεως διεξιέναι τὸ καθʼ ἕκαστον ὧν ὧν Blass olim: τῶν S, ret. Cobet. πρό τε ρον πᾶσαν τὴν Ἑλλά δα εὐεργέτηκεν εὐεργέτηκεν add. Blass olim: πεπραγμένων suppl. Cobet qui ἀνὰ post πρότερον add. οὔτε ὁ χρόνος ὁ παρὼν ἱκανός, οὔτε ὁ και ρὸς ἁρμόττων τῷ μα κρ ολογεῖν, οὔτε ῥᾴδι ον ἕνα ὄντα τοσαύ τας καὶ τηλικαύτας πρά ξεις ἐπ ελθεῖν ἐπελθεῖν Babington: ἀπελθεῖν S. καὶ μνη μο νεῦσαι· ἐπὶ κεφαλαί ου δ ὲ οὐκ ὀκνήσω εἰπεῖν περ ὶ αὐτῆς. 
5	ὥσπερ γὰρ ὁ ἥλιος πᾶσαν Column 3 τὴν οἰκουμ ένη ν ἐπέρχεται, τὰ ς μὲν Col. 3 plerumque restituit Babington. ὥρας διακρίνων εἰς τὸ π ρέπον εἰς τὸ πρέπον Blass. καὶ καλῶ ς πάντα καθ ιστάς, πάντα καθιστάς Cobet. τοῖς δὲ ς ώφροσι καὶ ἐπ ιεικέσι τ ῶν ἀνθρώπ ων ἐπιμ ελούμενος κ αὶ γεν έσεως καὶ τροφῆ ς καὶ καρπ ῶν κ αὶ τῶν ἄ λλων σώφροσι usque ad ἄλλων Blass. ἁ πά ντων τῶν εἰς τὸν β ίο ν χρησίμων, οὕτως καὶ ἡ πόλις ἡμῶν διατελε ῖ το ὺς μὲν κακοὺς κολάζο υσα, τοῖς δὲ δικαίοις β οηθοῦσα , τὸ δὲ ἴσον ἀν τί τῆς ἀδι κίας ἀδικίας Jensen: πλεονεξίας anon. ap. Babington. ἅπασιν ἀπονέμουσα, ἀπονέμουσα Kaibel: φυλάττουσα Blass. τ οῖς δὲ ἰδί οις κινδύνοις κα ὶ δαπάναι ς κοινὴν ἄδει αν τοῖς Ἕλλη σιν παρασκευ άζουσα. 
6	περὶ μὲν οὖ ν τῶν κοινῶ ν ἔργων τῆς πόλ εως ἔργων τῆς πόλεως Sauppe et Tell. ὥσπερ προεῖπον προεῖπον Blass. φρά σαι φράσαι Kayser. παρ αλείψω, παραλείψω Buecheler: αλιφω S. πε ρὶ δὲ Λεωσθέν ους καὶ τῶν ἄ λλων τοὺς λόγ ους ποιήσομ αι. νῦ ν δὲ πόθεν ἄρξωμα ι λέγων , λέγων Sauppe. ἢ τίνος πρῶτον μνησθῶ; πότερα περὶ τοῦ γένους αὐτῶν ἑκάστου διεξέλθω; 
7	ἀλλʼ εὔηθες εἶναι ὑπολαμβάνω· τὸ ν μὲν γὰρ τὸν μὲν γὰρ Schaefer. ἄλλους τινὰς ἀνθρώπους ἐγκωμιάζοντα, Column 4 οἳ πολλαχόθεν εἰς μίαν πόλιν συνεληλυθότες οἰκοῦσι γένος ἴδιον ἕκαστος συνεισενεγκάμενος, τοῦτον τοῦτον Cobet: τούτων S. μὲν δεῖ κατʼ ἄνδρα γενεαλογεῖν ἕκαστον· περὶ δὲ Ἀθηναίων ἀνδρῶν τοὺ ς λόγου ς ποιούμενον, ποιούμενον ποιούμενος Cobet. οἷς ἡ κοινὴ γένεσις α ὐτόχ θοσιν οὖσιν ἀνυπέρβλητ ον τὴν εὐγένειαν ἔχει, περίεργον ἡγοῦμαι εἶναι ἰδίᾳ τὰ γένη ἐγκωμιάζειν. 
8	ἀλλὰ πε ρὶ τῆς παιδείας αὐτῶν ἐπι μνη σθῶ, καὶ ὡς ἐν πολλῇ ς ωφρο σύνῃ παῖδες ὄντ ες ἐτρά φησαν καὶ ἐπαιδε ύθησαν ἐπαιδεύθησαν Babington. ὅπερ εἰώθασίν τινες ποι εῖν; τινες ποιεῖν Jensen (ποιεῖν iam Lightfoot): παιδεύειν Sauppe. ἀλλʼ οἶμαι π άντας εἰδέναι ὅτι τούτο υ ἕνεκα ἕνεκα Sauppe. τοὺ ς παῖδας παιδεύο μεν , παιδεύομεν Sauppe. ἵνα ἄνδρες ἀγαθοὶ γ ένων ται γένωνται Babington. · τοὺς δὲ γεγενημ ένους ἐν τῷ πολέμῳ ἄνδρ ας ὑπερβάλλοντας τῇ ἀ ρετῇ , πρόδηλόν ἐστιν ὅτι πα ῖδες ὄντες καλῶς ἐπαιδε ύθη σαν. 
9	ἁπλούστατον ο ὖν ἡ γοῦμαι εἶναι τὴν ἐν τῷ πολέμῳ διεξελθεῖν ἀρετήν, καὶ ὡς πολλῶν ἀγαθῶν αἴτιοι γεγένη ν ται τῇ πατρίδι καὶ τοῖς ἄλλοις Ἕλλησιν. ἄρξομαι δὲ πρῶτον ἀπὸ τοῦ στρατηγοῦ· καὶ γὰρ δίκαιον. 
10	Λεωσθένης γὰρ ὁρῶν τὴν Ἑλλάδα πᾶσαν τεταπεινωμένην καὶ Post καὶ add. ὥσπερ Kenyon. Column 5 ἐπτη χυ ῖαν, κατεφθαρμένην ὑπὸ τῶν δωροδοκούντων παρὰ Φι λίπ που καὶ Ἀλεξάνδρου κατὰ τῶν πατρίδων τῶν αὑτῶν, καὶ τ ὴν μὲν πόλιν ἡμῶν δεομέ νην δεομένην Babington, qui coll. 5 et 6 plerumque restituit. ἀνδρός, τὴν δʼ Ἑλλά δα πᾶ σαν πόλεως, ἥτις προστῆ ναι δυν ήσεται δυνήσεται Schaefer. τῆς ἡγεμονίας, ἐπέδ ωκεν ἐπέδωκεν Kayser: ἀπέδωκεν Babington. ἑαυτὸν μὲν τῇ πατρί δι, τὴν δὲ πόλιν τοῖς Ἕλλη σιν εἰς τὴν ἐλευθερίαν· 
11	καὶ ξενικὴν μὲν δύναμιν συ στησάμενος, τῆς δὲ πολιτικῆς ἡγεμὼν καταστάς, τοὺς πρώτους ἀντιταξαμένους τῇ τῶν Ἑλλήνων ἐλευθερίᾳ Βοιωτοὺς καὶ Μακεδόνας καὶ Εὐβοέας καὶ τοὺς ἄλλους συμμάχους αὐτῶν ἐνίκησε μαχόμενος ἐν τῇ Βοιωτίᾳ. 
12	ἐντεῦθεν δʼ ἐλθὼν εἰς Πύλας καὶ καταλαβὼν τὰς πα ρόδους, παρόδους Spengel. διʼ ὧν καὶ πρότερον ἐ πὶ τ οὺς Ἕλληνας οἱ βάρβαροι ἐ πο ρεύθησαν, τῆς μὲν ἐπὶ τὴν Ἑλλάδα πορείας Ἀντίπατρον ἐκώλυσεν, αὐτὸν δὲ κα ταλαβὼν ἐν τοῖς τόποις τού τοι ς καὶ μάχῃ νικήσας, ἐπολι όρ κει κατακλείσας εἰς Λαμίαν. 
13	Θετταλοὺς δὲ καὶ Φωκέας καὶ Αἰ τωλοὺς καὶ τοὺς ἄλλους ἅπαντας τοὺς ἐν τῷ τόπῳ συμμάχους ἐποιήσατο, καὶ ὧν Φίλιππος καὶ Ἀλέξανδρος ἀκόντων ἡγούμενοι ἐσεμνύνοντο, τούτων Λεωσθένης ἑκόντων τὴν ἡγεμονίαν ἔλαβεν. συνέβη δʼ αὐτῷ τῶν μὲν πραγμάτων ὧν προείλετο κρατῆσαι, Column 6 τῆς δὲ εἱ μαρ μένης οὐκ ἦν περιγενέ σθαι. 
14	δίκαιον δʼ ἐστὶν μὴ μ όνον ὧν ἔπραξεν Λεωσθέν ην ἀε ὶ ἀεὶ Jensen (sed in add.: καὶ) ζῶν Kenyon. χάριν ἔχειν αὐτῷ πρ ώτῳ, πρώτῳ Blass. ἀ λλὰ καὶ τῆς ὕστερον γενομέν ης μάχης μετὰ τ ὸν ἐκείνο υ ἐκείνου Muller. θάνατον, καὶ τῶν ἄλλων ἀγ αθῶν τῶν ἐν τῇ ς τρατείᾳ τ αύτῃ συμβάντων τοῖς Ἕλ λησιν· ἐπὶ γὰρ τοῖς ὑπὸ Λε ωσθένους τε θεῖσιν θεμελίοις οἰκοδομοῦσιν οἱ νῦν τὰς ὕστερον πράξεις. 
15	καὶ μηδεὶς ὑπολάβῃ με τῶν ἄλλων πολιτῶν μη δένα λόγον ποιεῖσθαι, ἀλλὰ ἀλλὰ Sauppe. Λεωσθένη μόν ον ἐγκω μιάζ ειν. ἐγκωμιάζειν Sauppe. συμβαίνει γὰρ τὸν Λε ωσθένους ἔπαινον ἐπὶ ταῖ ς μάχαις ἐγκώμιον τῶν ἄλ λων τῶν ἄλλων Jensen. πολιτῶν εἶναι· το ῦ μὲν γὰρ βουλεύεσθαι καλ ῶς ὁ στρα τηγὸς αἴτιος, τοῦ δὲ νι κᾶν μαχ ομένους οἱ κινδυν εύειν ἐθ έλοντες τοῖς σώμας ιν· ὥστ ε ὅταν ἐπαιν ῶ τὴν γ εγονυῖαν νίκην, ἅμα τ ῇ Λε ωσθένους ἡγεμονίᾳ καὶ τὴν τ ῶν ἄλλων ἀρετὴν ἐγκωμ ιάς ω. ἐγκωμιάσω Stahl: ἐγκωμιάζω Sauppe. 
16	τίς γὰρ οὐκ ἂν δικα ίως ἐπαινοίη τῶν πολιτῶ ν το ὺς ἐν τῷδε τῷ πολέμῳ τε λευτήσαντας, οἳ τὰς ἑα υτῶ ν ψυχὰς ἔδωκαν ὑπὲρ τῆ ς τῶ ν Ἑλλήνων ἐλευθερίας, φα νερωτάτην ἀπόδειξιν τ αύτ ην ἡγούμενοι εἶναι τοῦ βούλ εσθαι τῇ Ἑλλάδι τὴν ἐλε υθερ ίαν Column 7 περιθεῖναι, τὸ μαχομ ένους μαχομένους Sauppe: μαχόμενοι Babington. τελευτῆσαι ὑπὲρ αὐτῆ ς. 
17	μ έγα δʼ αὐτοῖς συνεβάλετ ο εἰ ς τὸ προθύμως ὑπὲρ τῆς Ἑλλά δος Col. 7 plerumque restituit Babington: sed Ἑλλάδος et προτέραν Sauppe. ἀγωνίσασθαι τὸ ἐν τῇ Βοιω τίᾳ τὴν μάχην τὴν π ροτέραν See above note. γενέσθαι. ἑώρων γὰ ρ τὴν μὲν π όλιν τῶν Θηβαίων οἰκτ ρῶς ἠφα νισμένην ἐξ ἀνθρώπων, τὴν δὲ ἀ κρόπολιν αὐτῆς φρουρου μένην ὑπὸ τῶν Μακεδόνων, τὰ δὲ σώματα τῶν ἐνοικούντων ἐξηνδραποδισμένα, τὴν δὲ χώραν ἄλλους διανεμομένους, ὥστε πρὸ ὀφθαλμῶν ὁρώμενα αὐτοῖς τὰ δεινὰ ἄοκνον π αρ εῖχε τόλμα ν εἰς τὸ κινδυνεύειν πρ οχείρως. 
18	ἀλλὰ μὴν τήν γε π ερὶ Π ύλας περὶ Πύλας Cobet. καὶ Λαμίαν μάχην γεν ομέν ην οὐχ ἧττον αὐτοῖς ἔνδο ξον γεν έσθαι συμβέβηκεν ἧς ἐν Βοιω τοῖς ἠγωνίσαντο, οὐ μόνον τῷ μαχο μένους νικᾶν Ἀντίπατρον καὶ τοὺς ς υμμάχους, ἀλλὰ καὶ τῷ τόπῳ τῷ ἐ νταυθοῖ γεγενῆσθαι τὴν μ άχην. ἀφικνούμενοι γὰρ οἱ Ἕλλη νες ἅπα ντες δὶς τοῦ ἐνιαυτοῦ εἰς τὴν Πυλ αίαν, θεωροὶ γενήσοντ αι τῶν ἔργων τῶν π επρα γμένων αὐτοῖς· ἅμα γὰρ εἰς τὸ ν τό πον ἁθροισθήσονται καὶ τῆ ς το ύτων ἀρετῆς μνησθήσοντ αι. 
19	ο ὐδένες γὰρ πώποτε τῶν γεγονότων οὔτε περὶ καλλιόνων οὔτε πρὸς ἰσχυροτέρους οὔτε μετʼ ἐλαττόνων ἠγωνίσαντο, τὴν ἀρετὴν ἰσχὺν καὶ τὴν ἀνδρείαν πλῆθος, ἀλλʼ οὐ τὸν πολὺν ἀριθμὸν τῶν σωμάτων εἶναι κρίνοντες. καὶ τὴν μὲν ἐλευθερίαν εἰς τὸ κοινὸν πᾶσιν κατέθεσαν, τὴν δʼ εὐδοξίαν τὴν τὴν add. Blass. ἀπὸ τῶν πράξεων ἴδιον στέφανον τῇ πατρίδ ι περι έθηκαν. περιέθηκαν Sauppe. 
20	ἄξιον Column 8 τοίνυν συλλογίσασθαι καὶ τί ἂν συμβῆναι νομίζομεν νομίζομεν Kayser: νομίζοιμεν S. μὴ κατὰ τρόπον τούτων ἀγωνισαμένων. ἆρʼ οὐκ ἂν ἑνὸς μὲν δεσπότου τὴν οἰκουμένην ὑπήκοον ἅπασαν εἶναι, νόμῳ δὲ τῷ τούτου τρόπῳ ἐξ ἀνάγκης χρῆσθαι τὴν Ἑλλάδα; συνελόντα δʼ εἰπεῖν, τὴν Μακεδόνων ὑπερηφανίαν καὶ μὴ τὴν τοῦ δικαίου δύναμιν ἰσχύειν παρʼ ἑκάστοις, ὥστε μήτε γυναικῶν μήτε παρθένων μήτε παίδων ὕβρεις ἀνεκλείπτους ἀνεκλείπτους plerique edd., qui lacunam indicant: ἂν ἐκλείπτους (verbum ignotum) S: post ἑκάστοις add. μὴ Colin. ἑκάστοις καθεστάναι. 
21	φανερὸν δʼ ἐξ ὧν ἀναγκαζόμεθα καὶ νῦν ἔτι ἔτι Kayser: ἐστι Cobet: ἐᾶν Caffiaux. · θυσίας μὲν ἀνθρώποις γ ιγνο μένας γιγνομένας Cobet. ἐφορᾶν, ἀγάλμ ατα δὲ καὶ βωμοὺς καὶ ναοὺς τοῖ ς μὲν θεοῖς ἀμελῶς, τοῖς δὲ ἀνθρώ ποις ἐπιμελῶς συντελούμενα, καὶ τοὺς τού των τούτων Cobet. οἰκέτας ὥσπερ ἥρωας τιμᾶν ἡμᾶς ἀναγκαζομένους. 
22	ὅπου δὲ τὰ πρὸς τοὺς τοὺς add. Cobet. θεοὺς ὅσια διὰ τὴν Μακεδόνων τόλμαν ἀνῄρηται, τί τὰ πρὸς τοὺς ἀνθρώπους Post ἀνθρώπους add. δίκαια Fritzsche. χρὴ νομίζειν; ἆρʼ οὐκ ἂν παντελῶς καταλελύσθαι; ὥστε ὅσῳ δεινότερα τὰ προ ς δοκώμενʼ ἂν γενέσθαι κρίνομεν, κρίνομεν Kayser: κρίνοιμεν S. τοσούτῳ μειζόνων ἐπαίνων τοὺς τετελευτηκότας ἀξίους χρὴ νομίζειν. 
23	οὐδεμία γὰρ στρατεία τὴν τῶν τῶν add. Babington. στρατευομένων ἀρετὴν ἐνεφάνισεν μᾶλλον τῆς νῦν γεγενημένης, ἐν ᾗ γε παρατάττεσθαι μὲν ὁσημέραι ἀναγκαῖον ἦ ν , πλείους δὲ μάχας ἠγωνίσθαι διὰ μιᾶς στρατ είας ἢ τοὺς Column 9 ἄλλους πάντας πληγὰς πληγὰς del. Cobet. λαμβάνειν ἐν τῷ παρεληλυθότι χρόνῳ, χειμώνων δʼ ὑπερβολὰς καὶ τῶν καθʼ ἡμέ ρα ν ἀναγκαίων ἐνδείας τος αύ τας καὶ τηλικαύτας οὕτως ἐγ κρατῶς ὑπομεμ ε νηκένα ι, ὥς τε καὶ τῷ λόγῳ χαλεπὸν εἶν αι φράσαι. 
24	τὸν δὴ τοιαύτας καρτερίας ἀόκνως ὑπομεῖναι τοὺ ς πολίτας προτρεψάμενον Λεωσθένη, καὶ τοὺς τῷ τοιούτῳ στρατηγῷ προθύμως συναγωνιστὰς σφᾶς αὐτοὺς παρασχόντας, ἆρʼ οὐ διὰ τὴν τῆς ἀρετῆς ἀπόδειξιν εὐτυχεῖς μᾶλλον ἢ διὰ τὴν τοῦ ζῆν ἀπόλειψιν ἀτυχεῖς νομιστέον; οἵτινες θνητοῦ σώματος ἀθάνατον δόξαν ἐκτήσαντο, καὶ διὰ τὴν ἰδίαν ἀρετὴν τὴν κοινὴν ἐλ ευ θερίαν τοῖς Ἕλλησιν ἐβεβαίωσαν. 
25	φέρει γὰρ πᾶσαν εὐδαιμονίαν Intercidisse aliquid videtur: ante πᾶσαν add. οὐδὲν Fritzsche: alii alia. ἄνευ τῆς αὐτονομίας. ο ὐ γὰρ ἀνδρὸς ἀπειλήν, ἀλλὰ νόμου φωνὴν κυριεύειν δεῖ τῶν εὐδαιμόνων, οὐδʼ αἰτίαν φοβερὰν εἶναι τοῖς ἐλευθέροις, ἀλλʼ ἔλεγχον, οὐδʼ ἐπὶ τοῖς κολακεύουσιν τοὺς δυνάστας καὶ διαβάλλουσιν τοὺ ς πολίτας τὸ τῶν πολιτῶν ἀσφαλές, ἀλλʼ ἐπὶ τῇ τῶν νόμων πίστει γενέσθαι. 
26	ὑπὲρ ὧν ἁπάντων οὗτοι πόνους πόνων διαδόχους ποιούμενοι, καὶ τοῖς καθʼ ἡμέραν κινδύνοις τοὺ ς εἰς τὴν ἅπαντα χρόνον φόβους τῶν πολιτῶν καὶ τῶν Ἑλλήνων παραιρούμενοι, τὸ ζῆν ἀνήλωσαν εἰς τὸ τοὺς ἄλλους καλῶς ζῆν. 
27	διὰ τούτους πατέρες ἔνδοξοι, μητέρες περίβλε π τοι τοῖς πολίταις γεγόνασι, ἀδελφαὶ γάμων τῶν προσηκόντων ἐννόμως τετυχήκασι καὶ τεύξονται, παῖδες ἐφόδιον εἰς τὴν πρὸς τὸν δῆμον ε ὔνοι αν εὔνοιαν Cobet. τὴν τῶν οὐκ ἀπολωλότων Column 10 ἀρετήν, οὐ γὰρ θεμιτὸν τούτου τοῦ ὀνόματος τυχεῖν τοὺς οὕτως ὑπὲρ καλῶν τὸ ν βίον ἐκλιπόντας, ἀλλὰ τῶν τὸ ζῆν ε ἰς αἰώνιον τάξιν μετηλλα χό των ἕξουσιν. 
28	εἰ γὰρ ὁ τοῖ ς ὁ τοῖς Cobet. ἄλλοις ὢν ἀνιαρ ότ ατος ἀνιαρότατος Babington. θάνατος τούτοις ἀρχηγὸς μεγάλων ἀγαθῶν γέγονε, πῶς τούτους ο ὐ κ εὐτυχεῖς κρίνειν δίκαιον, ἢ πῶς ἐκλελοιπέναι τὸν βίον, ἀλλʼ οὐκ ἐξ ἀρχῆς γεγονέναι καλλίω γένεσιν τῆς πρώτης ὑπαρξάσης; τότε μὲν γὰρ παῖδες ὄντες ἄφρονες ἦσαν, νῦν δʼ ἄνδρες ἀγαθοὶ γεγόνασιν. 
29	καὶ τότε μὲν ἐν πολλῷ ἐν πολλῷ Babington: πολλῶν S. χρόνῳ καὶ διὰ πολλῶν κινδύνων τὴν ἀρετὴν ἀπέδειξαν· νῦν δʼ ἀπὸ ταύτης ἀρξα μένους ὑπάρχει ἀρξαμένους ὑπάρχει Kenyon: αξαθαι S: ᾁξαντας ἦν Jensen in add.: ὑπάρχει εὐθὺς Cobet. γνωρίμους πᾶσι καὶ μνημονευτοὺς διὰ ἀνδραγαθίαν γεγονέναι. 
30	τίς γὰρ γὰρ add. Cobet. κα ι ρὸς ἐν ᾧ τῆς τούτων ἀρετῆς οὐ μνημονεύσομεν; τίς τόπος ἐν ᾧ ζήλου καὶ τῶν ἐντιμοτάτων ἐπαίνων τυγχάνοντας οὐκ ὀψόμεθα; πότερον οὐκ ἐν τοῖς τῆς πόλεως ἀγαθοῖς; ἀλλὰ τὰ διὰ τούτους γεγονότα τ ίνας ἄλλους ἢ τούτους ἐπαινεῖσθ αι καὶ μνήμης τυγχάνειν ποιήσει; ἀλλʼ οὐκ ἐν ταῖς ἰδίαις εὐπραξίαις; ἀλλʼ ἐν τῇ τούτων ἀρετῇ βεβαίως αὐτῶν ἀπολαύσομεν. 
31	παρὰ ποίᾳ δὲ τῶν ἡλικιῶν οὐ μακαριστοὶ Column 11 γενήσο νται; πότερον οὐ πα ρὰ Col. 11 plerumque restituit Blass. τοῖς π ρεσβυτέροις, πρεσβυτέροις Cobet: γεραιτέροις Sauppe. οἳ ἄ φοβον ἄ ξειν τὸν λοιπὸν βίον κα ὶ ἐν τῷ ἀσφαλεῖ γεγενῆς θαι νομίζουσι νομίζουσι Jensen: ἡγήσονται Blass. διὰ τούτ ους; ἀλλʼ οὐ παρὰ τοῖς ἡλικιώτ αις; τελευτὴ φ καλῶς ὠ παρὰ πο αι γεγον ; ἀλλʼ οὐ παρὰ τοῖς νεωτέρο ις καὶ παισίν; 
32	ἔπει τα οὐ τὸν θάνατον ζηλώσου σιν αὐτ ῶν, καὶ αὐτοὶ σπου δάσουσιν μιμεῖσθαι ὡς πα ράδειγμ α τὸν τούτων βίον, ἀνθʼ οὗ τὴν ἀ ρετὴν καταλελοί πασι; 
33	οὐκ οῦν ἄξιον εὐδαιμονί ζειν αὐ τοὺς ἐπὶ τοσαύτῃ τι μῇ; ἢ τίνε ς φοι λει Ἑλλην τῶν πε παρὰ πο τῆς Φρυγῶν κ ρατησάσης στρα τείας ἐγ κωμιασθήσεται; δὲ τῆς ἐλ τάτοις ε ἅπασιν κ αὶ λόγοις καὶ ᾠ δαῖς καὶ λόγοις καὶ ὠδαῖς Cobet. ἐπα ιν 
34	ἀμφό τερα γὰρ ε περὶ Λεως θένους καὶ τῶν τ ελευτησάντων ἐν τῷ πολ έμῳ. ἀμφότερα usque ad πολέμῳ Cobet. εἰ μὲν γὰρ ἡδονῆς ἕν εκεν μνημονεύ ουσιν τὰς τ οιαύτας καρ τερίας, τί γέ νοιτʼ ἂν τοῖς Ἕλ λησιν ἥδι ον ἢ ἔπαινος τῶν τὴν ἐλευθερί αν παρασκευα σάντων ἀ πὸ τῶν Μακεδό νων; εἰ μὲν γὰρ usque ad Μακεδόνων post Cobet et alios Blass. εἰ δὲ ὠφελείας ἕνε κεν ὠφελείας ἕνεκεν Babington. ἡ τοια ύτη μνήμη μνήμη Cobet. Column 12 γίγνεται, τίς ἂν λόγος ὠφελήσειεν μᾶλλον τὰς τῶν ἀκουσόντων ἀκουσόντων ἀκουόντων Sauppe. ψυχὰς τοῦ τὴν ἀρετὴν ἐγκωμιάσοντος ἐγκωμιάσοντος ἐγκωμιάζοντος Sauppe. καὶ τοὺς ἀγαθοὺς ἄνδρας; 
