4.1	ἰδοὺ ἐγὼ τῇ τε ἀτυχίᾳ, ἣν οὐ δικαίως αἰτιῶμαι, ὡς οὗτοί φασιν, ἑκὼν ἐμαυτὸν ἐγχειρίζω, τῇ τε τούτων ἔχθρᾳ, δεδιὼς μὲν τὸ μέγεθος τῆς διαβολῆς αὐτῶν, πιστεύων δὲ τῇ ὑμετέρᾳ γνώμῃ τῇ τε ἀληθείᾳ τῶν ἐξ ἐμοῦ πραχθέντων. ἀποστερούμενος δὲ ὑπʼ αὐτῶν μηδὲ τὰς παρούσας ἀτυχίας ἀνακλαύσασθαι πρὸς ὑμᾶς, ἀπορῶ εἰς ἥντινα ἄλλην σωτηρίαν χρή με καταφυγεῖν. 
4.2	καινότατα γὰρ δή, εἰ χρὴ καινότατα μᾶλλον ἢ κακουργότατα εἰπεῖν, διαβάλλουσί με. κατήγοροι γὰρ καὶ τιμωροὶ φόνου προσποιούμενοι εἶναι, ὑπεραπολογούμενοι τῆς ἀληθοῦς ὑποψίας ἁπάσης, διὰ τὴν ἀπορίαν τοῦ ἀποκτείναντος αὐτόν, ἐμὲ φονέα φασὶν εἶναι· δρῶντες δὲ τἀναντία ὧν προστέτακται αὐτοῖς, φανερὸν ὅτι ἀδίκως ἐμὲ μᾶλλον ἀποκτεῖναι ζητοῦσιν ἢ τὸν φονέα τιμωρεῖσθαι. 
4.3	ἐμὲ δὲ προσῆκεν οὐδὲν ἄλλο ἢ πρὸς τὴν μαρτυρίαν τοῦ ἀκολούθου ἀπολογηθῆναι· οὐ γὰρ μηνυτὴς οὐδʼ ἐλεγκτὴρ τῶν ἀποκτεινάντων εἰμί, ἀλλὰ διωκόμενος ἀποκρίνομαι. ὅμως δὲ περιεργαστέον, ἵνα ἐκ παντὸς τρόπου τούτους τε ἐπιβουλεύοντάς μοι ἐμαυτόν τε ἀπολυόμενον ἐπιδείξω τῆς ὑποψίας. 
4.4	τὴν μὲν οὖν ἀτυχίαν ᾗ με διαβάλλουσιν, εἰς εὐτυχίαν αἰτοῦμαι μεταστῆναι· ἀξιῶ δʼ ὑμᾶς ἀπολύσαντάς με μακαρίσαι μᾶλλον ἢ καταλαβόντας ἐλεῆσαι. φασὶ δὲ τῶν μὲν ἐντυχόντων παιομένοις αὐτοῖς οὐδένα ὅντινα οὐκ εἰκότερον εἶναι σαφῶς πυθόμενον τοὺς διαφθείραντας αὐτοὺς εἰς οἶκον ἀγγεῖλαι ἢ ἀπολιπόντα οἴχεσθαι. 
4.5	ἐγὼ δὲ οὐδένα οὕτω θερμὸν καὶ ἀνδρεῖον ἄνθρωπον εἶναι δοκῶ, ὅντινα οὐκ ἂν ἀωρὶ τῶν νυκτῶν τῶν νυκτῶν Ν: τῆς νυκτὸς Α. νεκροῖς ἀσπαίρουσι συντυχόντα πάλιν ὑποστρέψαντα φεύγειν μᾶλλον ἢ πυνθανόμενον τοὺς κακούργους περὶ τῆς ψυχῆς κινδυνεῦσαι. τούτων δὲ μᾶλλον ἃ εἰκὸς ἦν δρασάντων, οἱ μὲν ἐπὶ τοῖς ἱματίοις διαφθείραντες αὐτοὺς οὐκ ἂν ἔτι εἰκότως ἀφίοιντο, ἐγὼ δὲ ἀπήλλαγμαι τῆς ὑποψίας. 
4.6	εἰ δὲ ἐκηρύσσοντο ἢ μὴ ἄλλοι τινὲς κακοῦργοι ἅμα τῷ τούτων φόνῳ, τίς οἶδεν; οὐδενὶ γὰρ ἐπιμελὲς ἦν σκοπεῖν ταῦτα. ἀφανοῦς δὲ ὄντος τοῦ κηρύγματος, οὐδὲ ὑπὸ τούτων τῶν κακούργων ἄπιστον διαφθαρῆναι αὐτόν. 
4.7	τοῦ δὲ θεράποντος πῶς χρὴ πιστοτέραν τὴν μαρτυρίαν ἢ τῶν ἐλευθέρων ἡγεῖσθαι; οἱ μὲν γὰρ ἀτιμοῦνταί τε καὶ χρήμασι ζημιοῦνται, ἐὰν μὴ τἀληθῆ δοκῶσι μαρτυρῆσαι· ὁ δὲ οὐκ ἔλεγχον παρασχὼν οὐδὲ βάσανον—ποῦ ποῦ Reiske: οὐ Α: τι οὐ Ν pr., τινα οὐ Ν corr. 2 δίκην δώσει; ἢ τίς ἢ τίς Reiske: εἴ τις codd. ἔλεγχος ἔσται; ἀκινδύνως τε οὗτός γε μέλλων μαρτυρεῖν, οὐδὲν θαυμαστὸν ἔπαθεν ὑπὸ τῶν κυρίων ἐχθρῶν μοι ὄντων πεισθεὶς καταψεύδεσθαί μου· ἐγώ τε ἀνόσιʼ ἂν πάσχοιμι, εἰ μὴ πιστῶς καταμαρτυρηθεὶς διαφθαρείην ὑφʼ ὑμῶν. 
4.8	μὴ παραγενέσθαι δέ με τῷ φόνῳ ἀπιστότερον ἢ παραγενέσθαι φασὶν εἶναι. ἐγὼ δʼ οὐκ ἐκ τῶν εἰκότων ἀλλʼ ἔργῳ δηλώσω οὐ παραγενόμενος. ὁπόσοι γὰρ δοῦλοί μοι ἢ δοῦλαί εἰσι, πάντας παραδίδωμι βασανίσαι· καὶ ἐὰν μὴ φανῶ ταύτῃ τῇ νυκτὶ ἐν οἴκῳ καθεύδων ἢ ἐξελθών ποι, ποι Reiske: που codd. ὁμολογῶ φονεὺς εἶναι. ἡ δὲ νὺξ οὐκ ἄσημος· τοῖς γὰρ Διιπολείοις ὁ ἀνὴρ ἀπέθανε. 
4.9	περὶ δὲ τῆς εὐδαιμονίας, ἧς ἕνεκα τρέμοντά μέ φασιν εἰκότως ἀποκτεῖναι αὐτόν, πολὺ τἀναντία ἐστί. τοῖς μὲν γὰρ ἀτυχοῦσι νεωτερίζειν ἀτυχοῦσι νεωτερίζειν Ald.: ἀτυχοῦσιν ἑταιρίζειν codd. συμφέρει· ἐκ γὰρ τῶν μεταβολῶν ἐπίδοξος ἡ δυσπραγία μεταβάλλειν αὐτῶν ἐστι· τοῖς δʼ εὐτυχοῦσιν ἀτρεμίζειν καὶ φυλάσσειν τὴν παροῦσαν εὐπραγίαν. μεθισταμένων γὰρ τῶν πραγμάτων δυστυχεῖς ἐξ εὐτυχούντων καθίστανται. 
4.10	ἐκ δὲ τῶν εἰκότων προσποιούμενοί με ἐλέγχειν, οὐκ εἰκότως ἀλλʼ ὄντως φονέα μέ φασι τοῦ ἀνδρὸς εἶναι. τὰ δὲ εἰκότα ἄλλα πρὸς ἐμοῦ μᾶλλον ἀποδέδεικται ὄντα. ὅ τε γὰρ καταμαρτυρῶν μου ἄπιστος ἐλήλεγκται ὤν, ὅ τε ἔλεγχος οὐκ ἔστι· τά τε τεκμήρια ἐμά, οὐ τούτων τούτων Jernstedt: τούτου codd. ὄντα ἐδήλωσα· τά τε ἴχνη τοῦ φόνου οὐκ εἰς ἐμὲ φέροντα, ἀλλʼ εἰς τοὺς ἀπολυομένους ἀποδέδεικται ὑπʼ αὐτῶν. πάντων δὲ τῶν κατηγορηθέντων ἀπίστων ἐλεγχθέντων, οὐκ ἐὰν ἀποφύγω οὐκ ἔστιν ἐξ ὧν ἐλεγχθήσονται οἱ κακουργοῦντες, ἀλλʼ ἐὰν καταληφθῶ, καταληφθῶ Spengel: ἐλεγχθῶ codd. οὐδεμία ἀπολογία τοῖς διωκομένοις ἀρκοῦσά ἐστιν. 
4.11	οὕτω δὲ ἀδίκως διώκοντές με, αὐτοὶ μὲν ἀνοσίως ἀποκτεῖναι ζητοῦντες καθαροί φασιν εἶναι, ἐμὲ δέ, ὃς εὐσεβεῖν ὑμᾶς πείθω, ἀνόσια δρᾶν λέγουσιν. ἐγὼ δὲ καθαρὸς ὢν πάντων τῶν ἐγκλημάτων ὑπὲρ μὲν μὲν add. Bekker. ἐμαυτοῦ ἐπισκήπτω αἰδεῖσθαι τὴν τῶν μηδὲν ἀδικούντων εὐσέβειαν, ὑπὲρ δὲ τοῦ ἀποθανόντος ἀναμιμνῄσκων τὴν ποινὴν παραινῶ ὑμῖν μὴ τὸν ἀναίτιον καταλαβόντας τὸν αἴτιον ἀφεῖναι· ἀποθανόντος γὰρ ἐμοῦ οὐδεὶς ἔτι τὸν αἴτιον ζητήσει. 
4.12	ταῦτα οὖν σεβόμενοι ὁσίως καὶ δικαίως ἀπολύετέ με, καὶ μὴ μετανοήσαντες τὴν ἁμαρτίαν γνῶτε· ἀνίατος γὰρ ἡ μετάνοια τῶν τοιούτων ἐστίν. 
