1.1	ὁπόσα μὲν τῶν πραγμάτων ὑπὸ τῶν ἐπιτυχόντων ἐπιβουλεύεται, οὐ χαλεπὰ ἐλέγχεσθαί ἐστιν· ἂν δʼ οἱ ἱκανῶς μὲν πεφυκότες, ἔμπειροι δὲ τῶν πραγμάτων ὄντες, ἐν δὲ τούτῳ τῆς ἡλικίας καθεστῶτες ἐν ᾧ κράτιστοι φρονεῖν αὑτῶν εἰσι, πράσσωσι, χαλεποὶ καὶ γνωσθῆναι καὶ ἐλεγχθῆναί ἐλεγχθῆναι Kayser: δειχθῆναι codd. 
1.2	εἰσι· διὰ γὰρ τὸ μέγεθος τοῦ κινδύνου ἐκ πολλοῦ τὴν ἀσφάλειαν ὧν ἐπιβουλεύουσι σκοποῦντες, οὐ πρότερον ἐπιχειροῦσιν ἢ πάσης ὑποψίας φυλακὴν ποιήσωνται. γιγνώσκοντας οὖν ὑμᾶς χρὴ ταῦτα, κἂν ὁτιοῦν εἰκὸς παραλάβητε, σφόδρα πιστεύειν αὐτῷ. ἡμεῖς δʼ οἱ ἐπεξερχόμενοι τὸν φόνον οὐ τὸν αἴτιον ἀφέντες τὸν ἀναίτιον διώκομεν· 
1.3	σαφῶς γὰρ οἴδαμεν ὅτι πάσης τῆς πόλεως μιαινομένης ὑπʼ αὐτοῦ, ἕως ἂν διωχθῇ, τό τʼ ἀσέβημα ἡμέτερον γίγνεται, τῆς θʼ ὑμετέρας ἁμαρτίας ἡ ποινὴ εἰς ἡμᾶς τοὺς μὴ δικαίως διώκοντας ἀναχωρεῖ. ἅπαντος δὲ τοῦ μιάσματος ἀναχωροῦντος εἰς ἡμᾶς, ὡς ἂν δυνώμεθα σαφέστατα ἐξ ὧν γιγνώσκομεν πειρασόμεθα ὑμῖν δηλοῦν ὡς ἀπέκτεινε τὸν ἄνδρα. 
1.4	Οὔτε γὰρ κακούργους εἰκὸς ἀποκτεῖναι τὸν ἄνθρωπον οὔτε ... ἄνθρωπον add. Ald. · οὐδεὶς γὰρ ἂν τὸν ἔσχατον κίνδυνον περὶ τῆς ψυχῆς κινδυνεύων ἑτοίμην καὶ κατειργασμένην τὴν ὠφέλειαν ἀφῆκεν· ἔχοντες γὰρ [ἂν] ἂν secl. Reiske. τὰ ἱμάτια ηὑρέθησαν. οὐ μὴν οὐδὲ παροινήσας οὐδεὶς διέφθειρεν αὐτόν· ἐγιγνώσκετο γὰρ ἂν ὑπὸ τῶν συμποτῶν. οὐδὲ μὴν οὐδʼ ἐκ λοιδορίας· οὐ γὰρ ἂν ἂν add. Dobree. cf. d, 5. ἀωρὶ τῶν νυκτῶν οὐδʼ ἐν ἐρημίᾳ ἐλοιδοροῦντο. οὐδὲ μὴν ἄλλου στοχαζόμενος ἔτυχε τούτου· οὐ γὰρ ἂν σὺν τῷ ἀκολούθῳ διέφθειρεν αὐτόν. 
1.5	ἀπολυομένης δὲ τῆς ὑποψίας ἁπάσης αὐτὸς ὁ θάνατος ἐξ ἐπιβουλῆς ἀποθανόντα μηνύει αὐτόν. ἐπιθέσθαι δὲ τίνα μᾶλλον εἰκός ἐστιν ἢ τὸν μεγάλα μὲν κακὰ προπεπονθότα, ἔτι δὲ μείζονα ἐπίδοξον ὄντα πάσχειν; ἔστι δʼ ὁ διωκόμενος οὗτος· ἐκ παλαιοῦ γὰρ ἐχθρὸς ὢν αὐτοῦ πολλὰς μὲν καὶ μεγάλας γραφὰς διώξας οὐδεμίαν εἷλεν, 
1.6	ἔτι δὲ μείζους καὶ πλείους διωχθεὶς οὐδεπώποτʼ ἀποφυγὼν ἱκανὸν μέρος τῶν ὄντων ἀποβέβληκε, τὰ δʼ ἄγχιστα ἱερῶν κλοπῆς δυοῖν ταλάντοιν γεγραμμένος ὑπʼ αὐτοῦ, συνειδὼς μὲν αὑτῷ τὸ ἀδίκημα, ἔμπειρος δʼ ὢν τῆς τούτου δυνάμεως, μνησικακῶν δὲ τῶν ἔμπροσθεν, εἰκότως μὲν ἐπεβούλευσεν, εἰκότως δʼ ἀμυνόμενος τὴν ἔχθραν ἀπέκτεινε τὸν ἄνδρα. 
1.7	ἥ τε γὰρ ἐπιθυμία τῆς τιμωρίας ἀμνήμονα τῶν κινδύνων καθίστη αὐτόν, ὅ τε φόβος τῶν ἐπιφερομένων κακῶν ἐκπλήσσων θερμότερον ἐπιχειρεῖν ἐπῇρεν. ἤλπιζέ τε τάδε μὲν δράσας καὶ λήσειν ἀποκτείνας αὐτὸν καὶ ἀποφεύξεσθαι τὴν γραφήν· οὐδὲ οὐδὲ Reiske: οὔτε codd. γὰρ ἐπεξιέναι οὐδένα, ἀλλʼ ἐρήμην αὐτὴν ἔσεσθαι· 
1.8	εἴ τε καὶ ἁλοίη, τιμωρησαμένῳ κάλλιον ἔδοξεν αὐτῷ ταῦτα πάσχειν, ἢ ἀνάνδρως μηδὲν ἀντιδράσαντα ὑπὸ τῆς γραφῆς διαφθαρῆναι. σαφῶς δʼ ᾔδει ἁλωσόμενος αὐτήν· οὐ γὰρ ἂν τόνδε τὸν ἀγῶνα ἐνόμισεν ἀσφαλέστερον εἶναι. 
1.9	τὰ μὲν βιασάμενα ταῦτά ἐστιν ἀσεβῆσαι αὐτόν. μάρτυρες δʼ εἰ μὲν πολλοὶ παρεγένοντο, πολλοὺς ἂν παρεσχόμεθα· ἑνὸς δὲ τοῦ ἀκολούθου παραγενομένου, οἳ τούτου ἤκουον μαρτυρήσουσιν. ἔμπνους γὰρ ἔτι ἀρθείς, ἀνακρινόμενος ὑφʼ ἡμῶν, τοῦτον μόνον ἔφη γνῶναι τῶν παιόντων παιόντων cf. Bekker, coll. δ, 4· παρόντων codd. αὐτούς. ἐξελεγχόμενος δʼ ὑπό τε τῶν εἰκότων ὑπό τε τῶν παραγενομένων, οὐδενὶ τρόπῳ οὔτε δικαίως οὔτε συμφερόντως ἀπολύοιτʼ ἂν ὑφʼ ὑμῶν. 
1.10	οἵ τε γὰρ ἐπιβουλεύοντες ἀνεξέλεγκτοι ἂν εἶεν, εἰ μήθʼ ὑπὸ τῶν παραγενομένων μήθʼ ὑπὸ τῶν εἰκότων ἐξελέγχονται· ἀσύμφορόν θʼ ὑμῖν ἐστὶ τόνδε μιαρὸν καὶ ἄναγνον ὄντα εἴς τε τε add. Blass. τὰ τεμένη τῶν θεῶν εἰσιόντα μιαίνειν τὴν ἁγνείαν αὐτῶν, ἐπί τε τὰς αὐτὰς τραπέζας ἰόντα συγκαταπιμπλάναι τοὺς ἀναιτίους· ἐκ γὰρ τούτων αἵ τʼ ἀφορίαι γίγνονται δυστυχεῖς θʼ αἱ πράξεις καθίστανται. 
1.11	οἰκείαν οὖν χρὴ τὴν τιμωρίαν ἡγησαμένους, αὐτῷ τούτῳ τὰ τούτου ἀσεβήματα ἀναθέντας, ἰδίαν μὲν τὴν συμφοράν, καθαρὰν δὲ τὴν πόλιν καταστῆσαι. 
2.1	 οὔ μοι δοκῶ ἁμαρτάνειν ἀτυχέστατον ἐμαυτὸν ἡγούμενος εἶναι τῶν πάντων ἀνθρώπων. τῶν μὲν γὰρ ἄλλων οἱ δυστυχοῦντες, ὁπόταν μὲν ὑπὸ χειμῶνος πονῶσιν, εὐδίας γενομένης παύονται· ὅταν δὲ νοσήσωσιν, ὑγιεῖς γενόμενοι σῴζονται· ἐὰν δέ τις ἄλλη συμφορὰ καταλαμβάνῃ αὐτούς, τὰ ἐναντία ἐπιγιγνόμενα ὀνίνησιν. 
2.2	ἐμοὶ δὲ ζῶν τε ἅνθρωπος ἀνατροπεὺς τοῦ οἴκου ἐγένετο, ἀποθανών τε, κἂν ἀποφύγω, ἱκανὰς λύπας καὶ φροντίδας προσβέβληκεν. εἰς τοῦτο γὰρ βαρυδαιμονίας ἥκω ὥστε οὐκ ἀρκοῦν μοί ἐστιν ἐμαυτὸν ὅσιον καὶ δίκαιον παρέχοντα μὴ διαφθαρῆναι, ἀλλὰ κἂν μὴ τὸν ἀποκτείναντα εὑρὼν ἐξελέγξω, ὃν οἱ τιμωροῦντες αὐτῷ ἀδύνατοι εὑρεῖν εἰσιν, αὐτὸς καταδοχθεὶς φονεὺς εἶναι ἀνοσίως ἁλώσομαι. 
2.3	καὶ ἐμὲ ὡς δεινὸν μὲν παγχάλεπόν φασιν ἐλέγχεσθαι εἶναι, ὡς δʼ ἠλίθιον ἐξ αὐτῶν ὧν ἔπραξα φανερὸν εἶναι ἐργασάμενον τὸ ἔργον. εἰ γὰρ νῦν διὰ τῆς ἔχθρας τὸ μέγεθος εἰκότως ὑφʼ ὑμῶν καταδοκοῦμαι, πρὶν ἐργάσασθαι εἰκότερον ἦν προειδότα προειδότα Kayser: τὸν εἰδότα codd. τὴν νῦν ὑποψίαν εἰς ἐμὲ ἰοῦσαν, ἰοῦσαν Reiske: οὖσαν codd. καὶ τῶν ἄλλων εἴ τινα ἔγνων ἐπιβουλεύοντα αὐτῷ, διακωλύειν μᾶλλον ἢ αὐτὸν ἐργασάμενον εἰς ἑκουσίους καὶ προδήλους ὑποψίας ἐμπεσεῖν· ἔκ τε γὰρ αὐτοῦ τοῦ ἔργου φανερὸς γενόμενος ἀπωλλύμην, λαθών τε σαφῶς ᾔδη τήνδε τὴν ὑποψίαν εἰς ἐμὲ ἰοῦσαν. 
2.4	ἄθλια μὲν οὖν πάσχω μὴ ἀπολογεῖσθαι μόνον βιαζόμενος, ἀλλὰ καὶ τοὺς ἀποκτείναντας φανεροὺς καταστῆσαι· ὅμως δὲ καὶ τοῦτο ἐπιχειρητέον· οὐδὲν γὰρ πικρότερον τῆς ἀνάγκης ἔοικεν εἶναι. ἔχω δὲ οὐδαμῶς ἄλλως ἐλέγχειν ἢ ἐξ ὧν τοὺς ἄλλους ὁ κατήγορος ἀπολύων αὐτὸν τὸν θάνατόν φησι μηνύειν ἐμὲ τὸν φονέα ὄντα. εἰ γὰρ τούτων ἀναιτίων δοκούντων εἶναι ἐν ἐμοὶ τἀδίκημα φανεῖται, fidem vindicat Thalheim, collato Platonis Phileb. 37 d. τούτων ὑπόπτων ὄντων ἐγὼ εἰκότως ἂν ἂν add. Blass: δʼ εἰκότως Α, δικαίως Ν. καθαρὸς δοκοίην εἶναι. 
2.5	ἔστι δὲ οὐκ ἀπεικός, ὡς οὗτοί φασιν, ἀλλὰ εἰκὸς ἀωρὶ τῶν νυκτῶν πλανώμενον ἐπὶ τοῖς ἱματίοις διαφθαρῆναι. τὸ γὰρ μὴ ἐκδυθῆναι οὐδὲν σημεῖόν ἐστιν· εἰ γὰρ μὴ ἔφθησαν περιδύσαντες αὐτόν, ἀλλά τινας προσιόντας φοβηθέντες ἀπέλιπον, ἐσωφρόνουν καὶ οὐκ ἐμαίνοντο τὴν σωτηρίαν τοῦ κέρδους προτιμῶντες. 
2.6	εἰ δὲ μὴ καὶ ἐπὶ τοῖς ἱματίοις διεφθάρη, ἀλλʼ ἑτέρους ἰδὼν ἄλλο τι κακὸν ποιοῦντας, ἵνα μὴ μηνυτὴς τοῦ ἀδικήματος γένηται, ἀπέθανεν ὑπʼ αὐτῶν, τίς οἶδε; τοὺς δὲ μὴ πολὺ ἧσσον ἐμοῦ μισοῦντας αὐτόν—ἦσαν δὲ πολλοί—πῶς οὐκ εἰκὸς ἦν ἐμοῦ μᾶλλον διαφθεῖραι αὐτόν; ἐκείνοις μὲν γὰρ φανερὰ ἦν ἡ ὑποψία εἰς ἐμὲ ἰοῦσα, ἐγὼ δὲ ὑπὲρ ἐκείνων ὑπαίτιος ἐσόμενος σαφῶς ᾔδη. 
2.7	τοῦ δὲ ἀκολούθου ἡ μαρτυρία πῶς ἀξία πιστεύεσθαί ἐστιν; ὑπό τε γὰρ τοῦ κινδύνου ἐκπεπληγμένον αὐτὸν οὐκ εἰκὸς ἦν τοὺς ἀποκτείναντας γνῶναι, ὑπό τε τῶν κυρίων ἀναγιγνωσκόμενον ἐπινεῦσαι ἦν εἰκός. ἀπιστουμένων δὲ καὶ τῶν ἄλλων δούλων ἐν ταῖς μαρτυρίαις—οὐ γὰρ ἂν ἐβασανίζομεν αὐτούς—πῶς δίκαιον τούτῳ μαρτυροῦντι πιστεύσαντας διαφθεῖραί με; 
2.8	εἰ δέ τις τὰ εἰκότα ἀληθέσιν ἴσα ἡγεῖται καταμαρτυρῆσαί μου, ταὐτὸν τοὖργον Blass: τοῦτʼ αὖ Gernet:alii alia. Codicum tamen ἀντιλογισάσθω ὅτι με εἰκότερον ἦν τὴν ἀσφάλειαν τῆς ἐπιβουλῆς τηροῦντα φυλάξασθαι καὶ μὴ παραγενέσθαι τῷ ἔργῳ μᾶλλον ἢ τοῦτον σφαττόμενον ὀρθῶς γνῶμαι. 
2.9	ὡς δὲ τόνδε τόνδε Dobree: οὐδὲ codd. τὸν κίνδυνον οὐκ ἀσφαλέστερον τοῦ ἀπὸ τῆς γραφῆς ἡγούμην εἶναι, ἀλλὰ πολλαπλάσιον, εἰ μὴ παρεφρόνουν, διδάξω. ἁλοὺς μὲν γὰρ τὴν γραφὴν τῆς μὲν οὐσίας ᾔδη ἐκστησόμενος, τοῦ δὲ σώματος καὶ τῆς πόλεως τοῦ δὲ σώματος καὶ τῆς πόλεως Ν: τῆς δὲ π. καὶ τοῦ σ. Α. οὐκ ἀπεστερούμην, περιγενόμενος δὲ καὶ λειφθείς, κἂν ἔρανον παρὰ τῶν φίλων συλλέξας, οὐκ ἂν εἰς τὰ ἔσχατα κακὰ ἦλθον· ἐὰν δὲ νῦν καταληφθεὶς ἀποθάνω, ἀνόσια ὀνείδη τοῖς παισὶν ὑπολείψω, ἢ φυγὼν γέρων καὶ ἄπολις ὢν ἐπὶ ξενίας πτωχεύσω. 
2.10	οὕτω μὲν ἃ κατηγόρηταί μου, πάντα ἄπιστά ἐστιν· ἀπολύεσθαι δὲ ὑφʼ ὑμῶν, εἰ καὶ εἰκότως μὲν ὄντως δὲ μὴ ἀπέκτεινα τὸν ἄνδρα, πολὺ μᾶλλον δίκαιός εἰμι. ἐγώ τε γὰρ φανερὸν ὅτι μεγάλα ἀδικούμενος ἠμυνόμην ἠμυνόμην Kayser: ἠμυνάμην codd. · οὐ γὰρ ἂν εἰκότως ἐδόκουν ἀποκτεῖναι αὐτόν· τούς τε ἀποκτείναντας καὶ οὐ τοὺς αἰτίαν ἔχοντας ἀποκτεῖναι ὀρθῶς ἂν καταλαμβάνοιτε. 
2.11	ἐκ δὲ παντὸς τρόπου ἀπολυόμενος τῆς αἰτίας ἔγωγε οὔτε εἰς τὰ τεμένη εἰσιὼν τὴν ἁγνείαν τῶν θεῶν μιανῶ, οὔτε ὑμᾶς πείθων ἀπολῦσαί με ἀνόσια πράσσω. οἱ δὲ διώκοντες μὲν ἐμὲ τὸν ἀναίτιον, τὸν δʼ αἴτιον ἀφιέντες, τῆς τε ἀφορίας αἴτιοι γίγνονται, ὑμᾶς τε ἀσεβεῖς εἰς τοὺς θεοὺς πείθοντες καταστῆναι πάντων ὧν ἐμὲ ἄξιόν φασι παθεῖν εἶναι δίκαιοί εἰσι τυγχάνειν. 
2.12	τούτους μὲν οὖν τούτων ἀξίους ὄντας ἀπίστους ἡγεῖσθε· ἐμὲ δὲ ἔκ γε ἔκ γε Franke: ἔκ τε codd. τῶν προειργασμένων γνώσεσθε οὔτε ἐπιβουλεύοντα οὔτε τῶν οὐ προσηκόντων ὀρεγόμενον, ἀλλὰ τἀναντία τούτων πολλὰς μὲν καὶ μεγάλας εἰσφορὰς εἰσφέροντα, πολλὰ δὲ τριηραρχοῦντα, λαμπρῶς δὲ χορηγοῦντα, πολλοῖς πολλοῖς Salmasius (cf. Dem. 999.24): πολλοὺς codd. δὲ ἐρανίζοντα, μεγάλας δὲ ὑπὲρ πολλῶν ἐγγύας ἀποτίνοντα, τὴν δὲ τὴν δὲ Schaefer: τήν τε codd. οὐσίαν οὐ δικαζόμενον ἀλλʼ ἐργαζόμενον κεκτημένον, φιλοθύτην δὲ καὶ νόμιμον ὄντα. τοιούτου δὲ ὄντος μου μηδὲν ἀνόσιον μηδὲ αἰσχρὸν καταγνῶτε. 
2.13	εἰ δὲ ὑπὸ ζῶντος ἐδιωκόμην, οὐκ ἂν μόνον ὑπὲρ ἐμαυτοῦ ἀπελογούμην, ἀλλʼ αὐτόν τε τοῦτον καὶ τοὺς τούτῳ μὲν βοηθοῦντας, παρʼ ἐμοῦ δὲ ὠφελεῖσθαι ζητοῦντας ἐφʼ οἷς κατηγορεῖταί κατηγορεῖται vulg.: κατηγορεῖτε ΑΝ. μου, ἀπέδειξα ἀπέδειξα Α: ἐπέδειξα Ν. ἂν ἀδικοῦντας. ταῦτα μὲν οὖν ἐπιεικέστερον ἢ δικαιότερον παρήσω· δέομαι δʼ ὑμῶν, ὦ ἄνδρες, τῶν μεγίστων κριταὶ καὶ κύριοι, ἐλεήσαντας τὴν ἀτυχίαν μου ἰατροὺς γενέσθαι αὐτῆς, καὶ μὴ συνεπιβάντας τῇ τούτων ἐπιθέσει περιιδεῖν ἀδίκως καὶ ἀθέως διαφθαρέντα με ὑπʼ αὐτῶν. 
3.1	 ἥ τε ἀτυχία ἀδικεῖται ὑπʼ αὐτοῦ, ἣν προϊστάμενος τῆς κακουργίας ἀφανίσαι τὴν αὑτοῦ μιαρίαν ζητεῖ· ὑπό τε ὑμῶν οὐκ ἄξιος ἐλεεῖσθαί ἐστιν, ἀκούσιον μὲν τῷ παθόντι περιθεὶς τὴν συμφοράν, ἑκουσίως δὲ αὐτὸς εἰς τοὺς κινδύνους καταστάς. ὡς μὲν οὖν ἀπέκτεινε τὸν ἄνδρα, ἐν τῷ προτέρῳ λόγῳ ἀπεδείξαμεν· ὡς δὲ οὐκ ὀρθῶς ἀπελογήθη, νῦν πειρασόμεθα ἐλέγχοντες. 
3.2	εἴτε γὰρ προσιόντας τινὰς προϊδόντες οἱ ἀποκτείναντες αὐτοὺς ἀπολιπόντες ᾤχοντο φεύγοντες πρότερον ἢ ἀπέδυσαν, οἱ ἐντυχόντες ἂν αὐτοῖς, αὐτοῖς Reiske: αὐτῷ codd. εἰ καὶ τὸν δεσπότην τεθνεῶτα ηὗρον, τόν γε θεράποντα, τἀληθῆ Weidner: ἀληθῆ codd. ὃς ἔμπνους ἀρθεὶς ἐμαρτύρει verba ὃς ἔμπνους ἀρθεὶς ἐμαρτύρει delent nonnulli ut quae , ἔτι ἔμφρονα εὑρόντες, σαφῶς ἀνακρίναντες τοὺς ἐργασαμένους ἤγγειλαν ἂν ἡμῖν, καὶ οὐχ οὗτος ἂν τὴν αἰτίαν εἶχεν· εἴτε ἄλλοι τινὲς ἕτερόν τι τοιοῦτον κακουργοῦντες ὀφθέντες ὑπʼ αὐτῶν, ἵνα μὴ γνωσθῶσι διέφθειραν αὐτούς, ἅμα τῷ τούτων φόνῳ τὸ κακούργημα ἂν ἐκηρύσσετο καὶ εἰς τούτους ἂν ἡ ὑποψία ἧκεν. 
3.3	οἵ τε ἧσσον κινδυνεύοντες τῶν μᾶλλον ἐν φόβῳ ὄντων οὐκ οἶδʼ ὅπως ἂν μᾶλλον ἐπεβούλευσαν αὐτῷ· τοὺς μὲν γὰρ ὅ τε φόβος ἥ τε ἀδικία ἱκανὴ ἦν παῦσαι τῆς προμηθίας, τοῖς δὲ ὅ τε κίνδυνος ἥ τε αἰσχύνη μείζων οὖσα τῆς διαφορᾶς, εἰ καὶ διενοήθησαν ταῦτα πρᾶξαι, ἀρκοῦσα ἦν σωφρονίσαι τὸ θυμούμενον τῆς γνώμης. 
3.4	οὐκ ὀρθῶς δὲ τὴν τοῦ ἀκολούθου μαρτυρίαν ἄπιστον λέγουσιν εἶναι. οὐ γὰρ ἐπὶ ταῖς τοιαύταις μαρτυρίαις βασανίζονται, ἀλλʼ ἐλεύθεροι ἀφίενται· ὁπόταν δὲ ἢ κλέψαντες ἀπαρνῶνται ἢ συγκρύπτωσι τοῖς δεσπόταις, τότε βασανίζοντες ἀξιοῦμεν τἀληθῆ λέγειν αὐτούς. 
3.5	οὐδὲ μὴν ἀπογενέσθαι ἢ παραγενέσθαι εἰκότερον αὐτόν ἐστιν. εἰ γὰρ ἀπεγένετο, τὸν μὲν κίνδυνον τὸν αὐτὸν ἔμελλε καὶ παρὼν κινδυνεύειν—πᾶς γὰρ αὐτῶν ληφθεὶς τοῦτον ἂν τὸν ἐπιβουλεύσαντα ἤλεγχεν ὄντα—τὸ δʼ ἔργον ἧσσον πράσσειν· οὐδεὶς γὰρ ὅστις τῶν παρόντων οὐκ ἂν ὀκνηρότερος εἰς τὴν πρᾶξιν ἦν. 
3.6	ὡς δʼ οὐκ ἐλάσσω ἀλλὰ πολὺ μείζω τὸν ἀπὸ τῆς γραφῆς κίνδυνον ἢ τόνδε ἡγεῖτο εἶναι, διδάξω. τὸ μὲν ἁλῶναι καὶ ἀποφυγεῖν ἀμφοτέρας τὰς διώξεις ἐν ἴσαις ἐλπίσι θῶμεν αὐτῷ εἶναι. μὴ παραχθῆναι δὲ τὴν γραφὴν οὐδεμίαν ἐλπίδα εἶχε τούτου γε ζῶντος· οὐ γὰρ ἂν ἐπείθετο αὐτῷ· εἰς codd. fortasse exciderunt nonnulla post αὐτῷ. δὲ τόνδε τὸν ἀγῶνα ἀγῶνα Ν: κίνδυνον Α. ἥξειν οὐκ ἤλπισε· λήσειν γὰρ ἐδόκει ἀποκτείνας αὐτόν. 
3.7	ἀξιῶν δὲ διὰ τὸ φανερὰν εἶναι τὴν ὑποψίαν αὐτῷ μὴ καταδοκεῖσθαι ὑφʼ ὑμῶν, οὐκ ὀρθῶς ἀξιοῖ. εἰ γὰρ εἰ γὰρ Reiske: οὐ γὰρ codd. τοῦτον ἐν τοῖς μεγίστοις κινδύνοις ὄντα ἱκανὴ ἦν ἡ ὑποψία ἀποτρέψαι ἀποτρέψαι Reiske: ἀποστρέψαι codd. τῆς ἐπιθέσεως, οὐδείς γʼ ἂν γʼ ἂν Reiske: γὰρ codd. ἐπεβούλευσεν αὐτῷ· πᾶς γὰρ ἄν τις τῶν ἧσσον κινδυνευόντων, τὴν ὑποψίαν μᾶλλον τοῦ κινδύνου φοβούμενος, ἧσσον ἢ οὗτος ἐπέθετο ἐπέθετο Maetzner, quem dubitanter secutus sum: ἡγεῖτο αὐτῷ. 
3.8	αἱ δʼ εἰσφοραὶ καὶ χορηγίαι εὐδαιμονίας μὲν ἱκανὸν σημεῖόν ἐστι, τοῦ δὲ μὴ ἀποκτεῖναι τἀναντία· περὶ γὰρ αὐτῆς τῆς εὐδαιμονίας τρέμων μὴ ἀποστερηθῇ, εἰκότως μὲν ἀνοσίως δὲ ἀπέκτεινε ἀπολύσεσθε Sauppe: ἀπολύεσθε codd. τὸν ἄνδρα. φάσκων δὲ οὐ τοὺς εἰκότως ἀλλʼ ὄντως ἀλλʼ ὄντως Funkhanel: ἀλλὰ τοὺς codd. ἀποκτείναντας φονέας εἶναι, περὶ μὲν τῶν ἀποκτεινάντων ὀρθῶς λέγει, εἴπερ ἐγένετο φανερὸν ἡμῖν τίνες ἦσαν οἱ ἀποκτείναντες αὐτόν· μὴ δεδηλωμένων δὲ τῶν ἀποκτεινάντων, ὑπὸ τῶν εἰκότων ἐλεγχόμενος οὗτος ἂν καὶ οὐδεὶς ἕτερος ὁ ὁ add. Weidner. ἀποκτείνας αὐτὸν εἴη. οὐ γὰρ ἐπὶ ἐπὶ Ald.: ὑπὸ codd. μαρτύρων ἀλλὰ κρυπτόμενα πράσσεται τὰ τοιαῦτα. 
3.9	οὕτω δὲ φανερῶς ἐκ τῆς αὑτοῦ ἀπολογίας ἐλεγχθεὶς διαφθείρας αὐτόν, οὐδὲν ἕτερον ὑμῶν δεῖται ἢ τὴν αὑτοῦ μιαρίαν εἰς ὑμᾶς αὐτοὺς ἐκτρέψαι. ἡμεῖς δὲ ὑμῶν δεόμεθα μὲν οὐδέν, λέγομεν δʼ ὑμῖν, εἰ μήτε ἐκ τῶν εἰκότων μήτε ἐκ τῶν μαρτυρουμένων οὗτος νῦν ἐλέγχεται, οὐκ ἔστιν ἔτι τῶν διωκομένων ἔλεγχος οὐδείς. 
3.10	σαφῆ μὲν γὰρ τὸν θάνατον γιγνώσκοντες, φανερῶς δὲ τὰ ἴχνη τῆς ὑποψίας εἰς τοῦτον φέροντα, πιστῶς δὲ τοῦ ἀκολούθου μαρτυροῦντος, πῶς ἂν δικαίως ἀπολύοιτε αὐτόν; ἀδίκως δʼ ἀπολυομένου τούτου ὑφʼ ὑμῶν, ἡμῖν μὲν προστρόπαιος ὁ ἀποθανὼν οὐκ ἔσται, ὑμῖν δὲ ἐνθύμιος γενήσεται. ἀδίκως ... γενήσεται huc transposuit Jernstedt: ante 
3.11	ταῦτα οὖν εἰδότες βοηθεῖτε μὲν τῷ ἀποθανόντι, τιμωρεῖσθε δὲ τὸν ἀποκτείναντα, ἁγνεύετε δὲ τὴν πόλιν. τρία γὰρ ἀγαθὰ πράξετε· ἐλάσσους μὲν τοὺς ἐπιβουλεύοντας καταστήσετε, πλείους δὲ τοὺς τὴν εὐσέβειαν ἐπιτηδεύοντας, ἀπολύσεσθε habent codd. δʼ αὐτοὶ τῆς ὑπὲρ τούτου μιαρίας. 
