83	ἔγραψας σὺ τοῦτο, Δημόσθενες; ἔγραψας· οὐκ ἔστιν ἀντειπεῖν. ἐγένετο ἡ βουλὴ κυρία σοῦ προστάξαντος; ἐγένετο. τεθνᾶσι τῶν πολιτῶν ἄνδρες; τεθνᾶσι. κύριον ἦν τὸ σὸν ψήφισμα κατʼ ἐκείνων; ἀδύνατον ἀντειπεῖν. λέγε δὴ πάλιν ὃ Δημοσθένης κατὰ Δημοσθένους ἔγραψε. προσέχετε, ὦ ἄνδρες. Ψήφισμα 
84	ἡ βουλὴ εὕρηκε Δημοσθένην. τί δεῖ πολλῶν λόγων; ἀποπέφαγκεν, ὦ Ἀθηναῖοι. τὸ μὲν τοίνυν δίκαιον ἦν ὑφʼ ἑαυτοῦ κεκριμένον εὐθὺς ἀποθνῄσκειν· ἐπειδὴ δʼ εἰς τὰς ὑμετέρας ἥκει χεῖρας τῶν τῶν . . . συνειλεγμένων . . . τῶν ὀμωμοκότων Stephanus (συνειλεγμένων iam Ald.): τοὺς . . . συνειλεγμένους . . . τοὺς ὀμωμοκότας codd. ὑπὲρ τοῦ δήμου συνειλεγμένων καὶ τῶν ὀμωμοκότων See the preceding note πείσεσθαι πείσεσθαι Baiter: πείθεσθαι codd. τοῖς νόμοις καὶ τοῖς τοῦ δήμου ψηφίσμασι, τί ποιήσετε; προήσεσθε τὴν πρὸς τοὺς θεοὺς εὐσέβειαν καὶ τὰ παρὰ πᾶσιν ἀνθρώποις δίκαια νομιζόμενα; 
85	μή, ὦ Ἀθηναῖοι, μή· αἰσχρὸν γὰρ καὶ δεινόν, ἑτέρους μὲν ὑπὸ τῶν Δημοσθένους ψηφισμάτων, οὐδὲν ὄντας τούτου χείρους οὐδὲ τοσαῦτʼ ἠδικηκότας ὅσαπερ οὗτος, ἀπολωλέναι, τουτονὶ δὲ καταφρονοῦντα ὑμῶν καὶ τῶν νόμων ἀτιμώρητον ἐν τῇ πόλει περιιέναι, αὐτὸν ὑφʼ ἑαυτοῦ καὶ τῶν ψηφισμάτων ὧν ἔγραψεν ἑαλωκότα. ταὐτὸ ταὐτὸ ταὐτὰ Dobree: τουτὶ τὸ . . . ταὐτὰ τὰ codd. συνέδριον, ὦ Ἀθηναῖοι, καὶ ὁ αὐτὸς τόπος, καὶ ταὐτὰ See preceding note δίκαια. 
86	ὁ αὐτὸς ῥήτωρ ἐκείνοις τʼ αἴτιος ἐγένετο τῶν συμβάντων κακῶν καὶ αὑτῷ τῶν νῦν συμβησομένων. ἐπέτρεψεν [ὁ] ὁ del. Kleyn. αὐτὸς οὗτος ἐν τῷ δήμῳ τῷ συνεδρίῳ τούτῳ κρῖναι περὶ αὑτοῦ, μάρτυρας ὑμᾶς πεποιημένος. ἔθετο συνθήκας μετὰ τοῦ δήμου, γράψας τὸ ψήφισμα καθʼ ἑαυτοῦ παρὰ τὴν μητέρα τὴν μητέρα] τῇ μητρὶ Reiske. τῶν θεῶν, ἣ πάντων τῶν ἐν τοῖς γράμμασι δικαίων φύλαξ τῇ πόλει καθέστηκε. διὸ καὶ οὐχ ὅσιον ὑμῖν ἐστὶ ταύτας ἀκύρους ποιεῖν, οὐδὲ τοὺς θεοὺς ὀμωμοκόσι περὶ ταύτης τῆς κρίσεως ταῖς αὐτῶν τῶν θεῶν πράξεσιν ἐναντίαν τὴν ψῆφον ἐνεγκεῖν. 
87	κρίσεως κρίσεως Blass: κρίσει codd. Ποσειδῶν ἀποτυχὼν τῆς τῆς . . . γενομένης Ν Α pr.: τοῖς . . . γενομένοις Α corr. (2): τῇ γενομένῃ Bekker. ὑπὲρ Ἁλιρροθίου πρὸς Ἄρη γενομένης See preceding note ἐνέμεινεν· ἐνέμειναν ἐνέμειναν hic add. Sauppe, infra post γενομένῃ Reiske. αὐταὶ αἰ σεμναὶ θεαὶ τῇ πρὸς Ὀρέστην ἐν τούτῳ τῷ συνεδρίῳ κρίσει γενομένῃ καὶ τῇ τούτου ἀληθείᾳ συνοίκους ἑαυτὰς εἰς τὸν λοιπὸν χρόνον κατέστησαν. ὑμεῖς δὲ τί ποιήσετε οἱ πάντων εἶναι φάσκοντες εὐσεβέστατοι; εὐσεβέστατοι Ν: εὐσεβέστεροι Α. τὴν τοῦ συνεδρίου γνώμην γνώμην Α: γνῶσιν Ν. ἄκυρον καταστήσετε τῇ Δημοσθένους ἐπακολουθήσαντες πονηρίᾳ; οὐκ, ἐὰν σωφρονῆτε, ὦ Ἀθηναῖοι· 
88	οὐ γὰρ περὶ μικρῶν οὐδὲ τῶν τυχόντων ἐν τῇ τήμερον ἡμέρᾳ δικάζετε, ἀλλὰ περὶ σωτηρίας τῆς πόλεως ἁπάσης καὶ πρὸς τούτοις περὶ δωροδοκίας, ἔθους πονηροῦ καὶ πράγματος ἀλυσιτελοῦς ὑμῖν καὶ πάντας ἀνθρώπους ἀπολωλεκότος. ὃ ὃ add. Reiske. εἰ μέν, καθʼ ὅσον ἐστὲ δυνατοί, ἐκβαλεῖτʼ ἐκ τῆς πόλεως καὶ παύσετε τοὺς ῥᾳδίως καθʼ ὑμῶν χρήματα λαμβάνοντας, σωθησόμεθα θεῶν βουλομένων· εἰ δʼ ἐπιτρέψετε τοῖς ῥήτορσι πωλεῖν ὑμᾶς αὐτούς, περιόψεσθε τὴν πόλιν ἀνατραπεῖσαν ὑπὸ τούτων. 
89	ἔγραψεν αὐτὸς ἐν τῷ δήμῳ Δημοσθένης, ὡς δηλονότι δικαίου τοῦ πράγματος ὄντος, φυλάττειν Ἀλεξάνδρῳ τὰ εἰς τὴν Ἀττικὴν ἀφικόμενα μετὰ Ἁρπάλου χρήματα. οὕτως οὖν, ὦ ἄριστε, εἰπέ μοι, φυλάξομεν, φυλάξομεν Α: φυλάξωμεν Ν. ἐὰν σὺ μὲν εἴκοσι τάλαντα λαβὼν ἔχῃς ἰδίᾳ, ἰδίᾳ Wurm: ἴδια codd. ἕτερος δὲ πεντεκαίδεκα, Δημάδης δʼ ἑξακισχιλίους χρυσοῦ στατῆρας, ἕτεροι δʼ ὅσα δή ποτε ἀποπεφασμένοι εἰσί; τέτταρα τέτταρα Α corr. (2): τετρακόσια Α pr. N: διακόσια Thalheim. γὰρ τάλαντʼ ἐστὶ καὶ ἑξήκοντα ἤδη εὑρημένα, ὧν οἴεσθε τὴν αἰτίαν τούτοις δεῖν τούτοις δεῖν (δεῖν post οἴεσθε iam Reiske) Blass: τουτοισὶν codd. ἀναθεῖναι. 
90	καὶ πότερα κάλλιόν ἐστι, πρὸς δὲ δικαιότερον, ἅπαντʼ ἐν τῷ κοινῷ φυλάττεσθαι, ἕως ἄν τι δίκαιον ὁ δῆμος βουλεύσηται, ἢ τοὺς ῥήτορας καὶ τῶν στρατηγῶν ἐνίους διηρπακότας ἔχειν; ἐγὼ μὲν γὰρ οἶμαι τὸ μὲν ἐν τῷ κοινῷ φυλάττειν παρὰ πάντων ὁμολογούμενον εἶναι δίκαιον, τὸ δὲ τούτους ἔχειν μηδένʼ ἂν εἰπεῖν ὡς ἔστι καλῶς ἔχον. 
91	πολλοὺς οὗτος εἴρηκε εἴρηκε Dobree: ἐρεῖ codd., ret. Wurm. καὶ παντοδαποὺς λόγους, ὦ ἄνδρες, καὶ οὐδεπώποτε οὐδεπώποτε] οὐδέποτε Wurm. τοὺς αὐτούς. ὁρᾷ γὰρ ὑμᾶς τὸν ἅπαντα χρόνον ἐλπίσι κεναῖς καὶ ψευδέσι λόγοις ἐξηπατημένους ὑφʼ ἑαυτοῦ, καὶ μέχρι τούτου μνημονεύοντας τὰς ὑποσχέσεις μέχρι μέχρι Blass: μέχρις codd. ἂν ῥηθῶσιν. εἰ μὲν οὖν ἔτι δεῖ τὴν πόλιν τῆς Δημοσθένους πονηρίας καὶ ἀτυχίας ἀπολαύειν, ἵνα πλείω πλείω Ν: πλέον Α. κακοδαιμονῶμεν — οὐ οὐ Ν: οὐδὲ Α. γὰρ ἔχω τί ἄλλο εἴπω —,στερκτέον ἂν ἂν add. Bekker. εἴη τοῖς συμβαίνουσιν· 
92	εἰ δέ τι δέ τι Baiter: δʼ ἔτι codd. κηδόμεθα τῆς πατρίδος καὶ τοὺς πονηροὺς καὶ δωροδόκους μισοῦμεν καὶ μετοιωνίσασθαι τὴν τύχην καὶ μεταλλάξασθαι βουλόμεθα, οὐ προετέον προετέον Wolf: προσεκτέον codd. ἐστὶν ὑμᾶς αὐτούς, ὦ Ἀθηναῖοι, ταῖς τοῦ μιαροῦ καὶ γόητος τούτου δεήσεσιν, οὐδὲ προσδεκτέον τοὺς οἴκτους καὶ τοὺς φενακισμοὺς τοὺς τοὺς add. Baiter et Sauppe. τούτου· ἱκανὴν γὰρ εἰλήφατε πεῖραν αὐτοῦ καὶ τῶν ἔργων καὶ τῶν λόγων καὶ τῆς τύχης. 
93	τίς οὕτως εὔελπις ὑμῶν ἐστιν, ὦ Ἀθηναῖοι, τίς οὕτως ἀλόγιστος, τίς τῶν προγεγενημένων καὶ νῦν ἐνεστηκότων πραγμάτων ἄπειρος, ὅστις ὅστις Ald.: τίς codd. ἐλπίζει τὸν ἐκ τοσαύτης εὐδαιμονίας εἰς τοσαύτην ἀδοξίαν καταστήσαντα τὴν πόλιν, διʼ ἡντιναδήποτε αἰτίαν ἢ τύχην — ἐῶ γὰρ τοῦτο — νῦν, τοῦτο — νῦν, Gebauer: τοῦτο νῦν — codd. ἐπειδὴ πρὸς ταῖς ἄλλαις ἀπορίαις καὶ τοῖς περιεστηκόσιν ἡμᾶς κινδύνοις καὶ ἡ τῶν ἐξ αὐτῆς τῆς πόλεως δωροδοκία προσγέγονε, καὶ περὶ αἰσχρᾶς αἰτίας κοινῇ πάντες ἀγωνιζόμεθα καὶ περὶ τοῦ μὴ δοκεῖν τὰ ἰδίᾳ ἰδίᾳ Bekker: ἰδία A corr. (2): ἴδια A pr. N. παρά τισιν ὄντα χρήματα κοινῇ τὸν δῆμον ἔχειν, τηνικαῦτα συμβουλεύοντα καὶ διοικοῦντα τοῦτον σώσειν ὑμᾶς; 
94	ἐῶ γὰρ τἆλλα ὅσα μεταβαλλόμενος ἐν τοῖς πράγμασι καὶ δημηγορῶν οὐδὲν ὑγιὲς διατετέλεκε, διατετέλεκε Ν: τετέλεκε Α. καὶ τοτὲ μὲν γράφων καὶ ἀπαγορεύων μηδένα νομίζειν ἄλλον θεὸν ἢ τοὺς παραδεδομένους, τοτὲ δὲ λέγων ὡς οὐ δεῖ τὸν δῆμον ἀμφισβητεῖν τῶν ἐν τῷ τῷ add. N. οὐρανῷ τιμῶν Ἀλεξάνδρῳ, ὅταν δὲ μέλλῃ κριθήσεσθαι παρʼ ὑμῖν, Καλλιμέδοντα εἰσαγγέλλων συνιέναι ἐν Μεγάροις τοῖς φυγάσιν ἐπὶ καταλύσει τοῦ δήμου, καὶ ταύτην τὴν εἰσαγγελίαν εὐθὺς παραχρῆμα ἀναιρούμενος, 
95	ἐν δὲ τῇ ἐκκλησίᾳ ταύτῃ τῇ πρώην γεγενημένῃ προσάγων καὶ κατασκευάζων ψευδῆ μηνυτὴν ὡς ἐπιβουλευομένων τῶν νεωρίων, καὶ περὶ τούτων γράφων μὲν οὐδέν, αἰτίας δʼ ἕνεκα τοῦ παρόντος ἀγῶνος παρασκευάζων· τούτων γὰρ ἁπάντων ὑμεῖς τούτῳ μάρτυρές ἐστε. γόης οὗτος, ἄνδρες Ἀθηναῖοι, καὶ μιαρὸς ἄνθρωπός ἐστι, καὶ οὔτε τῷ γένει τῆς πόλεως πολίτης οὔτε τοῖς πεπολιτευμένοις αὐτῷ καὶ πεπραγμένοις. 
96	 ποῖαι γὰρ τριήρεις εἰσὶ κατεσκευασμέναι διὰ τοῦτον, ὥσπερ ἐπὶ Εὐβούλου, τῇ πόλει; ἢ ποῖοι νεώσοικοι τούτου πολιτευομένου γεγόνασι; πότε οὗτος ἢ διὰ ψηφίσματος ἢ νόμου ἐπηνώρθωσε τὸ ἱππικόν; τίνα κατεσκεύασε δύναμιν τοιούτων καιρῶν παραγενομένων μετὰ τὴν ἐν Χαιρωνείᾳ μάχην, ἢ πεζὴν ἢ ναυτικήν; τίς ἀνενήνεκται ἀνενήνεκται Bekker: ἀνήνεκται codd. τῇ θεῷ κόσμος εἰς ἀκρόπολιν ὑπὸ τούτου; τί κατεσκεύακεν οἰκοδόμημα Δημοσθένης ἐν τῷ ἐμπορίῳ τῷ ὑμετέρῳ ἢ ἐν τῷ ἄστει ἢ ἄλλοθί που τῆς χώρας; οὐδεὶς ἂν ἂν Stephanus: οὖν codd. οὐδαμοῦ δείξειεν. 
97	ἔπειτα τὸν ἐν μὲν ἐν μὲν Blass: μὲν ἐν codd. ταῖς πολεμικαῖς πράξεσιν ἄπιστον γεγενημένον, ἐν δὲ ταῖς κατὰ τὴν πόλιν οἰκονομίαις ἄχρηστον, περιεορακότα δὲ τοὺς ἀντιπολιτευομένους ἅπαντα διαπεπραγμένους διαπεπραγμένους A corr. (2): δὲ πεπραγμένους A pr. N. ὅσʼ ἐβουλήθησαν, μεταβεβλημένον δʼ αὐτὸν καὶ τὰς ὑπὲρ τοῦ δήμου πράξεις ἐγκαταλελοιπότα, τοῦτον περιποιῆσαι βουλήσεσθε; βουλήσεσθε Dobree: βούλεσθε codd. 
98	οὐκ, ἐὰν σωφρονῆτε καὶ καλῶς καὶ ὑπὲρ ὑμῶν αὐτῶν καὶ τῆς πόλεως βουλεύησθε βουλεύησθε A corr.: βουλεύεσθε A pr. N. · ἀλλὰ δέξεσθε δέξεσθε Dobree: δέξασθε codd. τὴν ἀγαθὴν τύχην, ἣ τιμωρήσασθαι παρέδωκε τῶν ῥητόρων τοὺς τὴν πόλιν διὰ τὴν αὑτῶν δωροδοκίαν ταπεινὴν πεποιηκότας, καὶ φυλάξεσθε, φυλάξεσθε Dobree: φυλάξασθε codd. καθάπερ οἱ θεοὶ προειρήκασιν ὑμῖν ἐν ταῖς μαντείαις πολλάκις, τοὺς τοιούτους ἡγεμόνας καὶ συμβούλους. ἀκούσατε δʼ αὐτῆς τῆς μαντείας. λέγε τὴν μαντείαν.
99	Μαντεία πῶς οὖν μίαν γνώμην ἕξομεν, ὦ Ἀθηναῖοι; πῶς ὁμονοήσομεν ὁμονοήσομεν Α: ὁμονοήσωμεν Ν. ἅπαντες ὑπὲρ τῶν κοινῇ συμφερόντων, ὅταν οἱ ἡγεμόνες καὶ οἱ δημαγωγοὶ χρήματα λαμβάνοντες προϊῶνται τὰ τῆς πατρίδος συμφέροντα, καὶ ὑμεῖς μὲν καὶ ὁ δῆμος ἅπας κινδυνεύῃ περὶ τοῦ ἐδάφους τοῦ τῆς πόλεως καὶ τῶν ἱερῶν τῶν πατρῴων καὶ παίδων καὶ γυναικῶν, οἱ δὲ διηλλαγμένοι πρὸς αὐτοὺς ἐν μὲν ταῖς ἐκκλησίαις λοιδορῶνται καὶ προσκρούωσιν ἀλλήλοις ἐξεπίτηδες, ἰδίᾳ δὲ ταὐτὰ ταὐτὰ Wolf: τὰ αὐτὰ Ν: ταῦτα Α. πράττωσιν ἐξαπατῶντες ὑμᾶς τοὺς ῥᾷστα πειθομένους τοῖς τούτων λόγοις; 
100	τί γάρ ἐστι ῥήτορος δημοτικοῦ καὶ μισοῦντος τοὺς κατὰ τῆς πόλεως λέγοντας καὶ γράφοντας; ἢ τί φασι τοὺς πρὸ ὑμῶν ὑμῶν Reiske: ἡμῶν codd. γεγενημένους, ὦ Δημόσθενες καὶ Πολύευκτε, διατελεῖν ποιοῦντας; καὶ ταῦτʼ οὐδενὸς δεινοῦ τότε τὴν πόλιν περιεστηκότος. οὐ κρίνειν ἀλλήλους; οὐκ εἰσαγγέλλειν; οὐ γράφεσθαι παρανόμων; ἔστιν οὖν ὅ τι πεποιήκατε τούτων ὑμεῖς οἱ φάσκοντες τοῦ δήμου κήδεσθαι καὶ τὴν σωτηρίαν ὑμῖν ἐν τῇ τούτων εἶναι ψήφῳ; 
101	γέγραψαι ψήφισμα, Δημόσθενες, πολλῶν ὄντων καὶ δεινῶν παρανόμων ὧν Δημάδης γέγραφε; κεκώλυκας τινὰ πρᾶξιν ὧν ἐκεῖνος προελόμενος κατὰ τοῦ δήμου πεπολίτευται; οὐδʼ ἡντινοῦν. εἰσήγγελκας τὸν παρὰ τὰ τὰ . . . ψηφίσματα Reiske: τὸ . . . ψήφισμα codd. τοῦ δήμου ψηφίσματα See preceding note καὶ τοὺς νόμους πολλὰ διαπεπραγμένον; οὐδεπώποτε, οὐδεπώποτε Α: οὐδέποτε Ν. ἀλλὰ περιεῖδες αὐτὸν ἐν τῇ ἀγορᾷ χαλκοῦν σταθέντα καὶ τῆς ἐν ἐν πρυτανείῳ Α (cf. 43): ἐν τῷ πρυτανείῳ Ν. πρυτανείῳ σιτήσεως κεκοινωνηκότα τοῖς Ἁρμοδίου καὶ Ἀριστογείτονος ἀπογόνοις. 
102	ἔπειτα ποῦ τῆς εὐνοίας τῆς σῆς ὁ δῆμος ἔλαβε πεῖραν, ἢ ποῦ τὴν τοῦ ῥήτορος βοήθειαν καὶ δύναμιν ἐξεταζομένην εἴδομεν; ἢ ἐνταῦθα φήσετʼ εἶναι δεινοί, εἰ παρακρούεσθε παρακρούεσθε Blass: παρακρούσησθε Ν: παρακρούσετε Α: παρακρούετε Dobree. τούτους ἀεὶ λέγοντες ὡς οὐκ ἔστιν ἔξω τῆς πατρίδος ὑμῖν ἐξελθεῖν, οὐκ ἔστιν ἄλλη καταφυγὴ χωρὶς τῆς ἡμετέρας εὐνοίας; φανεροὺς ἐχρῆν γεγενημένους ἀντιπράττοντας καὶ λόγῳ καὶ ἔργῳ τοῖς κατὰ τοῦ δήμου γραφομένοις ψηφίσμασιν, οὕτω πείθειν τούτους λέγοντας ὡς οὐκ ἔστιν ὑμῖν οὐδεμία σωτηρία χωρὶς τῆς παρὰ τοῦ δήμου βοηθείας. 
103	ὑμεῖς δʼ ἐν τοῖς ἔξω τὰς ἐλπίδας ἔχετε, ἁμιλλώμενοι ταῖς κολακείαις πρὸς τοὺς ὁμολογοῦντας ὑπὲρ Ἀλεξάνδρου πράττειν καὶ δῶρʼ εἰληφέναι παρὰ τῶν αὐτῶν ὧνπερ νῦν ἀποπέφαγκεν ὑμᾶς ἡ βουλή, καὶ σύ, πάντων ἐναντίον τῶν Ἑλλήνων ἐναντίον τῶν Ἑλλήνων Maetzner: ἐναντίων τῶν Ἑλλήνων Ν: τῶν Ἑλλήνων ἐναντίον Α. διειλεγμένος Νικάνορι καὶ κεχρηματικὼς [ἐν Ὀλυμπίᾳ] ἐν Ὀλυμπία del. Kleyn. περὶ ὧν ἐβουλήθης, ἐλεεινὸν νῦν σεαυτὸν κατασκευάζεις προδότης ὢν καὶ δωροδόκος, ὡς ἐπιλησομένους ἐπιλησομένους Stephanus: ἐπιμελησομένους codd. τούτους τῆς σῆς πονηρίας, καὶ οὐ δώσων δίκην ὑπὲρ ὧν εἴληψαι πεποιηκώς, 
104	τοσούτῳ τολμηρότερον Δημάδου, ὥσθʼ ὁ μὲν προειρηκὼς ἐν τῷ δήμῳ τὸν αὑτοῦ τρόπον καὶ τὴν ἀπόνοιαν, καὶ ὁμολογῶν λαμβάνειν καὶ λήψεσθαι, ὅμως οὐ τετόλμηκε τούτοις τετόλμηκε τούτοις Ν: τετόλμηκεν αὐτοῖς Α. δεῖξαι δεῖξαι Α: ἐνδεῖξαι Ν. τὸ πρόσωπον, οὐδʼ ἐναντία τῇ βουλῆς ἀποφάσει λέγειν ἠξίωσε — καίτοι οὐκ ἔγραψεν ἐκεῖνος περὶ αὑτοῦ κυρίαν εἶναι τὴν βουλήν, οὐδὲ θάνατον ὡρίσατο, ἐὰν ἀποφανθῇ χρήματʼ εἰληφώς — σὺ δʼ οὕτω σφόδρα πεπίστευκας τοῖς σεαυτοῦ λόγοις καὶ καταπεφρόνηκας τῆς τούτων εὐηθείας, ὥστε πείσειν οἴει τοὺς δικαστὰς ὡς μόνου σοῦ κατέψευσται τὸ συνέδριον καὶ μόνον οὐκ εἰληφότα σε τὸ χρυσίον ἀποπέφαγκεν. καὶ τίς ἂν ταῦτα πεισθείη; 
105	ὁρᾶτε, ὦ Ἀθηναῖοι, τί μέλλετε ποιεῖν. παρειλήφατε παρὰ τοῦ δήμου τὸ πρᾶγμα, τὸ γεγενημένον εἰδότος, εἰδότος Emperius: εἶδος codd.: ἤδη Ald. τιμωρίας δʼ ἕνεκα τῆς κατὰ τῶν ἐνόχων ὄντων ταῖς ἀποφάσεσι Post ἀποφάσεσι punctum habet Blass. Δημοσθένης εἰσάγεται πρῶτος. κατηγορήκαμεν ἡμεῖς, οὐδὲν οὐδὲν add. Reiske. οὐδενὶ καταχαρισάμενοι τῶν κοινῶν δικαίων. 
106	πότερʼ ἀμελήσαντες τῶν γεγενημένων ἁπάντων ἀφήσετε τὸν πρῶτον εἰσεληλυθότα πρὸς ὑμᾶς, καὶ τὰ δίκαια [τὰ] τὰ del. Sauppe. παρὰ τῷ δήμῳ καὶ τῇ βουλῇ τῇ ἐξ Ἀρείου πάγου δόξαντʼ εἶναι καὶ τοῖς ἄλλοις ἅπασιν ἀνθρώποις, ταῦθʼ ὑμεῖς οἱ κύριοι πάντων λύσετε, καὶ τὴν πονηρίαν αὐτοὶ τὴν τούτων ἀναδέξεσθε; 
107	ἢ πᾶσιν ἀνθρώποις παράδειγμα ἐξοίσετε κοινὸν ὑπὲρ τῆς πόλεως, ὅτι μισεῖτε τοὺς προδότας καὶ τοὺς χρημάτων ἕνεκα προϊεμένους τὰ τοῦ δήμου συμφέροντα; ταῦτα γὰρ ἅπαντʼ ἐστὶν ἐφʼ ὑμῖν νῦν, καὶ πεντακόσιοι καὶ χίλιοι ὄντες τὴν ἁπάσης τῆς πόλεως σωτηρίαν ἐν ταῖς χερσὶν ἔχετε, καὶ ἡ τήμερον ἡμέρα καὶ ἡ ὑμετέρα ψῆφος πολλὴν ἀσφάλειαν τῇ τῇ Α: ἐν τῇ Ν. πόλει καταστήσει τὰ δίκαια ὑμῶν ἐθελόντων κρίνειν, ἢ μοχθηρὰς ἐλπίδας ποιήσετε πάντας ἔχειν τοιαῦθʼ ὑμῶν ἔθη καθιστάντων. 
108	οὐ καταπληκτέον ἐστίν, ἄνδρες Ἀθηναῖοι, οὐδὲ προετέον, ἐὰν σωφρονῆτε, τοῖς Δημοσθένους ἐλέοις τὴν κοινὴν καὶ δικαίαν ὑπὲρ τῆς πόλεως ἀπολογίαν. οὐδεὶς γὰρ ὑμῶν ἠνάγκαζε τοῦτον τὰ μὴ προσήκοντα χρήματα λαμβάνειν λαμβάνειν Wolf: λαμβάνοντα codd.: λαυβάνειν τὰ Ald. καθʼ ὑμῶν, πολλῷ πλείω τῶν ἱκανῶν διʼ ὑμᾶς ἕτερα κεκτημένον, οὐδʼ ἀπολογεῖσθαι ἀπολογεῖσθαι A pr.: ἀπολεῖσθαι A corr. ras. N. νῦν ὑπὲρ τῶν ὡμολογημένων ἀδικημάτων, γράψαντα καθʼ ἑαυτοῦ θάνατον τὴν ζημίαν· ἀλλʼ ἡ ἐκ τοῦ ἄλλου βίου ἔμφυτος αἰσχροκέρδεια καὶ πονηρία ταῦτʼ εἰς τὴν κεφαλὴν αὐτῷ τέτροφε. τέτροφε Blass: τέτραφε codd. 
109	μὴ οὖν ἄχθεσθʼ αὐτοῦ κλαίοντος καὶ ὀδυρομένου· πολὺ γὰρ ἂν δικαιότερον ἐλεήσαιτε ἐλεήσαιτε Dobree: ἐλεήσετε codd. τὴν χώραν, ἣν οὗτος καθίστησιν εἰς τοὺς κινδύνους τοιαῦτα πράττων, ἣ τοὺς ἐξ αὑτῆς γεγενημένους ὑμᾶς ἱκετεύει, παραστησαμένη τὰ ὑμέτερα τέκνα καὶ γυναῖκας, τιμωρήσασθαι τὸν προδότην καὶ σῴζειν ἑαυτήν, ὑπὲρ ἧς οἱ πρόγονοι πολλοὺς καὶ καλοὺς καὶ καλοὺς] del. Baiter. κινδύνους ὑπομείναντες ἐλευθέραν ὑμῖν αὐτὴν παραδεδώκασιν, ἐν ᾗ πολλὰ καὶ καλὰ παραδείγματα λέλειπται τῆς τῶν τελευτησάντων ἀρετῆς. 
