28	Ψήφισμα Μαρτυρίαι Ἐπιστολαί μισθωτὸς οὗτος, ὦ Ἀθηναῖοι, μισθωτὸς οὗτός οὗτός] del. Blass. ἐστι παλαιός. οὗτος ἦν ὁ τὴν πρεσβείαν τὴν παρὰ Φιλίππου πορευομένην ὡς ἡμᾶς ἐκ Θηβῶν καλέσας, καὶ τοῦ λυθῆναι τὸν πρῶτον πόλεμον αἴτιος γενόμενος· οὗτος Φιλοκράτει συναπελογεῖτο συναπελογεῖτο Wurm: συνανελογεῖτο codd.: συνανεκοινολογεῖτο Ald. τῷ γράψαντι πρὸς Φίλιππον εἰρήνην, διʼ ἣν ὑμεῖς ἐκεῖνον ἐξεβάλετε, καὶ ζεύγη τοῖς πρέσβεσιν ἐμισθώσατο τοῖς μετʼ Ἀντιπάτρου δεῦρʼ ἐλθοῦσιν, ἀναλαμβάνων αὐτοὺς καὶ τὸ κολακεύειν τοὺς Μακεδόνας πρῶτος εἰς τὴν πόλιν εἰσάγων. 
29	μὴ ἀφῆτε, ἄνδρες Ἀθηναῖοι, μὴ ἀφῆτε τὸν ἐπὶ τοῖς τῆς πόλεως καὶ τῶν ἄλλων Ἑλλήνων ἀτυχήμασιν ἐπιγεγραμμένον ἀτιμώρητον, εἰλημμένον ἐπʼ αὐτοφώρῳ δῶρα ἔχοντα κατὰ τῆς πόλεως, μηδὲ τῆς ἀγαθῆς τύχης ὑμᾶς ὑμᾶς Sauppe: ἡμᾶς codd. ἐπὶ τὸ βέλτιον ἀγούσης, καὶ τὸν μὲν ἕτερον τῶν τὴν πατρίδα λελυμασμένων ἐκ τῆς πόλεως ἐκβεβληκυίας, τοῦτον δʼ ὑμῖν ἀποκτεῖναι παραδούσης, αὐτοὶ τοῖς πᾶσι συμφέρουσιν ἐναντιωθῆτε, ἀλλὰ μετοιωνίσασθε τὰς τῆς πόλεως πράξεις, εἰς τούτους τοὺς ἡγεμόνας τὰς ἀποτυχίας τρέψαντες. 
30	εἰς ποῖον γὰρ καιρὸν ἀποθήσεσθε τοῦτον ὑπολαβόντες χρήσιμον ὑμῖν αὐτοῖς ἔσεσθαι; ἔχοι τις ἂν εἰπεῖν ἢ ὑμῶν ἢ τῶν περιεστηκότων, εἰς ποῖα οὗτος πράγματα εἰσελθὼν ἢ ἴδια ἢ κοινὰ οὐκ ἀνατέτροφεν; ἀνατέτροφεν Blass: ἀνατέτραφεν codd. οὐκ εἰς μὲν τὴν Ἀριστάρχου οἰκίαν εἰσελθών, βουλεύσας μετʼ ἐκείνου τὸν Νικοδήμῳ θάνατον κατασκευασθέντα, ὃν ἴστε πάντες, ἐξέβαλε τὸν Ἀρίσταρχον ἐπὶ ταῖς αἰσχίσταις αἰτίαις; καὶ τοιούτῳ φίλῳ Δημοσθένει ἐχρήσατο, ὥστε δαίμονα αὐτῷ τοῦτον καὶ τῶν γεγενημένων συμφορῶν ἡγεμόνα νομίσαι προσελθεῖν; 
31	οὐκ ἐπειδὴ τῷ δήμῳ συμβουλεύειν ἤρξατο, ὡς μήποτε ὤφελεν — ἀφήσω γὰρ αὐτοῦ τὰ ἴδια· ὁ γὰρ χρόνος οὐκ ἐπιδέχεται μακρολογεῖν —, ἀγαθὸν μὲν ἁπλῶς εἰπεῖν οὐδὲν γέγονε τῇ πόλει, ἐν κινδύνοις δὲ καὶ κακοῖς καὶ ἀδοξίᾳ πᾶσʼ ἡ Ἑλλάς, οὐ μόνον ἡ πόλις, καθέστηκε; καί, πλείστοις καιροῖς ἐν ταῖς δημηγορίαις χρώμενος, ἅπαντας ἀφῆκε τοὺς ὑπὲρ ὑμῶν καιρούς; καὶ ἐν οἷς καὶ ἐν οἷς A corr. (2): ἐν οἷς A pr. N, Thalheim, qui post πρᾶξαι interpunxit et δὲ post τοσοῦτον addidit. τις ἂν φιλόπολις ἀνὴρ καὶ κηδεμὼν προείλετό τι πρᾶξαι, τοσοῦτον ἐδέησεν ὁ δημαγωγὸς καὶ χρήσιμος αὐτίκα φήσων ὑμῖν γεγενῆσθαι πρᾶξίν τινα προφέρειν, ὥστε καὶ τοὺς πράττοντας ὑπὲρ ὑμῶν τι τῆς αὑτοῦ τύχης ἀνέπλησεν. 
32	ἀπῆρε Χαρίδημος πρὸς τὸν Περσῶν βασιλέα, χρήσιμος ὑμῖν οὐ λόγοις ἀλλʼ ἔργοις βουλόμενος γενέσθαι, καὶ τοῖς ἰδίοις τοῖς αὑτοῦ κινδύνοις ὑμῖν καὶ τοῖς ἄλλοις Ἕλλησι βουλόμενος τὴν σωτηρίαν παρασκευάσαι· περιιὼν οὗτος οὗτος Α: οὕτως Ν. κατὰ τὴν ἀγορὰν ἐλογοποίει καὶ τῶν πραττομένων εἰσεποίει κοινωνὸν αὑτόν· οὕτω κατέστρεψεν ἡ τύχη ταῦτα ὥστʼ ἐναντία ὥστʼ ἐναντία Baiter: ὡς τἀναντία codd. γενέσθαι γενέσθαι Blass: γίνεσθαι Α: γίγνεσθαι Ν. τοῖς προσδοκωμένοις. 
33	ἐξέπλευσεν Ἐφιάλτης, μισῶν μὲν τοῦτον, ἀναγκαζόμενος δὲ τῶν πραγμάτων κοινωνεῖν· ἀφείλετο καὶ τοῦτον ἡ τύχη τῆς πόλεως. Εὐθύδικος προῃρεῖτο τὰς ὑπὲρ τοῦ δήμου πράξεις· ἔφη τούτῳ Δημοσθένης φίλος εἶναι· καὶ καὶ add. Reiske. οὗτος ἀπώλετο. καὶ ταῦθʼ ὑμεῖς ὁρῶντες καὶ ἐπιστάμενοι πολὺ βέλτιον ἢ ἐγὼ οὐ λογίζεσθε, οὐ σκοπεῖσθε πρὸς ὑμᾶς αὐτούς, τεκμαιρόμενοι τὰ μέλλοντα ἐκ τῶν γεγενημένων, ὅτι οὐδὲν οὗτος χρήσιμος ἀλλʼ ἢ τοῖς ἐχθροῖς κατὰ τῆς πόλεως Post πόλεως lacunam indicavit Maetzner, post ἐγένετο Sauppe. ; 
34	συστῆσαι κατασκευὴν ἑτέραν οἵα ἐπʼ Ἄγιδος ἐπʼ Ἄγιδος Wesseling: ἐπʼ Αἰγὸς codd.: ἔναγχος Cobet. ἐγένετο, ὅτε Λακεδαιμόνιοι μὲν ἅπαντες ἐξεστράτευσαν, Ἀχαιοὶ δὲ καὶ Ἠλεῖοι τῶν πραγμάτων ἐκοινώνουν, ὑπῆρχον δὲ ξένοι μύριοι, Ἀλέξανδρος δʼ, ὡς οἱ ὡς οἱ] ὡς ἦσαν οἱ Reiske. λέγοντες, ἐν Ἰνδοῖς ἦν, ἡ δʼ Ἑλλὰς ἅπασα διὰ τοὺς ἐν ἑκάστῃ τῶν πόλεων προδότας ἀχθομένη τοῖς παροῦσι πράγμασιν ἠσμένει μεταβολήν τινα τῶν κακῶν τῶν περιεστηκότων. 
35	τί οὖν; ἐν τούτοις τοῖς καιροῖς Δημοσθένης τίς ἦν, ὁ τοῦ συμβουλεῦσαι καὶ γράψαι κύριος καὶ φήσων αὐτίκα δὴ μισεῖν τὰ καθεστῶτα πράγματα; ἐῶ γὰρ τοὺς ἄλλους κινδύνους. ἔγραψάς τι περὶ τούτων τούτων Bekker: του τῶν Α: τῶ . . . τῶν, ut vid., N pr. (τῶ eras.). [κινδύνων]; κινδύνων del. Bekker. συνεβούλευσας; ἐπόρισας χρήματα; μικρόν τι χρήσιμος ἐγένου τοῖς ὑπὲρ τῆς κοινῆς σωτηρίας πράττουσιν; οὐδʼ ὁτιοῦν, ἀλλὰ περιῄεις κατασκευάζων λογοποιούς, καὶ παρʼ αὑτῷ γράφων ἐπιστολήν, καὶ καταισχύνων τὴν τῆς πόλεως δόξαν, 
36	ἐκ τῶν δακτύλων ἀναψάμενος περιεπορεύετο, τρυφῶν ἐν τοῖς τῆς πόλεως κακοῖς, καὶ ἐπὶ φορείου κατακομιζόμενος τὴν εἰς Πειραιᾶ ὁδόν, καὶ τὰς τῶν πενήτων ἀπορίας ὀνειδίζων. εἶθʼ οὗτος εἰς τοὺς μέλλοντας ὑμῖν καιροὺς ἔσται χρήσιμος, παραβεβηκὼς ἅπαντας τοὺς παρεληλυθότας; τοιούτων, ὦ δέσποινʼ Ἀθηνᾶ καὶ Ζεῦ σῶτερ, συμβούλων καὶ ἡγεμόνων ὤφελον τυχεῖν οἱ πολεμήσαντες τῇ πόλει, τῇ πόλει Stephanus: τὴν πόλιν codd. καὶ μηδεπώποτε μηδεπώποτε Blass: μηδέποτε codd. βελτιόνων. 
37	οὐκ ἀναμνήσεσθε, ὦ ἄνδρες, τὰς τῶν πρεσβυτέρων πράξεις; οἳ μεγάλων καὶ πολλῶν κινδύνων καταλαμβανόντων τὴν πόλιν ἀξίως τῆς πατρίδος καὶ τῆς αὐτῶν ἐλευθερίας καὶ τῆς δόξης τῆς δικαίας δικαίας] παλαιᾶς Bekker: alii alia. ὑπὲρ τῶν τοῦ δημοσίου συμφερόντων ἐκινδύνευσαν; ὧν τοὺς μὲν ἀρχαίους ἐκείνους μακρὸν ἂν εἴη λέγειν, Ἀριστείδην καὶ Θεμιστοκλέα, τοὺς ὀρθώσαντας τὰ τείχη τῆς πόλεως καὶ τοὺς φόρους εἰς ἀκρόπολιν ἀνενεγκόντας παρʼ ἑκόντων καὶ βουλομένων τῶν Ἑλλήνων· 
38	ἀλλὰ ταυτὶ τὰ μικρὸν πρὸ τῆς ἡμετέρας ἡλικίας γεγενημένα ὑπὸ Κεφάλου τοῦ ῥήτορος καὶ Θράσωνος τοῦ Ἑρχιέως Ἑρχιέως Weidner: Ἐρχιέως codd. καὶ Ἠλείου Ἠλείου Reiske: Ἠλιοῦ ΝΑ. καὶ καὶ add. Bergk. Φορμισίου καὶ ἑτέρων ἀνδρῶν ἀγαθῶν, ὧν ἐνίων ἔτι καὶ νῦν ζῇ τὰ σώματα. τούτων γὰρ οἱ μὲν φρουρουμένης ὑπὸ Λακεδαιμονίων τῆς Καδμείας βοηθήσαντες τοῖς εἰς Θήβας κατιοῦσι τῶν φυγάδων τοῖς ἰδίοις κινδύνοις ἠλευθέρωσαν πόλιν ἀστυγείτονα καὶ πολὺν χρόνον δουλεύουσαν, 
39	οἱ δὲ πείσαντος πείσαντος Blass: πείσαντες codd. ἐξελθεῖν ὑμῶν τοὺς προγόνους Κεφάλου τοῦ τὸ τοῦ τὸ Blass: τούτου codd.: τοῦτο τὸ Bekker. ψήφισμα γράψαντος, ὃς οὐ καταπλαγεὶς τὴν Λακεδαιμονίων δύναμιν, οὐδὲ λογισάμενος ὅτι τὸ κινδυνεύειν καὶ τὸ γράφειν ὑπὲρ τῆς πόλεως ἐπισφαλές ἐστιν, ἔγραψεν ἐξιέναι βοηθήσοντας Ἀθηναίους τοῖς κατειληφόσι τῶν φυγάδων Θήβας· καὶ ἐξελθόντων ἐκεῖσε τῶν ὑμετέρων πατέρων ὀλίγαις ἡμέραις ἐξεβλήθη ὁ τῶν τῶν om. N. Λακεδαιμονίων φρούραρχος, ἠλευθέρωντο ἠλευθέρωντο Bekker: ἠλευθεροῦντο codd. Θηβαῖοι, διεπέπρακτο ἡ πόλις ἡ ὑμετέρα ἄξια τῶν προγόνων. 
40	ἐκεῖνοι ἦσαν, ἐκεῖνοι, ὦ Ἀθηναῖοι, ἄξιοι σύμβουλοι καὶ ἡγεμόνες ὑμῶν καὶ τοῦ δήμου· μὰ Δίʼ οὐ τὰ τοιαῦτα κινάδη, οἳ πεποιήκασι μὲν οὐδὲν οὐδὲ πράξουσιν ἀγαθὸν ὑπὲρ τῆς πόλεως, τὴν δὲ αὑτῶν ἀσφάλειαν τηροῦντες καὶ πανταχόθεν πανταχόθεν Blass: πάντοθεν codd. ἀργυριζόμενοι καὶ πεποιηκότες τὴν πόλιν ἀδοξοτέραν ἑαυτῶν, καὶ νῦν εἰλημμένοι δῶρα καθʼ ὑμῶν εἰληφότες, παρακρούονται ὑμᾶς, καὶ ἀξιοῦσι τοιοῦτοι γεγενημένοι περὶ τῆς ἑαυτῶν πλεονεξίας παραγγέλλειν. οὓς χρῆν χρῆν Bekker: χρὴ codd. τεθνάναι πάλαι κατὰ τὸ ἑαυτῶν ψήφισμα, πάλαι κατὰ τὸ ἑαυτῶν ψήφισμα Ν: κατὰ τὸ ἑαυτῶν ψήφισμα πάλαι Α. τοιαῦτα διαπεπραγμένους. 
41	οὐκ αἰσχύνεσθε, ἄνδρες Ἀθηναῖοι, τὴν κατὰ Δημοσθένους τιμωρίαν ἐκ τῶν ἡμετέρων λόγων μόνων ἡγούμενοι δεῖν κρίνειν; οὐκ ἴστε τοῦτον αὐτοὶ δωροδόκον ὄντα καὶ κλέπτην καὶ προδότην τῶν τῶν om. A. φίλων, καὶ τῆς πόλεως ἀνάξιον καὶ αὐτὸν καὶ τὴν περὶ τοῦτον τύχην γεγενημένην; ἀπὸ ποίων ψηφισμάτων οὗτος ἢ ποίων νόμων οὐκ εἴληφεν ἀργύριον; 
42	εἰσί τινες ἐν τῷ δικαστηρίῳ τῶν ἐν τοῖς τριακοσίοις γεγενημένων, ὅθʼ οὗτος ἐτίθει τὸν περὶ τῶν τριηράρχων νόμον; οὐ φράσετε τοῖς πλησίον ὅτι τρία τάλαντα λαβὼν μετέγραφε καὶ μετεσκεύαζε τὸν νόμον καθʼ ἑκάστην ἐκκλησίαν, καὶ τὰ μὲν ἐπώλει ὧν εἰλήφει τὴν τιμήν, τὰ δʼ ἀποδόμενος οὐκ ἐβεβαίου; 
43	εἴπατέ μοι πρὸς Διός, ὦ ἄνδρες, προῖκα τοῦτον οἴεσθε γράψαι Διφίλῳ τὴν ἐν πρυτανείῳ σίτησιν, καὶ τὴν εἰς τὴν ἀγορὰν ἀνατεθησομένην ἀνατεθησομένην Reiske: ἀναθησομένην codd. εἰκόνα; ἢ τὸ ποιῆσαι πολίτας ὑμετέρους ὑμετέρους (coll. 44) Blass: ὑμᾶς codd. Χαιρέφιλον καὶ Φείδωνα καὶ Πάμφιλον καὶ Φείδιππον, Φείδιππον Bergk: Φίλιππον codd. ἢ πάλιν Ἐπιγένην καὶ Κόνωνα τοὺς τραπεζίτας; ἢ τὸ χαλκοῦς ἐν ἀγορᾷ στῆσαι Βηρισάδην Βηρισάδην Ald.: Βιρισάδην codd.: Παιρισάδην Thalheim. καὶ Σάτυρον καὶ Γόργιππον τοὺς ἐκ τοῦ Πόντου ἐκ τοῦ Πόντου Baiter: ἐκ τούτων codd.: ἐχθίστους Ald. τυράννους, παρʼ ὧν αὐτῷ χίλιοι μέδιμνοι μέδιμνοι Gibbon: μόδιοι codd. τοῦ ἐνιαυτοῦ πυρῶν ἀποστέλλονται τῷ οὐδʼ ὅποι ὅποι Ν: ὅπῃ Α. καταφύγῃ αὐτίκα φήσοντι εἶναι; 
44	ἢ τὸ γράψαι Ταυροσθένην Ἀθηναῖον εἶναι, τὸν τὸν add. Baiter. τοὺς μὲν αὑτοῦ πολίτας καταδουλωσάμενον, τῆς δʼ Εὐβοίας ὅλης μετὰ τοῦ ἀδελφοῦ Καλλίου προδότην Φιλίππῳ γεγενημένον; ὃν οὐκ ἐῶσιν οἱ νόμοι τῆς Ἀθηναίων χώρας ἐπιβαίνειν, εἰ δὲ μή, τοῖς αὐτοῖς ἔνοχον εἶναι κελεύουσιν οἷσπερ ἄν τις τῶν φευγόντων ἐξ Ἀρείου πάγου κατίῃ. κατίῃ Ν: κατίοι Α. καὶ τοῦτον οὗτος ὁ δημοτικὸς ὑμέτερον ἔγραψε πολίτην εἶναι. 
45	περὶ τούτων οὖν μάρτυρας ὑμῖν δεῖ καλεῖν, ἢ περὶ τῶν ἄλλων ὅσους οὗτος γέγραφε προξένους εἶναι καὶ Ἀθηναίους; εἶτα , εἶτα add. Gebauer. πρὸς τῆς Ἀθηνᾶς, οἴεσθʼ αὐτὸν ἀργύριον μὲν χαίρειν λαμβάνοντα, χρυσίου δʼ εἴκοσι τάλαντʼ οὐκ ἂν λαβεῖν; ἢ κατὰ μικρὸν μὲν δωροδοκεῖν, ἁθρόον δʼ οὐκ ἂν προσδέξασθαι τοσοῦτον λῆμμα; ἢ τὴν ἐξ Ἀρείου πάγου βουλὴν Δημοσθένην καὶ Δημάδην καὶ Κηφισοφῶντα ζητήσασαν ἓξ μῆνας ἀδίκως εἰς ὑμᾶς πεποιῆσθαι τὰς ἀποφάσεις; 
46	πολλοί, ὦ ἄνδρες, πολλοὶ τῶν πολιτῶν καὶ τῶν ἄλλων Ἑλλήνων, ὅπερ καὶ πρότερον εἶπον, θεωροῦσιν ὑμᾶς πῶς τοῦτον δικάσετε τὸν ἀγῶνα, καὶ πότερον εἰσαγωγίμους καὶ τὰς τῶν τὰς τῶν Α: τὰς κατὰ τῶν Ν. ἄλλων δωροδοκίας ποιήσετε, ἢ ἀνέδην ἐξέσται δῶρα λαμβάνειν καθʼ ὑμῶν, καὶ τὰ πρότερον δοκοῦντα πιστὰ καὶ βέβαιʼ εἶναι νῦν ἄπιστα διὰ τὴν Δημοσθένους κρίσιν γενήσεται, ὃν ἐκ τῶν ἄλλων προσῆκεν ἀπολωλέναι τῶν πεπολιτευμένων αὐτῷ, ὃς ἁπάσαις ταῖς ἀραῖς ταῖς ἐν τῇ πόλει γιγνομέναις γιγνομέναις Blass: γενομέναις codd. ἔνοχος καθέστηκεν, 
47	ἐπιωρκηκὼς μὲν τὰς σεμνὰς θεὰς ἐν Ἀρείῳ πάγῳ καὶ τοὺς ἄλλους θεοὺς οὓς ἐκεῖ διόμνυσθαι νόμιμόν ἐστι, κατάρατος δὲ καθʼ ἑκάστην ἐκκλησίαν γιγνόμενος, γιγνόμενος Blass: γενόμενος A pr. N: γινόμενος A corr. ἐξεληλεγμένος δῶρα κατὰ τῆς πόλεως εἰληφώς, ἐξηπατηκὼς δὲ καὶ τὸν δῆμον καὶ τὴν βουλὴν παρὰ τὴν ἀράν, καὶ ἕτερα μὲν λέγων ἕτερα δὲ φρονῶν, ἰδίᾳ δὲ συμβεβουλευκὼς Ἀριστάρχῳ δεινὰς καὶ παρανόμους συμβουλάς, ἀνθʼ ὧν — εἴπερ ἐστί που δικαία τιμωρία κατὰ τῶν ἐπιόρκων καὶ πονηρῶν, ὥσπερ ἔστι — δώσει δίκην οὗτος ἐν τῇ τήμερον ἡμέρᾳ. ἀκούσατʼ, ἄνδρες δικασταί, τῆς ἀρᾶς.
48	Ἀρά ἀλλʼ ὅμως, ἄνδρες δικασταί, οὕτω Δημοσθένης τῷ ψεύδεσθαι καὶ μηδὲν ὑγιὲς λέγειν ἑτοίμως χρῆται, καὶ οὔτʼ αἰσχύνης οὔτʼ ἐλέγχου οὔτʼ ἀρᾶς οὐδὲν αὐτῷ μέλει, ὥστε καὶ περὶ ἐμοῦ τολμήσει λέγειν, ὡς ἀκούω, ὡς ἄρα κἀμοῦ κατέγνω πρότερον ἡ βουλή· καὶ ποιῶ πάντων ἀτοπώτατον, ὡς οὗτός φησι, πρότερον μὲν ἐναντίον τῇ τῆς βουλῆς ἀποφάσει ἀγῶνα ἀπολογούμενος ὑπὲρ ἐμαυτοῦ, νυνὶ δὲ συνηγορῶν αὐτῇ, κατηγορῶν τούτου περὶ τῆς γεγενημένης ἀποφάσεως· 
49	πρᾶγμα κατασκευάζων οὐ γεγενημένον, ἀλλὰ ψεύδεσθαι πρὸς ὑμᾶς πρὸς ὑμᾶς Baiter et Sauppe: πρός τινας codd. τολμῶν. ἵνʼ οὖν, ἐὰν ἐπὶ τοῦτον ἴῃ τὸν λόγον, μὴ ἐπιτρέπητʼ αὐτῷ, ἀλλʼ εἰδῆτʼ ἀκριβῶς ὅτι οὔτε μʼ ἀπέφηνεν ἡ βουλὴ οὔτʼ ἐμέλλησεν, ἠδικήθην δὲ ὑφʼ ἑνὸς ἀνθρώπου πονηροῦ καὶ δίκην δεδωκότος παρʼ ὑμῖν, ἀκούσατέ μου βραχέα· ἔπειτʼ ἐπὶ τοῦτον πάλιν βαδιοῦμαι. 
50	ἀνάγκη τὴν βουλήν, ὦ ἄνδρες, τὴν ἐξ Ἀρείου πάλου κατὰ δύο τρόπους ποιεῖσθαι τὰς ἀποφάσεις πάσας. τίνας τούτους; ἤτοι αὐτὴν προελομένην καὶ ζητήσασαν, ἢ τοῦ δήμου προστάξαντος αὐτῇ. χωρὶς τούτων οὐκ ἔστιν ὅντινʼ ἂν ὅντινʼ ἂν Baiter et Sauppe: ὅντινα codd. τρόπον ποιήσειεν. εἰ μὲν τοίνυν φῄς, ὦ μιαρὸν σὺ θηρίον, τοῦ δήμου προστάξαντος ζητήσασαν τὴν βουλὴν περὶ ἐμοῦ ποιήσασθαι τὴν ἀπόφασιν, 
51	δεῖξον τὸ ψήφισμα, καὶ τίνες ἐγένοντο μου κατήγοροι γενομένης τῆς ἀποφάσεως, ὥσπερ νῦν ἀμφότερα γέγονε, καὶ ψήφισμα καθʼ ὃ ἐζήτησεν ἡ βουλή, καὶ κατήγοροι χειροτονήσαντος τοῦ δήμου, παρʼ ὧν νῦν οἱ δικασταὶ τἀδικήματα πυνθάνονται. κἂν ᾖ ταῦτα ἀληθῆ, ἀποθνήσκειν ἕτοιμός εἰμι. εἰ δʼ αὐτὴν προελομένην ἀποφῆναί με φῄς, παράσχου μάρτυρας τοὺς Ἀρεοπαγίτας, ὥσπερ ἐγὼ παρέξομαι ὅτι οὐκ ἀπεφάνθην. 
52	καταψευσάμενον μέντοι κἀμοῦ καὶ τῆς βουλῆς ὥσπερ σὺ καὶ πονηρὸν καὶ προδότην ἕνʼ ἕνʼ Blass: ὃν A pr. (del. ras.) N: ὄντʼ Franke. εἰσαγγείλας, καὶ ἐξελέγξας ἐν πεντακοσίοις καὶ δισχιλίοις τῶν πολιτῶν ὅτι μισθώσας αὑτὸν Πυθοκλεῖ Πυθοκλεῖ Ν: Τιμοκλεῖ Α. κατʼ ἐμοῦ ταῦτʼ ἔπραξεν, ἐτιμωρησάμην μετὰ τῶν τότε δικασάντων. λαβέ μοι σὺ τὴν μαρτυρίαν, ἣν καὶ πρότερον παρεσχόμην μαρτυρουμένην τοῖς δικασταῖς καὶ οὐδεὶς ἐπεσκήψατο ὡς ψευδεῖ οὔσῃ, ἣν καὶ νῦν παρέξομαι. λέγε τὴν μαρτυρίαν.
53	Μαρτυρία εἶτʼ οὐ δεινόν, ὦ Ἀθηναῖοι, εἰ, ὅτι μὲν εἷς ἀνὴρ ἔφησε Πιστίας Ἀρεοπαγίτης ὢν ἀδικεῖν με, καταψευδόμενος κἀμοῦ κἀμοῦ Α corr. (2): κατʼ ἐμοῦ A pr. N. καὶ τῆς βουλῆς, ἴσχυσεν ἂν τὸ ψεῦδος τῆς ἀληθείας μᾶλλον, εἰ εἰ Gebauer: καὶ codd. διὰ τὴν ἀσθένειαν τὴν τότε καὶ τὴν ἐρημίαν τὴν ἐμὴν ἐπιστεύθησαν αἱ κατʼ ἐμοῦ ψευδεῖς γενόμεναι γενόμεναι Blass: γινόμεναι codd. κατασκευαί· ἐπειδὴ δὲ τἀληθὲς παρὰ πάσης τῆς ἐξ Ἀρείου πάγου βουλῆς ὁμολογεῖται, Δημοσθένην εἰληφέναι εἴκοσι τάλαντα χρυσίου καθʼ ὑμῶν καὶ ταῦτα πεποιηκότʼ ἀδικεῖν, καὶ ὁ δημαγωγὸς ὑμῖν, ἐν ᾧ τὰς ἐλπίδας ἔχουσί τινες, 
54	ἐπʼ αὐτοφώρω χρήματα λαμβάνων εἴληπται, νῦν τὰ νόμιμα τἀκεῖθεν καὶ τὰ δίκαια καὶ τἀληθῆ ἀσθενέστερα γενήσεται τῶν Δημοσθένους λόγων, καὶ ἰσχύσει μᾶλλον τῆς ἀληθείας ἡ παρὰ τούτου ῥηθησομένη κατὰ τοῦ συνεδρίου διαβολή, ὡς ἄρα πολλοὺς ἡ βουλὴ ἀποπέφαγκεν ἀδικεῖν τὸν δῆμον, οἳ ἀποπεφεύγασιν εἰσελθόντες εἰς τὸ δικαστήριον, καὶ ἡ βουλὴ ἐπʼ ἐνίων τὸ πέμπτον μέρος οὐ μετείληφε τῶν ψήφων; τοῦτο δὲ ὃν τρόπον γίγνεται, ῥᾳδίως ἅπαντες μαθήσεσθε. 
55	ἡ βουλή, ὦ ἄνδρες, ζητεῖ τὰ προσταχθένθʼ ὑφʼ ὑμῶν καὶ τὰ γεγενημένα παρʼ αὑτοῖς αὑτοῖς Bekker: αὐτοῖς codd. ἀδικήματʼ οὐχ ὡς ὑμεῖς — καί μοι μὴ ὀργισθῆτε — δικάζειν ἐνίοτε εἴθισθε, τῇ σῇ γνώμῃ πλέον ἢ τῷ δικαίῳ ἀπονέμοντες, ἀλλʼ ἁπλῶς τὸν ἔνοχον ὄντα τοῖς ζητουμένοις ἀποφαίνει ἀποφαίνει add. Wolf. καὶ τὸν ὁποιονοῦν ἠδικηκότα παρὰ παρὰ add. Blass. τὰ πάτρια, νομίζουσα τὸν ἐν τοῖς μικροῖς συνεθιζόμενον ἀδικεῖν τοῦτον τὰ μεγάλα τῶν ἀδικημάτων εὐχερέστερον προσδέξεσθαι. 
