56	διόπερ τὸν παρʼ αὑτῶν ἀποστερήσαντα τὸ ναῦλον τὸν πορθμέα ζημιώσασα πρὸς ὑμᾶς ἀπέφηνε· πάλιν τὸν τὴν πεντεδραχμίαν ἐπὶ τῷ τοῦ μὴ παρόντος ὀνόματι λαβεῖν ἀξιώσαντα, καὶ τοῦτον ὑμῖν ἀπέφηνε, καὶ τὸν τὴν μερίδα τὴν ἐξ Ἀρείου πάγου τολμήσαντʼ ἀποδόσθαι παρὰ τὰ νόμιμα τὸν αὐτὸν τρόπον ζημιώσασʼ ἐξέβαλε. 
57	τούτους ὑμεῖς κρίναντες ἀφήκατε, οὐ τῆς ἐξ Ἀρείου πάγου βουλῆς καταγιγνώσκοντες ψεύδεσθαι, ἀλλὰ τῇ συγγνώμῃ μᾶλλον ἢ τῷ δικαίῳ προσθέμενοι, καὶ τὴν τιμωρίαν μείζω νομίζοντες εἶναι τῆς ὑπὸ τῶν κρινομένων γεγενημένης ἁμαρτίας. ἦ που ἄρα ἡ βουλή, Δημόσθενες, τὰ ψευδῆ ἀπέφηνεν; οὐ δήπου. τούτους μέντοι, ὦ ἄνδρες, καὶ τοιούτους ἑτέρους ἀδικεῖν παρʼ ἑαυτοῖς ἑαυτοῖς Blass: ἑαυτῆς codd.: ἑαυτῇ Reiske. ἀποφηνάσης τῆς βουλῆς ὑμεῖς ἀφήκατε. 
58	πολύευκτον δὲ τὸν Κυδαντίδην τοῦ δήμου προστάξαντος ζητῆσαι τὴν βουλήν, εἰ συνέρχεται τοῖς φυγάσιν εἰς Μέγαρα, καὶ ζητήσασαν ἀποφῆναι πρὸς ὑμᾶς, ἀπέφηνεν ἡ βουλὴ συνιέναι. κατηγόρους εἵλεσθε κατὰ τὸν νόμον, εἰσῆλθεν εἰς τὸ δικαστήριον, ἀπελύσαθʼ ὑμεῖς, ὁμολογοῦντος τοῦ τοῦ om. A. Πολυεύκτου βαδίζειν εἰς Μέγαρʼ ὡς τὸν Νικοφάνην· ἔχειν γὰρ τὴν αὑτοῦ μητέρα τοῦτον. οὐδὲν οὖν ἄτοπον οὐδὲ δεινὸν ἐφαίνεθʼ ὑμῖν ποιεῖν τῷ τῆς μητρὸς ἀνδρὶ διαλεγόμενος ἠτυχηκότι καὶ συνευπορῶν, καθʼ ὅσον δυνατὸς ἦν, ἀπεστερημένῳ τῆς πατρίδος. 
59	αὕτη, Δημόσθενες, τῆς βουλῆς ἡ ἀπόφασις οὐκ ἐξηλέγχθη ψευδὴς οὖσα, ἀληθινῆς δὲ αὐτῆς οὔσης ἔδοξε τοῖς δικασταῖς ἀφεῖναι ἀφεῖναι Blass: ἀφιέναι codd. τὸν Πολύευκτον· τὸ μὲν γὰρ ἀληθὲς τῇ βουλῇ προσετάχθη ζητεῖν, τὸ δὲ συγγνώμης ἄξιόν φημι φημι] ἢ μὴ Reiske. τὸ δικαστήριον ἔκρινε. διὰ τοῦτʼ οὐ πιστευτέον τῇ βουλῇ περὶ τῶν γιγνομένων γιγνομένων Blass: γινομένων Ν: γενομένων Α. ἀποφάσεων, ἐπειδή σε καὶ τοὺς μετὰ σοῦ τὸ χρυσίον ἔχοντας ἀποπέφαγκε; δεινὸν μέντʼ ἂν εἴη. 
60	δεῖξον γὰρ τοῖς δικασταῖς σύ, Δημόσθενες, νυνὶ ὡς τούτων τι τῶν ἁμαρτημάτων ἁμαρτημάτων Sauppe: ἡμαρτηκότων codd. ὅμοιόν ἐστι τοῖς σοῖς ἀδικήμασι, καὶ ὡς τὸ δῶρα λαμβάνειν κατὰ τῆς πατρίδος συγγνώμης ἐστὶν ἄξιον, ὥστʼ ἀποφύγοις ἂν παρὰ τούτοις εἰκότως. ἀλλʼ οἱ νόμοι περὶ μὲν τῶν ἄλλων ἀδικημάτων τῶν εἰς ἀργυρίου λόγον ἀνηκόντων διπλῆν τὴν βλάβην ὀφλεῖν ὀφλεῖν Meier: ὀφείλειν codd κελεύουσι, περὶ δὲ τῶν δωροδοκούντων δύο μόνον τιμήματα πεποιήκασιν, ἢ φάνατον, ἵνα ταύτης τυχὼν τῆς ζημίας ὁ λαβὼν παράδειγμα γένηται τοῖς ἄλλοις, ἢ δεκαπλοῦν τοῦ ἐξ ἀρχῆς λήμματος τὸ τίμημα τῶν δώρων, ἵνα μὴ λυσιτελήσῃ λυσιτελήσῃ Blass: λυσιτελὴς ᾖ N A pr.: λυσιτελὲς ᾖ A corr. τοῖς τοῦτο τολμῶσι ποιεῖν. 
61	ἢ τοῦτο μὲν οὐκ ἐπιχειρήσεις λέγειν, ὅτι δὲ τῶν πρότερον πρότερον Scaliger: προτέρων codd. ἀποφανθέντων ὑπὸ τῆς βουλῆς, τοῖς μὲν ἄλλοις ὡμολογηκέναι συμβέβηκεν ἀξίαν εἶναι τὴν τῆς βουλῆς ζημίαν, ζημίαν A pr.: ζήτησιν A corr. N. σοὶ δὲ μόνῳ τὰ τὰ] del. Dobree. περὶ αὐτῆς ἠναντιῶσθαι. ἀλλὰ μόνος σὺ τῶν πώποτʼ ἀποπεφασμένων ἠξίωσας ἑκὼν σεαυτῷ τούτους κριτὰς καὶ ζητητὰς γενέσθαι, καὶ ἔγραψας κατὰ σαυτοῦ τὸ ψήφισμα, καὶ τὸν δῆμον ἐποιήσω μάρτυρα τῶν ὡμολογημένων, ὁρισάμενος σεαυτῷ ζημίαν εἶναι θάνατον, ἐὰν ἀποφήνῃ σʼ σʼ add. Blass. ἡ βουλὴ τῶν χρημάτων εἰληφότα τι τῶν εἰς τὴν χώραν ὑφʼ Ἁρπάλου κομισθέντων. 
62	ἀλλὰ μὴν πρότερον ἔγραψας σύ, ὦ Δημόσθενες, κατὰ πάντων τούτων καὶ τῶν ἄλλων Ἀθηναίων κυρίαν εἶναι τὴν ἐξ Ἀρείου πάγου βουλὴν κολάσαι τὸν παρὰ τοὺς νόμους πλημμελοῦντα, χρωμένην τοῖς πατρίοις πατρίοις Wolf: πατρώοις codd. νόμοις· καὶ παρέδωκας σὺ καὶ ἐνεχείρισας τὴν πόλιν ἅπασαν ταύτῃ, ἣν αὐτίκα φήσεις ὀλιγαρχικὴν εἶναι· καὶ τεθνᾶσι κατὰ τὸ σὸν ψήφισμα δύο τῶν πολιτῶν, πατὴρ καὶ υἱός, παραδοθέντες τῷ ἐπὶ τῷ ὀρύγματι· 
63	ἐδέθη τῶν ἀφʼ Ἁρμοδίου γεγονότων εἷς κατὰ τὸ σὸν πρόσταγμα· ἐστρέβλωσαν Ἀντιφῶντα καὶ ἀπέκτειναν οὗτοι τῇ τῆς βουλῆς ἀποφάσει πεισθέντες· ἐξέβαλες σὺ Χαρῖνον Χαρῖνον Rohdewald: Ἀρχίνον codd. ἐκ τῆς πόλεως ἐπὶ προδοσίᾳ κατὰ τὰς τῆς βουλῆς ἀποφάσεις καὶ τιμωρίας. κατὰ δὲ σαυτοῦ καὶ ταῦτα γράψας αὐτὸς τὸ ψήφισμʼ ἀκυροῖς; καὶ ποῦ ταῦτα δίκαια ἢ νόμιμά ἐστι; 
64	μαρτύρομαι τὰς σεμνὰς θεάς, ἄνδρες Ἀθηναῖοι, καὶ τὸν τόπον ὃν ἐκεῖναι κατέχουσι, καὶ τοὺς ἥρωας τοὺς ἐγχωρίους, καὶ τὴν Ἀθηνᾶν τὴν Πολιάδα Πολιάδα Wolf: πολίτιδα codd. καὶ τοὺς ἄλλους θεοὺς οἳ τὴν χώραν καὶ τὴν πόλιν ἡμῶν εἰλήχασιν, ὅτι τοῦ δήμου παραδεδωκότος ὑμῖν τιμωρήσασθαι τιμωρήσασθαι Α· Τιμωρής. τε N pr.: τιμωρήσατε N corr. (2): οὐκ ἐτιμωρήσασθε Ald. τὸν εἰληφότα τι τῶν Post τῶν nonnihil excidisse videtur: κομισθέντων χρημάτων supplendum ci. Blass (coll. 70). κατὰ τῆς πατρίδος, τὸν λελυμασμένον καὶ ἐφθαρκότα τὴν τῆς πόλεως εὐδαιμονίαν, τὸν περικεχαρακωμένην προδεδωκότα προδεδωκότα Schmidt: παραδεδωκότα codd. τὴν πατρίδα ταῖς αὑτοῦ συμβουλίαις, 
65	[ὃν] ὃν del. Thalheim. οἱ μὲν ἐχθροὶ καὶ κακόνοι τῇ πόλει τῇ πόλει Kleyn: τῆς πολέως codd. ζῆν ἂν βούλοιντο, συμφορὰν ἡγούμενοι τῆς πόλεως εἶναι, ὅσοι δὲ εὖνοι τοῖς ὑμετέροις πράγμασι, καὶ μεταπεσούσης τῆς τύχης ἐλπίζουσιν ἐπὶ τὸ βέλτιον ἂν τὰ τῆς πόλεως πράγματʼ ἐλθεῖν, τὴν ἀξίαν δίκην δόντα τῶν πεπραγμένων ἀπολωλέναι βούλονται, καὶ ταῦτʼ εὔχονται τοῖς θεοῖς· οὓς κἀγὼ συμπαρακαλῶ σῶσαι τὴν πατρίδα, κινδυνεύουσαν ὁρῶν ὑπὲρ σωτηρίας, ὑπὲρ παίδων, ὑπὲρ γυναικῶν, ὑπὲρ δόξης, ὑπὲρ τῶν ἄλλων ἀγαθῶν ἁπάντων. 
66	τί γὰρ ἐροῦμεν, ὦ Ἀθηναῖοι, πρὸς τοὺς περιεστηκότας ἐξελθόντες ἐκ τοῦ δικαστηρίου, ἐάν, ὃ μὴ γένοιτο, παρακρουσθῆτε ὑπὸ τῆς τούτου γοητείας; τίσιν ὀφθαλμοῖς ἕκαστος ὑμῶν τὴν πατρῴαν ἑστίαν οἴκαδʼ ἀπελθὼν ἰδεῖν τολμήσει, τολμήσει Bekker: τολμήσειε Ν: τολμήσειεν Α. ἀπολελυκότες μὲν τὸν προδότην τὸν πρῶτον εἰς τὸν ἴδιον οἶκον εἰσενεγκάμενον τὸ δεδωροδοκημένον χρυσίον, κατεγνωκότες δὲ μηδὲν ἀληθὲς μήτε μήτε Bekker: μηδὲ codd. ζητεῖν μήθʼ εὑρίσκειν τὸ παρὰ πᾶσιν ἀνθρώποις εἶναι σεμνότατον νομιζόμενον συνέδριον; 
67	τίνας δʼ, ὦ Ἀθηναῖοι, — σκοπεῖτε γὰρ πρὸς ὑμᾶς αὐτούς —, τίνας τὰς ἐλπίδας ἕξομεν, ἐὰν κίνδυνός τις καταλάβῃ τὴν πόλιν, τὸ μὲν δῶρα λαμβάνειν κατὰ τῆς πατρίδος ἀσφαλὲς εἶναι πεποιηκότες, τὸ δὲ τὴν φυλακὴν ἔχον συνέδριον τῆς πόλεως ἐν τοῖς τοιούτοις κινδύνοις ἀδόκιμον καταστήσαντες; 
68	τί δʼ ἐάν — τιθῶμεν τί δʼ ἐάν, — τιθῶμεν Funkhaenel: τί δέ, ἀντιθῶμεν Α: τί δαὶ ἀντιθῶμεν Ν. γὰρ ταῦτα —, ἐὰν κατὰ τὸ ψήφισμα τὸ Δημοσθένους ἀπαιτῇ πέμψας ἡμᾶς Ἀλέξανδρος τὸ χρυσίον τὸ κομισθὲν εἰς τὴν χώραν ὑφʼ Ἁρπάλου, καὶ πρὸς τῷ γεγενῆσθαι τὴν τῆς βουλῆς ἀπόφασιν τοὺς παῖδας καταπέμψῃ πρὸς ἡμᾶς τοὺς νῦν ὡς ἑαυτὸν ἀνακεκομισμένους, καὶ τούτων ἀξιοῖ πυνθάνεσθαι τὴν ἀλήθειαν ἡμᾶς, ἡμᾶς Baiter et Sauppe: ὑμᾶς codd. πρὸς θεῶν, ὦ ἄνδρες, τί ἐροῦμεν; 
69	γράψεις γράψεις Stephanus: γράφεις codd. σύ, Δημόσθενες, πολεμεῖν ἡμᾶς, ἐπειδὴ καὶ τοὺς πρότερον πολέμους καλῶς διῴκησας; καὶ πότερόν ἐστι δικαιότερον, ἂν ταῦτα δόξῃ καὶ τοῖς ἄλλοις Ἀθηναίοις, εἰς τὸν πόλεμον ὑπάρχειν μετὰ τῶν ἄλλων καὶ τὸ παρὰ σοῦ χρυσίον, ἢ τοὺς μὲν ἄλλους ἀπὸ τῶν ἰδίων κτημάτων ἕκαστον εἰσφέρειν, καὶ καταχωνεύειν τὸν ἴδιον κόσμον τῶν γυναικῶν, καὶ τὰ ἐκπώματα, καὶ πάντα τὰ ἐν τῇ χώρᾳ ἀναθήματα τῶν θεῶν, ὥσπερ ἔφησθα σὺ γράψειν, γράψειν Stephanus: γράφειν codd. αὐτὸς εἰσενεγκὼν πεντήκοντα δραχμὰς ἀπὸ τῆς οἰκίας τῆς ἐν Πειραιεῖ, καὶ τῆς ἐν ἄστει; τοσοῦτον γὰρ κατὰ τὴν προτέραν εἰσφορὰν εἰσενηνοχώς, εἴκοσι τάλαντʼ ἔχεις. 
70	ἢ πολεμεῖν μὲν οὐ γράψεις, ἀποδιδόναι δὲ κατὰ τὸ γεγραμμένον ὑπὸ σοῦ ψήφισμα κελεύσεις κελεύσεις Stephanus: κελεύεις codd. Ἀλεξάνδρῳ τὸ κεκομισμένον χρυσίον; οὐκοῦν ὑπὲρ σοῦ τὸν δῆμον ἀποδιδόναι δεήσει. καὶ ποῦ τοῦτʼ ἐστὶ δίκαιον ἢ κοινὸν ἢ δημοτικόν, τοὺς μὲν ἐργαζομένους εἰσφέρειν, σὲ δʼ ἁρπάζειν καὶ κλέπτειν; καὶ κλέπτειν add. N. καὶ τοὺς μὲν φανερὰν κεκτῆσθαι τὴν οὐσίαν καὶ ἀπὸ ταύτης εἰσφέρειν, σὲ δὲ πλείω ἢ πεντήκοντα καὶ ἑκατὸν τάλαντα, τὰ μὲν ἐκ τῶν βασιλικῶν, τὰ δʼ ἐκ τῶν Ἀλεξάνδρου πραγμάτων, εἰληφέναι, μηδὲν δὲ φανερὸν ἐν τῇ πόλει κεκτῆσθαι, ἀλλὰ διεσκευάσθαι πρὸς τὸν δῆμον ὡς οὐ πιστεύοντα τοῖς ἑαυτῷ πολιτευομένοις; 
71	καὶ τοὺς μὲν νόμους προλέγειν τῷ ῥήτορι καὶ τῷ στρατηγῷ, τῷ τῷ add. Reiske. τὴν παρὰ τοῦ δήμου πίστιν ἀξιοῦντι λαμβάνειν, παιδοποιεῖσθαι κατὰ τοὺς νόμους, γῆν ἐντὸς ὅρων κεκτῆσθαι, πάσας τὰς δικαίας πίστεις παρακαταθέμενον οὕτως ἀξιοῦν προεστάναι τοῦ δήμου· σὲ δὲ τὴν μὲν μὲν add. Blass. πατρῴαν γῆν πεπρακέναι, τοὺς δʼ οὐ γεγενημένους υἱεῖς σαυτῷ προσποιεῖσθαι παρὰ τοὺς νόμους τῶν ἐν ταῖς κρίσεσιν ἕνεκα γιγνομένων ὅρκων, ἐπιτάττειν δὲ τοῖς ἄλλοις στρατεύεσθαι λιπόντʼ αὐτὸν τὴν κοινὴν τάξιν. 
72	ὦ Ἀθηναῖοι, παρὰ τί οἴεσθε τὰς πόλεις τοτὲ μὲν εὖ τοτὲ δὲ φαύλως πράττειν; οὐδὲν εὑρήσετʼ ἄλλο πλὴν παρὰ τοὺς συμβούλους καὶ τοὺς ἡγεμόνας. ἐπιβλέψατε δʼ ἐπὶ τὴν Θηβαίων πόλιν. ἐγένετο πότε ante ἐγένετο add. Stephanus, ante καὶ τίνων Blass. πόλις, Verba πόλις, ἐγένετο del. Dobree. ἐγένετο μεγίστη· καὶ τίνων τυχοῦσα ἡγεμόνων καὶ στρατηγῶν; ἅπαντες ἂν ὁμολογήσαιεν οἱ οἱ add. Reiske. πρεσβύτεροι, παρʼ ὧνπερ κἀγὼ τοὺς λόγους ἀκούων ἐρῶ, 
73	ὅτε Πελοπίδας, ὥς φασιν, ἡγεῖτο τοῦ ἱεροῦ λόχου λόχου A corr. (2): λόγου A pr. N. καὶ Ἐπαμινώνδας ἐστρατήγει καὶ οἱ μετὰ τούτων, τότε τὴν ἐν Λεύκτροις μάχην ἐνίκησεν ἡ τῶν Θηβαίων πόλις, τότʼ εἰς τὴν ἀπόρθητον νομιζομένην εἶναι Λακεδαιμονίων χώραν εἰσέβαλον, κατʼ ἐκείνους τοὺς χρόνους πολλὰ καὶ καλὰ διεπράξαντʼ ἔργα, Μεσσήνην τετρακοσιοστῷ ἔτει κατῴκισαν, Ἀρκάδας αὐτονόμους ἐποίησαν, ἔνδοξοι παρὰ πᾶσιν ἦσαν. 
74	πότε δʼ αὖ τοὐναντίον ταπεινὰ καὶ τοῦ φρονήματος ἀνάξια διεπράξαντο; ὅτʼ ἐδωροδόκει μὲν λαμβάνων χρήματα παρὰ Φιλίππου Τιμόλαος ὁ τούτου φίλος, ἐπὶ δὲ τοῖς ξένοις τοῖς εἰς Ἄμφισσαν συλλεγεῖσι Πρόξενος ὁ προδότης ἐγένετο, ἡγεμὼν δὲ τῆς φάλαγγος κατέστη Θεαγένης, ἄνθρωπος ἀτυχὴς καὶ δωροδόκος ὥσπερ οὗτος. τότε διὰ τρεῖς γʼ ἀνθρώπους οὓς εἶπον ἅπασʼ ἡ πόλις ἐκ τῶν Ἑλλήνων (ἐκ?) τῶν Ἑλλήνων A pr.: μετὰ τῶν Ἑλλήνων ἁπάντων A corr.: μετὰ τῶν ἄλλων Ἑλλήνων Ν. ἀπώλετο καὶ διεφθάρη. οὐ γὰρ ψεῦδός ἐστιν ἀλλὰ καὶ λίαν ἀληθὲς τὸ τοὺς ἡγεμόνας αἰτίους ἁπάντων γίγνεσθαι καὶ τῶν ἀγαθῶν καὶ τῶν ἐναντίων τοῖς πολίταις. 
75	θεωρήσατε δὴ πάλιν καὶ ἐπὶ τῆς ἡμετέρας πόλεως, τὸν αὐτὸν τρόπον ἐξετάσαντες. ἡ πόλις ἡμῶν ἦν μεγάλη καὶ ἔνδοξος παρὰ τοῖς Ἕλλησι καὶ τῶν προγόνων ἀξία, μετά γε τὰς ἀρχαίας ἐκείνας πράξεις, ὅτε Κόνων, ὡς οἱ πρεσβύτεροι λέγουσιν, ἐνίκησε τὴν ἐν Κνίδῳ ναυμαχίαν, ὅτʼ Ἰφικράτης ἀνεῖλε τὴν Λακεδαιμονίων μόραν, μόραν Scaliger: μοῖραν codd. ὅτε Χαβρίας ἐν Νάξῳ κατεναυμάχησε τὰς Λακεδαιμονίων τριήρεις, ὅτε Τιμόθεος τὴν ἐν Κερκύρᾳ ναυμαχίαν ἐνίκησε. 
76	τότε, ὦ Ἀθηναῖοι, τότε οἱ μὲν πρότερον ὄντες λαμπροὶ διὰ τοὺς ἡγεμόνας Λακεδαιμόνιοι καὶ ὑπὸ τοῖς ἐκείνων ἤθεσι τραφέντες ταπεινοὶ πρὸς τὴν πόλιν ἡμῶν ἧκον, δεόμενοι τῆς παρὰ τῶν προγόνων ἡμῶν σωτηρίας, ὁ δὲ καταλυθεὶς ὑπʼ ἐκείνων δῆμος διὰ τοὺς τότε γενομένους παρʼ ἡμῖν ἡμῖν Sauppe: ὑμῖν codd. συμβούλους πάλιν ἡγεμὼν ἦν τῶν Ἑλλήνων, δικαίως οἶμαι, στρατηγῶν μὲν τοιούτων τετυχηκὼς οἵων εἶπον ἀρτίως, συμβούλους δʼ ἔχων Ἀρχῖνον καὶ Κέφαλον τὸν Κολλυτέα. μία γὰρ αὕτη σωτηρία καὶ πόλεως καὶ ἔθνους ἐστί, τὸ προστατῶν ἀνδρῶν ἀγαθῶν καὶ συμβούλων σπουδαίων τυχεῖν. 
77	διόπερ, ὦ Ἀθηναῖοι, δεῖ ταῦθʼ ὑμᾶς ὁρῶντας καὶ λογιζομένους μὴ μὰ Δία τὸν πλείω χρόνον τῆς Δημοσθένους δωροδοκίας καὶ ἀτυχίας κοινωνεῖν, μηδʼ ἐν τούτῳ τὰς ἐλπίδας τῆς σωτηρίας ἔχειν, μηδʼ οἴεσθαι ἀπορήσειν ἀνδρῶν ἀγαθῶν καὶ συμβούλων σπουδαίων, ἀλλὰ τὴν τῶν προγόνων λαβόντας ὀργὴν τὸν ἐπʼ αὐτοφώρῳ κλέπτην εἰλημμένον καὶ προδότην, τὸν οὐκ ἀπεχόμενον τῶν εἰς τὴν πόλιν ἀφικνουμένων χρημάτων, τὸν εἰς τὰς δεινοτάτας ἀτυχίας ἐμβεβληκότα τὴν πόλιν, τὸν τῆς Ἑλλάδος ἀλιτήριον ἀποκτείναντας Post ἀποκτείναντας add. δεῖ N A pr., del. A corr. ras. ἐξόριστον ἐκ τῆς πόλεως ποιῆσαι, καὶ μεταβαλέσθαι μεταβαλέσθαι A corr. (2): μεταβάλλεσθαι A pr. N. τὴν τῆς πόλεως τύχην ἐᾶσαι, καὶ προσδοκῆσαι τούτων γενομένων βέλτιον πράξειν. 
78	ἀκούσατε, ὦ Ἀθηναῖοι, κἀκείνου τοῦ ψηφίσματος τοῦ γραφέντος ὑπὸ Δημοσθένους, ὃ ὃ A corr. ras.: ὅτ. N pr.: ὅτε A pr. N. corr. τεταραγμένης τῆς πόλεως μετὰ τὴν ἐν Χαιρωνείᾳ μάχην ἔγραψεν ὁ δημοτικὸς οὗτος, καὶ τῆς μαντείας τῆς ἐλθούσης ἐκ Δωδώνης παρὰ τοῦ Διὸς τοῦ Δωδωναίου· σαφῶς γὰρ ὑμῖν πάλαι προείρηκε φυλάττεσθαι τοὺς ἡγεμόνας καὶ τοὺς συμβούλους. λέγε τὴν μαντείαν πρῶτον.
79	Μαντεία λέγε δὴ τὸ καλὸν ψήφισμα τούτου. Ψηφίσματος Μέρος δημοτικός γʼ ὁ διατάττων ἑαυτὸν μέν, ἐπειδὴ ἀνδρεῖος καὶ εὔψυχός ἐστιν, ἐν τοῖς ὅπλοις μένειν, οὓς δʼ ἂν οὗτος οὗτος Ν: αὐτὸς Α. ἀποδοκιμάσῃ τῶν πολιτῶν, ἐπὶ τὰ ἔργα ἀπιέναι, καὶ ἐάν τι ἄλλο τούτῳ δόξῃ ἐπιτήδειον εἶναι, τοῦτο ποιεῖν. λέγε τὰ λοιπά.
80	Τὸ Λοιπὸν τοῦ Ψηφίσματος ἀκούετε, ἄνδρες δικασταί. ἀπιέναι φησὶ τὸ ψήφισμα τὸ ψήφισμα] del. Bekker. τὰς ᾑρημένας ᾑρημένας Wolf: εἰρημένας codd. πρεσβείας. ἐπειδὴ γὰρ γὰρ add. Reiske. ἤκουσε μετὰ τὴν μάχην τὴν ἐν Χαιρωνεία Φίλιππον εἰς τὴν χώραν ἡμῶν μέλλειν εἰσβάλλειν, αὐτὸς ἑαυτὸν πρεσβευτὴν κατασκευάσας, ἵνʼ ἐκ τῆς πόλεως ἀποδραίη, ᾤχετο ᾤχετο hic add. Blass (iam infra post τάλαντα suppleverat Maetzner'. συσκευασάμενος ἐκ ἐκ add. Wurm. τῆς διοικήσεως ὀκτὼ τάλαντα, οὐδὲν φροντίσας τῆς τότε παρούσης ἀπορίας, ἡνίχʼ οἱ ἄλλοι πάντες ἐκ τῶν ἰδίων ἐπεδίδοσαν εἰς τὴν ὑμετέραν σωτηρίαν. 
81	τοιοῦτος ὑμῖν ὁ σύμβουλος, καὶ δύο ταύτας μόνας ἐν τῷ βίῳ ἐν τῷ βίῳ] delendum ci. Maetzner, qui post μάχην interpunxit. Δημοσθένης πεποίηται ἀποδημίας, μετὰ τὴν μάχην ὅτʼ ἀπεδίδρασκεν ἐκ τῆς πόλεως, καὶ νῦν εἰς Ὀλυμπίαν, ἐπεὶ Νικάνορι διὰ τῆς ἀρχεθεωρίας ἐντυχεῖν ἐβούλετο. ἄξιόν γε τούτῳ παρακαταθέσθαι τὴν πόλιν καὶ ἐπιτρέψαι ἐπιτρέψαι Α: ἐπιτρέψειν Ν. κινδυνεύειν μέλλοντας, ὃς ὅτε μὲν ἔδει μάχεσθαι μετὰ τῶν ἄλλων τοῖς πολεμίοις, λιπὼν τὴν τάξιν ᾤχετο ἀπιὼν οἴκαδε, ἐπειδὴ δὲ προσῆκεν οἴκοι κινδυνεύειν μετὰ τῶν ἄλλων, πρεσβευτὴν αὐτὸς αὑτὸν προβαλόμενος προβαλόμενος A corr. ras.: προβαλλόμενος A pr. N. ᾤχετο ἐκ τῆς πόλεως ἀποδρὰς, 
82	ἐπειδὴ δὲ πρεσβεύειν ἔδει περὶ τῆς εἰρήνης, οὐκ ἂν ἔφασκεν ἐκ τῆς πόλεως ἐξελθεῖν οὐδὲ τὸν ἕτερον πόδα, ἐπειδὴ δὲ τοὺς φυγάδας Ἀλέξανδρον ἔφασαν κατάγειν καὶ Νικάνωρ εἰς Ὀλυμπίαν ἧκεν, ἀρχεθεωρὸν αὑτὸν ἐπέδωκε ἐπέδωκε Scaliger: ἀπέδωκε codd. τῇ βουλῇ. τοιοῦτος οὗτος, ἐν μὲν ταῖς παρατάξεσιν οἰκουρός, ἐν δὲ τοῖς οἴκοι μένουσι πρεσβευτής, ἐν δὲ τοῖς πρεσβευταῖς δραπέτης ἐστίν. λέγε δὴ Post δὴ lacunam susp. Maetzner, infra post ὑμῶν Weil. καὶ τὸ περὶ ζητήσεως τῶν χρημάτων ψήφισμα, ἃ ἃ Maetzner: ὃ codd. ἔγραψε Δημοσθένης τῇ ἐξ Ἀρείου πάγου βουλῇ περὶ αὑτοῦ τε καὶ ὑμῶν, ἵνα παρʼ ἄλληλα θεωρήσαντες εἰδῆτε τὴν Δημοσθένους ἀπόνοιαν. Ψήφισμα 
