6.33	 Φλέγραισιν εὑρὼν Ἀλκυονῆ, σφετέρας δʼ οὐ φείσατο 
6.34	 χερσὶν βαρυφθόγγοιο νευρᾶς 
6.35	 Ἡρακλέης. ἀλλʼ Αἰακίδαν καλέων 
6.36	 ἐς πλόον κεῖνον κύρησε δαινυμένων. 
6.37	 τὸν μὲν ἐν ῥινῷ λέοντος στάντα κελήσατο νεκταρέαις σπονδαῖσιν ἄρξαι 
6.38	 καρτεραίχμαν Ἀμφιτρυωνιάδαν, 
6.39	 ἄνδωκε δʼ αὐτῷ φέρτατος 
6.40	 οἰνοδόκον φιάλαν χρυσῷ πεφρικυῖαν Τελαμών, 
6.41	 ὁ δʼ ἀνατείναις οὐρανῷ χεῖρας ἀμάχους 
6.42	 αὔδασε τοιοῦτον ἔπος· εἴ ποτʼ ἐμάν, ὦ Ζεῦ πάτερ, 
6.43	θυμῷ ἐθέλων ἀρὰν ἄκουσας, 
6.44	 νῦν σε, νῦν εὐχαῖς ὑπὸ θεσπεσίαις 
6.45	 λίσσομαι παῖδα θρασὺν ἐξ Ἐριβοίας
6.46	 ἀνδρὶ τῷδε, ξεῖνον ἀμὸν μοιρίδιον τελέσαι,
6.47	 τὸν μὲν ἄρρηκτον φυάν, ὥσπερ τόδε δέρμα με νῦν περιπλανᾶται 
6.48	 θηρός, ὃν πάμπρωτον ἄθλων κτεῖνά ποτʼ ἐν Νεμέᾳ·
6.49	θυμὸς δʼ ἑπέσθω. ταῦτʼ ἄρα οἱ φαμένῳ πέμψεν θεὸς 
6.50	 ἀρχὸν οἰωνῶν μέγαν αἰετόν· ἁδεῖα δʼ ἔνδον νιν ἔκνιξεν χάρις, 
6.51	 εἶπέν τε φωνήσαις ἅτε μάντις ἀνήρ· 
6.52	 ἔσσεταί τοι παῖς, ὃν αἰτεῖς, ὦ Τελαμών· 
6.53	 καί νιν ὄρνιχος φανέντος κέκλεʼ ἐπώνυμον εὐρυβίαν Αἴαντα, λαῶν 
6.54	 ἐν πόνοις ἔκπαγλον Ἐνυαλίου. 
6.55	 ὣς ἆρα εἰπὼν αὐτίκα 
6.56	 ἕζετʼ. ἐμοὶ δὲ μακρὸν πάσας ἀν αγήσασθʼ ἀρετάς· 
6.57	 Φυλακίδᾳ γὰρ ἦλθον, ὦ Μοῖσα, ταμίας 
6.58	 Πυθέᾳ τε κώμων Εὐθυμένει τε. τὸν Ἀργείων τρόπον 
6.59	 εἰρήσεταί που κἀν βραχίστοις. 
6.60	 ἄραντο γὰρ νίκας ἀπὸ παγκρατίου 
6.61	 τρεῖς ἀπʼ Ἰσθμοῦ, τὰς δʼ ἀπʼ εὐφύλλου Νεμέας, 
6.62	 ἀγλαοὶ παῖδές τε καὶ μάτρως· ἀνὰ δʼ ἄγαγον ἐς φάος οἵαν μοῖραν ὕμνων· 
6.63	 τὰν Ψαλυχιδᾶν δὲ πάτραν Χαρίτων 
6.64	 ἄρδοντι καλλίστᾳ δρόσῳ, 
6.65	 τόν τε Θεμιστίου ὀρθώσαντες οἶκον τάνδε πόλιν 
6.66	 θεοφιλῆ ναίοισι. Λάμπων δὲ μελέταν 
6.67	 ἔργοις ὀπάζων Ἡσιόδου μάλα τιμᾷ τοῦτʼ ἔπος, 
6.68	 υἱοῖσί τε φράζων παραινεῖ, 
6.69	 ξυνὸν ἄστει κόσμον ἑῷ προσάγων, 
6.70	 καὶ ξένων εὐεργεσίαις ἀγαπᾶται, 
6.71	 μέτρα μὲν γνώμᾳ διώκων, μέτρα δὲ καὶ κατέχων· 
6.72	 γλῶσσα δʼ οὐκ ἔξω φρενῶν· φαίης κέ νιν ἀνδράσιν ἀθληταῖσιν ἔμμεν 
6.73	 Ναξίαν πέτραις ἐν ἄλλαις χαλκοδάμαντʼ ἀκόναν. 
6.74	 πίσω σφε Δίρκας ἁγνὸν ὕδωρ, τὸ βαθύζωνοι κόραι 
6.75	 χρυσοπέπλου Μναμοσύνας ἀνέτειλαν παρʼ εὐτειχέσιν Κάδμου πύλαις. 
7.1	 τίνι τῶν πάρος, ὦ μάκαιρα Θήβα, 
7.2	 καλῶν ἐπιχωρίων μάλιστα θυμὸν τεὸν 
7.3	 εὔφρανας; ἦ ῥα χαλκοκρότου πάρεδρον 
7.4	 Δαμάτερος ἁνίκʼ εὐρυχαίταν 
7.5	 ἄντειλας Διόνυσον; ἢ χρυσῷ μεσονύκτιον νίφοντα δεξαμένα τὸν φέρτατον θεῶν, 
7.6	 ὁπότʼ Ἀμφιτρύωνος ἐν θυρέτροις 
7.7	 σταθεὶς ἄλοχον μετῆλθεν Ἡρακλείοις γοναῖς; 
7.8	 ἢ ὅτʼ ἀμφὶ πυκναῖς Τειρεσίαο βουλαῖς; 
7.9	 ἢ ὅτʼ ἀμφʼ Ἰόλαον ἱππόμητιν; 
7.10	 ἢ Σπαρτῶν ἀκαμαντολογχᾶν; ἢ ὅτε καρτερᾶς Ἄδραστον ἐξ ἀλαλᾶς ἄμπεμψας ὀρφανὸν 
7.11	 μυρίων ἑτάρων ἐς Ἄργος ἵππιον; 
7.12	 ἢ Δωρίδʼ ἀποικίαν οὕνεκεν ὀρθῷ 
7.13	 ἔστασας ἐπὶ σφυρῷ 
7.14	 Λακεδαιμονίων, ἕλον δʼ Ἀμύκλας 
7.15	 Αἰγεῖδαι σέθεν ἔκγονοι, μαντεύμασι Πυθίοις; 
7.16	 ἀλλὰ παλαιὰ γὰρ 
7.17	 εὕδει χάρις, ἀμνάμονες δὲ βροτοί, 
7.18	 ὅ τι μὴ σοφίας ἄωτον ἄκρον 
7.19	 κλυταῖς ἐπέων ῥοαῖσιν ἐξίκηται ζυγέν. 
7.20	 κώμαζʼ ἔπειτεν ἁδυμελεῖ σὺν ὕμνῳ 
7.21	 καὶ Στρεψιάδᾳ· φέρει γὰρ Ἰσθμοῖ 
7.22	 νίκαν παγκρατίου· σθένει τʼ ἔκπαγλος ἰδεῖν τε μορφάεις· ἄγει τʼ ἀρετὰν οὐκ αἴσχιον φυᾶς. 
7.23	 φλέγεται δὲ ἰοπλόκοισι Μοίσαις, 
7.24	 μάτρωΐ θʼ ὁμωνύμῳ δέδωκε κοινὸν θάλος, 
7.25	 χάλκασπις ᾧ πότμον μὲν Ἄρης ἔμιξεν, 
7.26	 τιμὰ δʼ ἀγαθοῖσιν ἀντίκειται. 
7.27	 ἴστω γὰρ σαφὲς ὅστις ἐν ταύτᾳ νεφέλᾳ χάλαζαν αἵματος πρὸ φίλας πάτρας ἀμύνεται, 
7.28	 λοιγὸν ἄντα φέρων ἐναντίῳ στρατῷ, 
7.29	 ἀστῶν γενεᾷ μέγιστον κλέος αὔξων 
7.30	 ζώων τʼ ἀπὸ καὶ θανών. 
7.31	 τὺ δέ, Διοδότοιο παῖ, μαχατὰν 
7.32	 αἰνέων Μελέαγρον, αἰνέων δὲ καὶ Ἕκτορα 
7.33	 Ἀμφιάρηόν τε, 
7.34	 εὐανθέʼ ἀπέπνευσας ἁλικίαν 
7.35	 προμάχων ἀνʼ ὅμιλον, ἔνθʼ ἄριστοι 
7.36	 ἔσχον πολέμοιο νεῖκος ἐσχάταις ἐλπίσιν. 
7.37	 ἔτλαν δὲ πένθος οὐ φατόν· ἀλλὰ νῦν μοι 
7.38	 Γαιάοχος εὐδίαν ὄπασσεν 
7.39	 ἐκ χειμῶνος. ἀείσομαι χαίταν στεφάνοισιν ἁρμόσαις. ὁ δʼ ἀθανάτων μὴ θρασσέτω φθόνος, 
7.40	 ὅ τι τερπνὸν ἐφάμερον διώκων 
7.41	 ἕκαλος ἔπειμι γῆρας ἔς τε τὸν μόρσιμον 
7.42	 αἰῶνα. θνᾴσκομεν γὰρ ὁμῶς ἅπαντες· 
7.43	 δαίμων δʼ ἄϊσος· τὰ μακρὰ δʼ εἴ τις 
7.44	 παπταίνει, βραχὺς ἐξικέσθαι χαλκόπεδον θεῶν ἕδραν· ὅτι πτερόεις ἔρριψε Πάγασος 
7.45	 δεσπόταν ἐθέλοντʼ ἐς οὐρανοῦ σταθμοὺς 
7.46	 ἐλθεῖν μεθʼ ὁμάγυριν Βελλεροφόνταν 
7.47	 Ζηνός· τὸ δὲ πὰρ δίκαν 
7.48	 γλυκὺ πικροτάτα μένει τελευτά. 
7.49	 ἄμμι δʼ, ὦ χρυσέᾳ κόμᾳ θάλλων, πόρε, Λοξία, 
7.50	 τεαῖσιν ἁμίλλαισιν 
7.51	 εὐανθέα καὶ Πυθόϊ στέφανον. 
8.1	 Κλεάνδρῳ τις ἁλικίᾳ τε λύτρον 
8.2	 εὔδοξον, ὦ νέοι, καμάτων 
8.3	 πατρὸς ἀγλαὸν Τελεσάρχου παρὰ πρόθυρον ἰὼν ἀνεγειρέτω 
8.4	 κῶμον, Ἰσθμιάδος τε νίκας ἄποινα, καὶ Νεμέᾳ 
8.5	 ἀέθλων ὅτι κράτος ἐξεῦρε. τῷ καὶ ἐγώ, καίπερ ἀχνύμενος θυμόν, αἰτέομαι χρυσέαν καλέσαι Μοῖσαν. ἐκ μεγάλων δὲ πενθ έω ν λυθέντες 
8.6	 μήτʼ ἐν ὀρφανίᾳ πέσωμεν στεφάνων, 
8.7	 μήτε κάδεα θεράπευε· παυσάμενοι δʼ ἀπρήκτων κακῶν 
8.8	 γλυκύ τι δαμωσόμεθα καὶ μετὰ πόνον· 
8.9	 ἐπειδὴ τὸν ὑπὲρ κεφαλᾶς 
8.10	 τὸν Ταντάλου λίθον παρά τις ἔτρεψεν ἄμμι θεός, 
8.11	 ἀτόλματον Ἑλλάδι μόχθον. ἀλλά 
8.12	 μοι δεῖμα μὲν παροιχόμενον 
8.13	 καρτερὰν ἔπαυσε μέριμναν· τὸ δὲ πρὸ ποδὸς ἄρειον ἀεὶ σκοπεῖν 
8.14	 χρῆμα πᾶν. δόλιος γὰρ αἰὼν ἐπʼ ἀνδράσι κρέμαται, 
8.15	 ἑλίσσων βίου πόρον· ἰατὰ δʼ ἔστι βροτοῖς σύν γʼ ἐλευθερίᾳ καὶ τά. χρὴ δʼ ἀγαθὰν ἐλπίδʼ ἀνδρὶ μέλειν· χρὴ δʼ ἐν ἑπταπύλοισι Θήβαις τραφέντα 
8.16	 Αἰγίνᾳ Χαρίτων ἄωτον προνέμειν, 
8.17	 πατρὸς οὕνεκα δίδυμαι γένοντο θύγατρες Ἀσωπίδων 
8.18	 ὁπλόταται, Ζηνί τε ἅδον βασιλέϊ. 
8.19	 ὃ τὰν μὲν παρὰ καλλιρόῳ 
8.20	 Δίρκᾳ φιλαρμάτου πόλιος ᾤκισσεν ἁγεμόνα· 
8.21	 σὲ δʼ ἐς νᾶσον Οἰνοπίαν ἐνεγκὼν 
8.22	 κοιμᾶτο, δῖον ἔνθα τέκες 
8.23	 Αἰακὸν βαρυσφαράγῳ πατρὶ κεδνότατον ἐπιχθονίων· ὃ καὶ 
8.24	 δαιμόνεσσι δίκας ἐπείραινε· τοῦ μὲν ἀντίθεοι 
8.25	 ἀρίστευον υἱέες υἱέων τʼ ἀρηΐφιλοι παῖδες ἀνορέᾳ χάλκεον στονόεντʼ ἀμφέπειν ὅμαδον· σώφρονές τʼ ἐγένοντο πινυτοί τε θυμόν. 
8.26	 ταῦτα καὶ μακάρων ἐμέμναντʼ ἀγοραί, 
8.27	 Ζεὺς ὅτʼ ἀμφὶ Θέτιος ἀγλαός τʼ ἔρισαν Ποσειδᾶν γάμῳ, 
8.28	 ἄλοχον εὐειδέʼ ἐθέλων ἑκάτερος 
8.29	 ἑὰν ἔμμεν· ἔρως γὰρ ἔχεν. 
8.30	 ἀλλʼ οὔ σφιν ἄμβροτοι τέλεσαν εὐνὰν θεῶν πραπίδες, 
8.31	 ἐπεὶ θεσφάτων ἐπάκουσαν· εἶπε δʼ 
8.32	 εὔβουλος ἐν μέσοισι Θέμις, 
8.33	 οὕνεκεν πεπρωμένον ἦν φέρτερον γόνον ἄνακτα πατρὸς τεκεῖν 
8.34	 ποντίαν θεόν, ὃς κεραυνοῦ τε κρέσσον ἄλλο βέλος 
8.35	 διώξει χερὶ τριόδοντός τʼ ἀμαιμακέτου, Δί τε μισγομέναν ἢ Διὸς παρʼ ἀδελφεοῖσιν.— ἀλλὰ τὰ μὲν παύσατε· βροτέων δὲ λεχέων τυχοῖσα 
8.36	 υἱὸν εἰσιδέτω θανόντʼ ἐν πολέμῳ, 
8.37	 χεῖρας Ἄρεΐ τʼ ἐναλίγκιον στεροπαῖσί τʼ ἀκμὰν ποδῶν. 
8.38	 τὸ μὲν ἐμὸν Πηλέϊ γάμου θεόμορον 
8.39	 ὀπάσσαι γέρας Αἰακίδᾳ, 
8.40	 ὅντʼ εὐσεβέστατον φάτις Ἰωλκοῦ τράφειν πεδίον·
8.41	 ἰόντων δʼ ἐς ἄφθιτον ἄντρον εὐθὺς 
8.42	Χείρωνος αὐτίκʼ ἀγγελίαι· 
8.43	 μηδὲ Νηρέος θυγάτηρ νεικέων πέταλα δὶς ἐγγυαλιζέτω 
8.44	 ἄμμιν· ἐν διχομηνίδεσσιν δὲ ἑσπέραις ἐρατὸν 
8.45	λύοι κεν χαλινὸν ὑφʼ ἥρωϊ παρθενίας. ὣς φάτο Κρονίδαις ἐννέποισα θεά· τοὶ δʼ ἐπὶ γλεφάροις νεῦσαν ἀθανάτοισιν· ἐπέων δὲ καρπὸς 
8.46	 οὐ κατέφθινε. φαντὶ γὰρ ξύνʼ ἀλέγειν 
8.47	 καὶ γάμον Θέτιος ἄνακτα. καὶ νεαρὰν ἔδειξαν σοφῶν 
8.48	 στόματʼ ἀπείροισιν ἀρετὰν Ἀχιλέος· 
8.49	 ὃ καὶ Μύσιον ἀμπελόεν 
8.50	 αἵμαξε Τηλέφου μέλανι ῥαίνων φόνῳ πεδίον, 
8.51	 γεφύρωσέ τʼ Ἀτρεΐδαισι νόστον, 
8.52	 Ἑλέναν τʼ ἐλύσατο, Τρωΐας 
8.53	 ἶνας ἐκταμὼν δορί, ταί νιν ῥύοντό ποτε μάχας ἐναριμβρότου 
8.54	 ἔργον ἐν πεδίῳ κορύσσοντα, Μέμνονός τε βίαν 
8.55	 ὑπέρθυμον Ἕκτορά τʼ ἄλλους τʼ ἀριστέας· οἷς δῶμα Φερσεφόνας μανύων Ἀχιλεύς, οὖρος Αἰακιδᾶν, Αἴγιναν σφετέραν τε ῥίζαν πρόφαινεν. 
8.56	 τὸν μὲν οὐδὲ θανόντʼ ἀοιδαὶ ἔλιπον, 
8.57	 ἀλλά οἱ παρά τε πυρὰν τάφον θʼ Ἑλικώνιαι παρθένοι 
8.58	 στάν, ἐπὶ θρῆνόν τε πολύφαμον ἔχεαν. 
8.59	 ἔδοξʼ ἆρα τόδʼ ἀθανάτοις, 
8.60	 ἐσλόν γε φῶτα καὶ φθίμενον ὕμνοις θεᾶν διδόμεν. 
8.61	 τὸ καὶ νῦν φέρει λόγον, ἔσσυταί τε 
8.62	 Μοισαῖον ἅρμα Νικοκλέος 
8.63	 μνᾶμα πυγμάχου κελαδῆσαι. γεραίρετέ νιν, ὃς Ἴσθμιον ἂν νάπος 
8.64	 Δωρίων ἔλαχεν σελίνων· ἐπεὶ περικτίονας 
8.65	 ἐνίκασε δή ποτε καὶ κεῖνος ἄνδρας ἀφύκτῳ χερὶ κλονέων. τὸν μὲν οὐ κατελέγχει κριτοῦ γενεὰ πατραδελφεοῦ· ἁλίκων τῷ τις ἁβρὸν 
8.66	 ἀμφὶ παγκρατίου Κλεάνδρῳ πλεκέτω 
8.67	 μυρσίνας στέφανον, ἐπεί νιν Ἀλκαθόου τʼ ἀγὼν σὺν τύχᾳ 
8.68	 ἐν Ἐπιδαύρῳ τε νεότας δέκετο πρίν· 
8.69	 τὸν αἰνεῖν ἀγαθῷ παρέχει· 
8.70	 ἥβαν γὰρ οὐκ ἄπειρον ὑπὸ χειᾷ καλῶν δάμασεν. 
