1.1	 μᾶτερ ἐμά, τὸ τεόν, χρύσασπι Θήβα, 
1.2	 πρᾶγμα καὶ ἀσχολίας ὑπέρτερον 
1.3	 θήσομαι. μή μοι κραναὰ νεμεσάσαι 
1.4	 Δᾶλος, ἐν ᾇ κέχυμαι. 
1.5	 τί φίλτερον κεδνῶν τοκέων ἀγαθοῖς; 
1.6	 εἶξον, Ὠπολλωνιάς· ἀμφοτερᾶν τοι χαρίτων σὺν θεοῖς ζεύξω τέλος, 
1.7	 καὶ τὸν ἀκειρεκόμαν Φοῖβον χορεύων 
1.8	 ἐν Κέῳ ἀμφιρύτᾳ σὺν ποντίοις 
1.9	 ἀνδράσιν, καὶ τὰν ἁλιερκέα, Ἰσθμοῦ 
1.10	 δειράδʼ· ἐπεὶ στεφάνους 
1.11	 ἓξ ὤπασεν Κάδμου στρατῷ ἐξ ἀέθλων, 
1.12	 καλλίνικον πατρίδι κῦδος. ἐν ᾇ καὶ τὸν ἀδείμαντον Ἀλκμήνα τέκεν 
1.13	 παῖδα, θρασεῖαι τόν ποτε Γηρυόνα φρῖξαν κύνες. 
1.14	 ἀλλʼ ἐγὼ Ἡροδότῳ τεύχων τὸ μὲν ἅρματι τεθρίππῳ γέρας, 
1.15	 ἁνία τʼ ἀλλοτρίαις οὐ χερσὶ νωμάσαντʼ ἐθέλω 
1.16	 ἢ Καστορείῳ ἢ Ἰολάου ἐναρμόξαι νιν ὕμνῳ. 
1.17	 κεῖνοι γὰρ ἡρώων διφρηλάται Λακεδαίμονι καὶ Θήβαις ἐτέκνωθεν κράτιστοι· 
1.18	 ἔν τʼ ἀέθλοισι θίγον πλείστων ἀγώνων, 
1.19	 καὶ τριπόδεσσιν ἐκόσμησαν δόμον 
1.20	 καὶ λεβήτεσσιν φιάλαισί τε χρυσοῦ, 
1.21	 γευόμενοι στεφάνων 
1.22	 νικαφόρων· λάμπει δὲ σαφὴς ἀρετὰ 
1.23	 ἔν τε γυμνοῖσι σταδίοις σφίσιν ἔν τʼ ἀσπιδοδούποισιν ὁπλίταις δρόμοις, 
1.24	 οἷά τε χερσὶν ἀκοντίζοντες αἰχμαῖς, 
1.25	 καὶ λιθίνοις ὁπότʼ ἐν δίσκοις ἵεν. 
1.26	 οὐ γὰρ ἦν πεντάθλιον, ἀλλʼ ἐφʼ ἑκάστῳ 
1.27	 ἔργματι κεῖτο τέλος. 
1.28	 τῶν ἀθρόοις ἀνδησάμενοι θαμάκις 
1.29	 ἔρνεσιν χαίτας ῥεέθροισί τε Δίρκας ἔφανεν καὶ παρʼ Εὐρώτᾳ πέλας, 
1.30	 Ἰφικλέος μὲν παῖς ὁμόδαμος ἐὼν Σπαρτῶν γένει, 
1.31	 Τυνδαρίδας δʼ ἐν Ἀχαιοῖς ὑψίπεδον Θεράπνας οἰκ έω ν ἕδος. 
1.32	 χαίρετʼ. ἐγὼ δὲ Ποσειδάωνι Ἰσθμῷ τε ζαθέᾳ 
1.33	 Ὀγχηστίαισίν τʼ ἀϊόνεσσιν περιστέλλων ἀοιδὰν 
1.34	 γαρύσομαι τοῦδʼ ἀνδρὸς ἐν τιμαῖσιν ἀγακλέα τὰν Ἀσωποδώρου πατρὸς αἶσαν 
1.35	 Ὀρχομενοῖό τε πατρῴαν ἄρουραν, 
1.36	 ἅ νιν ἐρειδόμενον ναυαγίαις 
1.37	 ἐξ ἀμετρήτας ἁλὸς ἐν κρυοέσσᾳ 
1.38	 δέξατο συντυχίᾳ· 
1.39	 νῦν δʼ αὖτις ἀρχαίας ἐπέβασε πότμος 
1.40	 συγγενὴς εὐαμερίας. ὁ πονήσαις δὲ νόῳ καὶ προμάθειαν φέρει· 
1.41	 εἰ δʼ ἀρετᾷ κατάκειται πᾶσαν ὀργάν, 
1.42	 ἀμφότερον δαπάναις τε καὶ πόνοις, 
1.43	 χρή νιν εὑρόντεσσιν ἀγάνορα κόμπον 
1.44	 μὴ φθονεραῖσι φέρειν 
1.45	 γνώμαις. ἐπεὶ κούφα δόσις ἀνδρὶ σοφῷ 
1.46	 ἀντὶ μόχθων παντοδαπῶν ἔπος εἰπόντʼ ἀγαθὸν ξυνὸν ὀρθῶσαι καλόν. 
1.47	 μισθὸς γὰρ ἄλλοις ἄλλος ἐφʼ ἔργμασιν ἀνθρώποις γλυκύς, 
1.48	 μηλοβότᾳ τʼ ἀρότᾳ τʼ ὀρνιχολόχῳ τε καὶ ὃν πόντος τρέφει· 
1.49	 γαστρὶ δὲ πᾶς τις ἀμύνων λιμὸν αἰανῆ τέταται· 
1.50	 ὃς δʼ ἀμφʼ ἀέθλοις ἢ πολεμίζων ἄρηται κῦδος ἁβρόν, 
1.51	 εὐαγορηθεὶς κέρδος ὕψιστον δέκεται, πολιατᾶν καὶ ξένων γλώσσας ἄωτον. 
1.52	 ἄμμι δʼ ἔοικε Κρόνου σεισίχθονʼ υἱὸν 
1.53	 γείτονʼ ἀμειβομένοις εὐεργέταν 
1.54	 ἁρμάτων ἱπποδρόμιον κελαδῆσαι, 
1.55	 καὶ σέθεν, Ἀμφιτρύων, 
1.56	 παῖδας προσειπεῖν, τὸν Μινύα τε μυχὸν 
1.57	 καὶ τὸ Δάματρος κλυτὸν ἄλσος Ἐλευσῖνα καὶ Εὔβοιαν ἐν γναμπτοῖς δρόμοις· 
1.58	 Πρωτεσίλα, τὸ τεὸν δʼ ἀνδρῶν Ἀχαιῶν 
1.59	 ἐν Φυλάκᾳ τέμενος συμβάλλομαι. 
1.60	 πάντα δʼ ἐξειπεῖν, ὅσʼ ἀγώνιος Ἑρμᾶς 
1.61	 Ἡροδότῳ ἔπορεν 
1.62	 ἵπποις, ἀφαιρεῖται βραχὺ μέτρον ἔχων 
1.63	 ὕμνος. ἦ μὰν πολλάκι καὶ τὸ σεσωπαμένον εὐθυμίαν μείζω φέρει. 
1.64	 εἴη νιν εὐφώνων πτερύγεσσιν ἀερθέντʼ ἀγλααῖς 
1.65	 Πιερίδων ἔτι καὶ Πυθῶθεν Ὀλυμπιάδων τʼ ἐξαιρέτοις 
1.66	 Ἀλφεοῦ ἔρνεσι φράξαι χεῖρα τιμὰν ἑπταπύλοις 
1.67	 Θήβαισι τεύχοντʼ. εἰ δέ τις ἔνδον νέμει πλοῦτον κρυφαῖον, 
1.68	 ἄλλοισι δʼ ἐμπίπτων γελᾷ, ψυχὰν Ἀΐδᾳ τελέων οὐ φράζεται δόξας ἄνευθεν. 
2.1	 οἱ μὲν πάλαι, ὦ Θρασύβουλε, φῶτες, οἳ χρυσαμπύκων 
2.2	 ἐς δίφρον Μοισᾶν ἔβαινον κλυτᾷ φόρμιγγι συναντόμενοι, 
2.3	 ῥίμφα παιδείους ἐτόξευον μελιγάρυας ὕμνους, 
2.4	 ὅστις ἐὼν καλὸς εἶχεν Ἀφροδίτας 
2.5	 εὐθρόνου μνάστειραν ἁδίσταν ὀπώραν. 
2.6	 ἁ Μοῖσα γὰρ οὐ φιλοκερδής πω τότʼ ἦν οὐδʼ ἐργάτις· 
2.7	 οὐδʼ ἐπέρναντο γλυκεῖαι μελιφθόγγου ποτὶ Τερψιχόρας 
2.8	 ἀργυρωθεῖσαι πρόσωπα μαλθακόφωνοι ἀοιδαί. 
2.9	 νῦν δʼ ἐφίητι τὸ τὠργείου φυλάξαι 
2.10	 ῥῆμʼ ἀλαθείας ἐτᾶς ἄγχιστα βαῖνον, 
2.11	 χρήματα, χρήματʼ ἀνήρ, ὃς φᾶ κτεάνων θʼ ἅμα λειφθεὶς καὶ φίλων. 
2.12	 ἐσσὶ γὰρ ὦν σοφός, οὐκ ἄγνωτʼ ἀείδω 
2.13	 Ἰσθμίαν ἵπποισι νίκαν, 
2.14	 τὰν Ξενοκράτει Ποσειδάων ὀπάσαις, 
2.15	 Δωρίων αὐτῷ στεφάνωμα κόμᾳ 
2.16	 πέμπεν ἀναδεῖσθαι σελίνων, 
2.17	 εὐάρματον ἄνδρα γεραίρων, Ἀκραγαντίνων φάος. 
2.18	 ἐν Κρίσᾳ δʼ εὐρυσθενὴς εἶδʼ Ἀπόλλων νιν πόρε τʼ ἀγλαΐαν 
2.19	 καὶ τόθι· κλειναῖς δʼ Ἐρεχθειδᾶν χαρίτεσσιν ἀραρὼς 
2.20	 ταῖς λιπαραῖς ἐν Ἀθάναις, οὐκ ἐμέμφθη 
2.21	 ῥυσίδιφρον χεῖρα πλαξίπποιο φωτός, 
2.22	 τὰν Νικόμαχος κατὰ καιρὸν νεῖμʼ ἁπάσαις ἁνίαις· 
2.23	 ὅντε καὶ κάρυκες ὡρᾶν ἀνέγνον, σπονδοφόροι Κρονίδα 
2.24	 Ζηνὸς Ἀλεῖοι, παθόντες πού τι φιλόξενον ἔργον· 
2.25	 ἁδυπνόῳ τέ νιν ἀσπάζοντο φωνᾷ 
2.26	 χρυσέας ἐν γούνασιν πίτνοντα Νίκας 
2.27	 γαῖαν ἀνὰ σφετέραν, τὰν δὴ καλέοισιν Ὀλυμπίου Διὸς 
2.28	 ἄλσος· ἵνʼ ἀθανάτοις Αἰνησιδάμου 
2.29	 παῖδες ἐν τιμαῖς ἔμιχθεν. 
2.30	 καὶ γὰρ οὐκ ἀγνῶτες ὑμῖν ἐντὶ δόμοι 
2.31	 οὔτε κώμων, ὦ Θρασύβουλʼ, ἐρατῶν, 
2.32	 οὔτε μελικόμπων ἀοιδᾶν. 
2.33	 οὐ γὰρ πάγος, οὐδὲ προσάντης ἁ κέλευθος γίνεται, 
2.34	 εἴ τις εὐδόξων ἐς ἀνδρῶν ἄγοι τιμὰς Ἑλικωνιάδων. 
2.35	 μακρὰ δισκήσαις ἀκοντίσσαιμι τοσοῦθʼ, ὅσον ὀργὰν 
2.36	 Ξεινοκράτης ὑπὲρ ἀνθρώπων γλυκεῖαν 
2.37	 ἔσχεν. αἰδοῖος μὲν ἦν ἀστοῖς ὁμιλεῖν, 
2.38	 ἱπποτροφίας τε νομίζων ἐν Πανελλάνων νόμῳ· 
2.39	 καὶ θεῶν δαῖτας προσέπτυκτο πάσας· οὐδέ ποτε ξενίαν 
2.40	 οὖρος ἐμπνεύσαις ὑπέστειλʼ ἱστίον ἀμφὶ τράπεζαν· 
2.41	 ἀλλʼ ἐπέρα ποτὶ μὲν Φᾶσιν θερείαις, 
2.42	 ἐν δὲ χειμῶνι πλέων Νείλου πρὸς ἀκτάς. 
2.43	 μή νυν, ὅτι φθονεραὶ θνατῶν φρένας ἀμφικρέμανται ἐλπίδες, 
2.44	 μήτʼ ἀρετάν ποτε σιγάτω πατρῴαν, 
2.45	 μηδὲ τούσδʼ ὕμνους· ἐπεί τοι 
2.46	 οὐκ ἐλινύσοντας αὐτοὺς εἰργασάμαν. 
2.47	 ταῦτα, Νικάσιππʼ, ἀπόνειμον, ὅταν 
2.48	 ξεῖνον ἐμὸν ἠθαῖον ἔλθῃς. 
3.1	 εἴ τις ἀνδρῶν εὐτυχήσαις ἢ σὺν εὐδόξοις ἀέθλοις 
3.2	 ἢ σθένει πλούτου κατέχει φρασὶν αἰανῆ κόρον, 
3.3	 ἄξιος εὐλογίαις ἀστῶν μεμίχθαι. 
3.4	 Ζεῦ, μεγάλαι δʼ ἀρεταὶ θνατοῖς ἕπονται 
3.5	 ἐκ σέθεν· ζώει δὲ μάσσων ὄλβος ὀπιζομένων, πλαγίαις δὲ φρένεσσιν 
3.6	 οὐχ ὁμῶς πάντα χρόνον θάλλων ὁμιλεῖ. 
3.7	 εὐκλέων δʼ ἔργων ἄποινα χρὴ μὲν ὑμνῆσαι τὸν ἐσλόν, 
3.8	 χρὴ δὲ κωμάζοντʼ ἀγαναῖς χαρίτεσσιν βαστάσαι. 
3.9	 ἔστι δὲ καὶ διδύμων ἀέ θλων Μελίσσῳ 
3.10	 μοῖρα πρὸς εὐφροσύναν τρέψαι γλυκεῖαν 
3.11	 ἦτορ, ἐν βάσσαισιν Ἰσθμοῦ δεξαμένῳ στεφάνους, τὰ δὲ κοίλᾳ λέοντος 
3.12	 ἐν βαθυστέρνου νάπᾳ κάρυξε Θήβαν 
3.13	 ἱπποδρομίᾳ κρατέων. ἀνδρῶν δʼ ἀρετὰν 
3.14	 σύμφυτον οὐ κατελέγχει. 
3.15	 ἴστε μὰν Κλεωνύμου 
3.16	 δόξαν παλαιὰν ἅρμασιν· 
3.17	 καὶ ματρόθε Λαβδακίδαισιν σύννομοι πλούτου διέστειχον τετραοριᾶν πόνοις. 
3.18	 αἰὼν δὲ κυλινδομέναις ἁμέραις ἄλλʼ ἄλλοτʼ ἐξάλλαξεν· ἄτρωτοί γε μὰν παῖδες θεῶν. 
4.1	 ἔστι μοι θεῶν ἕκατι μυρία παντᾷ κέλευθος· 
4.2	 ὦ Μέλισσʼ, εὐμαχανίαν γὰρ ἔφανας Ἰσθμίοις 
4.3	 ὑμετέρας ἀρετὰς ὕμνῳ διώκειν· 
4.4	 αἷσι Κλεωνυμίδαι θάλλοντες αἰεὶ 
4.5	 σὺν θεῷ θνατὸν διέρχονται βιότου τέλος. ἄλλοτε δʼ ἀλλοῖος οὖρος 
4.6	 πάντας ἀνθρώπους ἐπαΐσσων ἐλαύνει. 
4.7	 τοὶ μὲν ὦν Θήβαισι τιμάεντες ἀρχᾶθεν λέγονται 
4.8	 πρόξενοί τʼ ἀμφικτιόνων κελαδεννᾶς τʼ ὀρφανοὶ 
4.9	 ὕβριος· ὅσσα δʼ ἐπʼ ἀνθρώπους ἄηται 
4.10	 μαρτύρια φθιμένων ζωῶν τε φωτῶν 
4.11	 ἀπλέτου δόξας, ἐπέψαυσαν κατὰ πᾶν τέλος· ἀνορέαις δʼ ἐσχάταισιν 
4.12	 οἴκοθεν στάλαισιν ἅπτονθʼ Ἡρακλείαις· 
4.13	 καὶ μηκέτι μακροτέραν σπεύδειν ἀρετάν. 
4.14	 ἱπποτρόφοι τʼ ἐγένοντο, 
4.15	 χαλκέῳ τʼ Ἄρει ἅδον. 
4.16	 ἀλλʼ ἁμέρᾳ γὰρ ἐν μιᾷ 
4.17	 τραχεῖα νιφὰς πολέμοιο τεσσάρων 
4.17b	 ἀνδρῶν ἐρήμωσεν μάκαιραν ἑστίαν· 
4.18	 νῦν δʼ αὖ μετὰ χειμέριον ποικίλων μηνῶν ζόφον 
4.18b	 χθὼν ὥτε φοινικέοισιν ἄνθησεν ῥόδοις 
4.19	 δαιμόνων βουλαῖς. ὁ κινητὴρ δὲ γᾶς Ὀγχηστὸν οἰκέων 
4.20	 καὶ γέφυραν ποντιάδα πρὸ Κορίνθου τειχέων, 
4.21	 τόνδε πορὼν γενεᾷ θαυμαστὸν ὕμνον 
4.22	 ἐκ λεχέων ἀνάγει φάμαν παλαιὰν 
4.23	 εὐκλέων ἔργων· ἐν ὕπνῳ γὰρ πέσεν· ἀλλʼ ἀνεγειρομένα χρῶτα λάμπει, 
4.24	 Ἀωσφόρος θαητὸς ὣς ἄστροις ἐν ἄλλοις· 
4.25	 ἅ τε κἀν γουνοῖς Ἀθανᾶν ἅρμα καρύξαισα νικᾶν 
4.26	 ἔν τʼ Ἀδραστείοις ἀέθλοις Σικυῶνος ὤπασεν 
4.27	 τοιάδε τῶν τότʼ ἐόντων φύλλʼ ἀοιδᾶν. 
4.28	 οὐδὲ παναγυρίων ξυνᾶν ἀπεῖχον 
4.29	 καμπύλον δίφρον, Πανελλάνεσσι δʼ ἐριζόμενοι δαπάνᾳ χαῖρον ἵππων. 
4.30	 τῶν ἀπειράτων γὰρ ἄγνωστοι σιωπαί, 
4.31	 ἔστιν δʼ ἀφάνεια τύχας καὶ μαρναμένων, 
4.32	 πρὶν τέλος ἄκρον ἱκέσθαι· 
4.33	 τῶν τε γὰρ καὶ τῶν διδοῖ· 
4.34	 καὶ κρέσσονʼ ἀνδρῶν χειρόνων 
4.35	 ἔσφαλε τέχνα καταμάρψαισʼ. ἴστε μὰν Αἴαντος ἀλκὰν φοίνιον, τὰν ὀψίᾳ 
4.36	 ἐν νυκτὶ ταμὼν περὶ ᾧ φασγάνῳ, μομφὰν ἔχει παίδεσσιν Ἑλλάνων ὅσοι Τρῴανδʼ ἔβαν. 
4.37	 ἀλλʼ Ὅμηρός τοι τετίμακεν διʼ ἀνθρώπων, ὃς αὐτοῦ 
4.38	 πᾶσαν ὀρθώσαις ἀρετὰν κατὰ ῥάβδον ἔφρασεν 
4.39	 θεσπεσίων ἐπέων λοιποῖς ἀθύρειν. 
4.40	 τοῦτο γὰρ ἀθάνατον φωνᾶεν ἕρπει, 
4.41	 εἴ τις εὖ εἴπῃ τι· καὶ πάγκαρπον ἐπὶ χθόνα καὶ διὰ πόντον βέβακεν 
4.42	 ἑργμάτων ἀκτὶς καλῶν ἄσβεστος αἰεί. 
4.43	 προφρόνων Μοισᾶν τύχοιμεν, κεῖνον ἅψαι πυρσὸν ὕμνων 
4.44	 καὶ Μελίσσῳ, παγκρατίου στεφάνωμʼ ἐπάξιον, 
4.45	 ἔρνεϊ Τελεσιάδα. τόλμᾳ γὰρ εἰκὼς 
4.46	 θυμὸν ἐριβρεμετᾶν θηρῶν λεόντων 
4.47	 ἐν πόνῳ, μῆτιν δʼ ἀλώπηξ, αἰετοῦ ἅ τʼ ἀναπιτναμένα ῥόμβον ἴσχει. 
4.48	 χρὴ δὲ πᾶν ἔρδοντα μαυρῶσαι τὸν ἐχθρόν. 
4.49	 οὐ γὰρ φύσιν Ὠαριωνείαν ἔλαχεν· 
4.50	 ἀλλʼ ὀνοτὸς μὲν ἰδέσθαι, 
4.51	 συμπεσεῖν δʼ ἀκμᾷ βαρύς. 
4.52	 καίτοι πότʼ Ἀνταίου δόμους 
4.53	 Θηβᾶν ἀπὸ Καδμεϊᾶν μορφὰν βραχύς, ψυχὰν δʼ ἄκαμπτος, προσπαλαίσων ἦλθʼ ἀνὴρ 
4.54	 τὰν πυροφόρον Λιβύαν, κρανίοις ὄφρα ξένων ναὸν Ποσειδάωνος ἐρέφοντα σχέθοι, 
4.55	 υἱὸς Ἀλκμήνας· ὃς Οὐλυμπόνδʼ ἔβα, γαίας τε πάσας 
4.56	 καὶ βαθύκρημνον πολιᾶς ἁλὸς ἐξευρὼν θέναρ, 
4.57	 ναυτιλίαισί τε πορθμὸν ἁμερώσαις. 
4.58	 νῦν δὲ παρʼ Αἰγιόχῳ κάλλιστον ὄλβον 
4.59	 ἀμφέπων ναίει, τετίματαί τε πρὸς ἀθανάτων φίλος, Ἥβαν τʼ ὀπυίει, 
4.60	 χρυσέων οἴκων ἄναξ καὶ γαμβρὸς Ἥρας. 
4.61	 τῷ μὲν Ἀλεκτρᾶν ὕπερθεν δαῖτα πορσύνοντες ἀστοὶ 
4.62	 καὶ νεόδματα στεφανώματα βωμῶν αὔξομεν 
4.63	 ἔμπυρα χαλκοαρᾶν ὀκτὼ θανόντων, 
4.64	 τοὺς Μεγάρα τέκε οἱ Κρειοντὶς υἱούς· 
4.65	 τοῖσιν ἐν δυθμαῖσιν αὐγᾶν φλὸξ ἀνατελλομένα συνεχὲς παννυχίζει 
4.66	 αἰθέρα κνις άε ντι λακτίζοισα καπνῷ, 
4.67	 καὶ δεύτερον ἆμαρ ἐτείων τέρμʼ ἀέθλων 
4.68	 γίνεται, ἰσχύος ἔργον. 
4.69	 ἔνθα λευκωθεὶς κάρα 
4.70	 μύρτοις ὅδʼ ἀνὴρ διπλόαν 
4.71	 νίκαν ἀνεφάνατο παίδων τε τρίταν πρόσθεν, κυβερνατῆρος οἰακοστρόφου 
4.72	 γνώμᾳ πεπιθὼν πολυβούλῳ. σὺν Ὀρσέᾳ δέ νιν κωμάξομαι, τερπνὰν ἐπιστάζων χάριν. 
5.1	 μᾶτερ Ἁλίου πολυώνυμε Θεία, 
5.2	 σέο ἕκατι καὶ μεγασθενῆ νόμισαν 
5.3	 χρυσὸν ἄνθρωποι περιώσιον ἄλλων· 
5.4	 καὶ γὰρ ἐριζόμεναι 
5.5	 νᾶες ἐν πόντῳ καὶ ὑφʼ ἅρμασιν ἵπποι 
5.6	 διὰ τεάν, ὤνασσα, τιμὰν ὠκυδινάτοις ἐν ἁμίλλαισι θαυμασταὶ πέλονται· 
5.7	 ἔν τʼ ἀγωνίοις ἀέθλοισι ποθεινὸν 
5.8	 κλέος ἔπραξεν, ὅντινʼ ἀθρόοι στέφανοι 
5.9	 χερσὶ νικάσαντʼ ἀνέδησαν ἔθειραν 
5.10	 ἢ ταχυτᾶτι ποδῶν. 
5.11	 κρίνεται δʼ ἀλκὰ διὰ δαίμονας ἀνδρῶν. 
5.12	 δύο δέ τοι ζωᾶς ἄωτον μοῦνα ποιμαίνοντι τὸν ἄλπνιστον εὐανθεῖ σὺν ὄλβῳ, 
5.13	 εἴ τις εὖ πάσχων λόγον ἐσλὸν ἀκούῃ. 
5.14	 μὴ μάτευε Ζεὺς γενέσθαι· πάντʼ ἔχεις, 
5.15	 εἴ σε τούτων μοῖρʼ ἐφίκοιτο καλῶν. 
5.16	 θνατὰ θνατοῖσι πρέπει. 
5.17	 τὶν δʼ ἐν Ἰσθμῷ διπλόα θάλλοισʼ ἀρετά, 
5.18	 Φυλακίδα, κεῖται, Νεμέα δὲ καὶ ἀμφοῖν, 
5.19	 Πυθέᾳ τε παγκρατίου. τὸ δʼ ἐμὸν 
5.20	 οὐκ ἄτερ Αἰακιδᾶν κέαρ ὕμνων γεύεται· 
5.21	 σὺν Χάρισιν δʼ ἔμολον Λάμπωνος υἱοῖς 
5.22	 τάνδʼ ἐς εὔνομον πόλιν. εἰ δὲ τέτραπται 
5.23	 θεοδότων ἔργων κέλευθον ἂν καθαράν, 
5.24	 μὴ φθόνει κόμπον τὸν ἐοικότʼ ἀοιδᾷ 
5.25	 κιρνάμεν ἀντὶ πόνων. 
5.26	 καὶ γὰρ ἡρώων ἀγαθοὶ πολεμισταὶ 
5.27	 λόγον ἐκέρδαναν, κλέονται δʼ ἔν τε φορμίγγεσσιν ἐν αὐλῶν τε παμφώνοις ὁμοκλαῖς 
5.28	 μυρίον χρόνον· μελέταν δὲ σοφισταῖς 
5.29	 Διὸς ἕκατι πρόσβαλον σεβιζόμενοι· 
5.30	 ἐν μὲν Αἰτωλῶν θυσίαισι φαενναῖς 
5.31	 Οἰνεΐδαι κρατεροί, 
5.32	 ἐν δὲ Θήβαις ἱπποσόας Ἰόλαος 
5.33	 γέρας ἔχει, Περσεὺς δʼ ἐν Ἄργει, Κάστορος δʼ αἰχμὰ Πολυδεύκ εο ς τʼ ἐπʼ Εὐρώτα ῥεέθροις. 
5.34	 ἀλλʼ ἐν Οἰνώνᾳ μεγαλήτορες ὀργαὶ 
5.35	 Αἰακοῦ παίδων τε· τοὶ καὶ σὺν μάχαις 
5.36	 δὶς πόλιν Τρώων πράθον ἑσπόμενοι 
5.37	 Ἡρακλῆϊ πρότερον, 
5.38	 καὶ σὺν Ἀτρείδαις. ἔλα νῦν μοι πεδόθεν· 
5.39	 λέγε, τίνες Κύκνον, τίνες Ἕκτορα πέφνον, 
5.40	 καὶ στράταρχον Αἰθιόπων ἄφοβον 
5.41	 Μέμνονα χαλκοάραν· τίς ἄρʼ ἐσλὸν Τήλεφον 
5.42	 τρῶσεν ἑῷ δορὶ Καΐκου παρʼ ὄχθαις; 
5.43	 τοῖσιν Αἴγιναν προφέρει στόμα πάτραν 
5.44	 διαπρεπέα νᾶσον· τετείχισται δὲ πάλαι 
5.45	 πύργος ὑψηλαῖς ἀρεταῖς ἀναβαίνειν. 
5.46	 πολλὰ μὲν ἀρτιεπὴς 
5.47	 γλῶσσά μοι τοξεύματʼ ἔχει περὶ κείνων 
5.48	 κελαδέσαι· καὶ νῦν ἐν Ἄρει μαρτυρήσαι κεν πόλις Αἴαντος ὀρθωθεῖσα ναύταις 
5.49	 ἐν πολυφθόρῳ Σαλαμὶς Διὸς ὄμβρῳ 
5.50	 ἀναρίθμων ἀνδρῶν χαλαζάεντι φόνῳ. 
5.51	 ἀλλʼ ὅμως καύχημα κατάβρεχε σιγᾷ· 
5.52	 Ζεὺς τά τε καὶ τὰ νέμει, 
5.53	 Ζεὺς ὁ πάντων κύριος. ἐν δʼ ἐρατεινῷ 
5.54	 μέλιτι καὶ τοιαίδε τιμαὶ καλλίνικον χάρμʼ ἀγαπάζοντι. μαρνάσθω τις ἔρδων 
5.55	 ἀμφʼ ἀέθλοισιν γενεὰν Κλεονίκου 
5.56	 ἐκμαθών· οὔτοι τετύφλωται μακρὸς 
5.57	 μόχθος ἀνδρῶν· οὐδʼ ὁπόσαι δαπάναι 
5.58	 ἐλπίδων ἔκνισʼ ὄπιν. 
5.59	 αἰνέω καὶ Πυθέαν ἐν γυιοδάμαις 
5.60	 Φυλακίδᾳ πλαγᾶν δρόμον εὐθυπορῆσαι 
5.61	 χερσὶ δεξιόν, νόῳ ἀντίπαλον. 
5.62	 λάμβανέ οἱ στέφανον, φέρε δʼ εὔμαλλον μίτραν, 
5.63	 καὶ πτερόεντα νέον σύμπεμψον ὕμνον. 
6.1	 θάλλοντος ἀνδρῶν ὡς ὅτε συμποσίου 
6.2	 δεύτερον κρητῆρα Μοισαίων μελέων 
6.3	 κίρναμεν Λάμπωνος εὐάθλου γενεᾶς ὕπερ, ἐν Νεμέᾳ μὲν πρῶτον, ὦ Ζεῦ, 
6.4	 τίν γʼ ἄωτον δεξάμενοι στεφάνων, 
6.5	 νῦν αὖτε Ἰσθμοῦ δεσπότᾳ 
6.6	 Νηρεΐδεσσί τε πεντήκοντα, παίδων ὁπλοτάτου 
6.7	 Φυλακίδα νικῶντος. εἴη δὲ τρίτον 
6.8	 σωτῆρι πορσαίνοντας Ὀλυμπίῳ Αἴγιναν κάτα 
6.9	 σπένδειν μελιφθόγγοις ἀοιδαῖς. 
6.10	 εἰ γάρ τις ἀνθρώπων δαπάνᾳ τε χαρεὶς 
6.11	 καὶ πόνῳ πράσσει θεοδμάτους ἀρετάς, 
6.12	 σύν τέ οἱ δαίμων φυτεύει δόξαν ἐπήρατον, ἐσχατιαῖς ἤδη πρὸς ὄλβου 
6.13	 βάλλετʼ ἄγκυραν θεότιμος ἐών. 
6.14	 τοίαισιν ὀργαῖς εὔχεται 
6.15	 ἀντιάσαις Ἀΐδαν γῆράς τε δέξασθαι πολιὸν 
6.16	 ὁ Κλεονίκου παῖς· ἐγὼ δʼ ὑψίθρονον 
6.17	 Κλωθὼ κασιγνήτας τε προσεννέπω ἑσπέσθαι κλυταῖς 
6.18	 ἀνδρὸς φίλου Μοίρας ἐφετμαῖς. 
6.19	 ὔμμε τʼ, ὦ χρυσάρματοι Αἰακίδαι, 
6.20	 τέθμιόν μοι φαμὶ σαφέστατον ἔμμεν 
6.21	 τάνδʼ ἐπιστείχοντα νᾶσον ῥαινέμεν εὐλογίαις. 
6.22	 μυρίαι δʼ ἔργων καλῶν τέτμηνθʼ ἑκατόμπεδοι ἐν σχερῷ κέλευθοι, 
6.23	 καὶ πέραν Νείλοιο παγᾶν καὶ διʼ Ὑπερβορέους· 
6.24	 οὐδʼ ἔστιν οὕτω βάρβαρος οὔτε παλίγγλωσσος πόλις, 
6.25	 ἅτις οὐ Πηλέος ἀΐει κλέος ἥρωος, εὐδαίμονος γαμβροῦ θεῶν, 
6.26	 οὐδʼ ἅτις Αἴαντος Τελαμωνιάδα 
6.27	 καὶ πατρός· τὸν χαλκοχάρμαν ἐς πόλεμον 
6.28	 ἆγε σὺν Τιρυνθίοισι πρόφρονα σύμμαχον ἐς Τρωΐαν, ἥρωσι μόχθον, 
6.29	 Λαομεδοντίαν ὑπὲρ ἀμπλακίαν 
6.30	 ἐν ναυσὶν Ἀλκμήνας τέκος. 
6.31	 εἷλε δὲ Περγαμίαν, πέφνεν δὲ σὺν κείνῳ Μερόπων 
6.32	 ἔθνεα καὶ τὸν βουβόταν οὔρεϊ ἴσον 
