585	χεύαις, εἰς ἔμετον δὲ καὶ οὐ χατέοντα πελάζοις,
586	ἠὲ πίθου φλογιῇ θάλψας κύτος αἰὲν ἐναλθῆ
587	ἀνέρα θερμάσσαιο, χέαι δ’ ἀπὸ νήχυτον ἱδρῷ·
588	καί τε καὶ αὐξηρῶν δονάκων ἀπὸ ῥίζεα κόψας
589	οἴνῃ ἐπεγκεράσαιο, τὰ δή ῥ’ ὑποτέτροφε λίμνη
590	οἰκείη, τόθι λεπτὰ διὲκ πόσιν ἑρπετὰ νήχει,
591	ἠὲ φιλοζώοιο κυπειρίδος ἠὲ κυπείρου,
592	αὐτόν τ’ ἠνεκέεσσι τρίβοις πανάπαστον ἐδωδῆς
593	καὶ πόσιος ξήραινε, κατατρύσαιο δὲ γυῖα.
594	Ἐχθραλέον δέ σε μή τι λιθάργυρος ἀλγινόεσσα
595	λήσειεν τότε γαστρὶ πέσῃ βάρος, ἀμφὶ δὲ μέσσον
596	πνεύματ’ ἀνειλίσσοντα κατ’ ὀμφάλιον βρομέῃσιν,
597	οἷά περ εἰλίγγοιο δυσαλθέος, ὅς τε δαμάζει
598	ἀνέρας ἀπροφάτοισιν ἐνιπλήσσων ὀδύνῃσιν.
599	οὐ μὲν τῶν γ’ οὔρων ἄνυται ῥύσις, ἀμφὶ δὲ γυῖα
600	πίμπραται, αὐτάρ που μολίβῳ εἰδήνατο χροιή.
601	Τῷ δ’ ὁτὲ μὲν σμύρνης ὀδελοῦ πόρε διπλόον ἄχθος,
602	ἄλλοτε δ’ ὁρμίνοιο νέην χύσιν, ἄλλοτε κόψαις
603	οὐρείην ὑπέρεικον, ὅθ’ ὑσσώπου ὀροδάμνους,
604	πολλάκι δ’ ἀγριόεντα κράδην, σπέραδός τε σελίνου
605	Ἴσθμιον, ᾧ θ’ ὑπὸ κοῦρον ἀλίβλαπτον Μελικέρτην
606	Σισυφίδαι κτερίσαντες ἐπηέξησαν ἀέθλους.
607	ἠὲ σύ γ’ ἐν πέπεριν ῥυτῇ συνομήρεα φώξας
608	οἴνῳ ἐνιτρίψαιο, κακῆς δ’ ἀπερύκεο νούσου,
609	κύπρου τε βλαστεῖα νεανθέα, πολλάκι σίδης
610	πρωτόγονον κυτίνοιο πόροις ἀνθήμονα καρπόν.
611	[Μὴ μὲν δὴ σμῖλον σὺ κακὴν ἐλατηίδα μάρψαις
612	Οἰταίην, θανάτοιο πολυκλαύτοιο δότειραν,
613	ἥν τε καὶ ἐμπλείουσα χαλικροτέρη πόσις οἴνης
614	οἴη ἐπαλθήσειε παραχρέος, ἡνίκα φωτὸς
615	ἴσθμια καὶ φάρυγος στεινὴν ἐμφράσσεται οἶμον.]
616	[Καὶ τὰ μὲν οὖν Νίκανδρος ἑῇ ἐνικάτθετο βίβλῳ
617	μοχθήεντα μύκητα παρ’ ἀνέρι φαρμακόεντα.
618	Πρὸς δ’ ἔτι τοῖς, Δίκτυννα τεῆς ἐχθήρατο κλῶνας
619	Ἥρη τ’ Ἰμβρασίη μούνη στέφος οὐχ ὑπέδεκτο
620	κάλλεος, οὕνεκα Κύπριν, ὅτ’ εἰς ἔριν ἠέρθησαν
621	ἀθάναται, κόσμησεν ἐν Ἰδαίοισιν ὄρεσσι, —
622	τῆς σύ γ’ ἀπ’ εὐύδροιο νάπης, εὐαλθὲς ὄνειαρ.
623	καρπὸν πορφυρόεντα συναλδέα χειμερίῃσιν
624	ἠελίου θαλφθέντα βολαῖς δοίδυκι λεήνας
625	χυλὸν ὑπὲκ λεπτῆς ὀθόνης ἢ σχοινίδι κύρτῃ
626	ἐκθλίψαντα πορεῖν κυάθου κοτυληδόνα πλήρη
627	ἢ πλεῖον, πλεῖον γὰρ ὀνήιον· — οὐ γὰρ ἀνιγρὸν
628	πῶμα βροτοῖς·— τόδε γάρ τε καὶ ἄρκιον, αἴκε πίῃσθα.]
629	Καί κ’ ἔνθ’ ὑμνοπόλοιο καὶ εἰσέτι Νικάνδροιο
630	μνῆστιν ἔχοις, θεσμὸν δὲ Διὸς ξενίοιο φυλάσσοις. 
