3.208	ὅσσοι θʼ Ἑρμείαο πόλιν, ναυσίκλυτον ἄστυ
3.209	Κωρύκιον, ναίουσι καὶ ἀμφιρύτην Ἐλεοῦσαν.
3.210	πέτρας μὲν κείνας τεκμαίρεται ἐγγύθι γαίης 
3.211	ἴδρις ἀνήρ, οἵῃσιν ὑπʼ ἀνθίαι αὐλίζονται,
3.212	ἀντροφυεῖς, κευθμῶσι διαρρῶγας θαμέεσσι·
3.213	δουρὶ δʼ ἀναπλώσας πινάκων ἐριηχέα τεύχει
3.214	δοῦπον ἐπικροτέων· πατάγῳ θʼ ἐπιτέρπεται ἦτορ
3.215	ἀνθιέων· καί πού τις ἀνέδραμεν αὐτίκα λίμνης, 
3.216	παπταίνων ἄκατόν τε καὶ ἀνέρα· τῷ δʼ ἄρʼ ἑτοίμας
3.217	πέρκας εὐθὺς ἵησιν ἐν οἴδμασιν ἢ κορακίνους
3.218	ἀσπαλιεύς, πρώτης ὀρέγων ξεινήϊα φορβῆς.
3.219	αὐτὰρ ὅ γʼ ἁρπάγδην κεχαρημένος εἰλαπινάζει
3.220	δαῖτα φίλην σαίνει τε δολόφρονα θηρητῆρα. 
3.221	ὡς δὲ φιλοξείνοιο μετʼ ἀνέρος οἰκία κέλσῃ
3.222	κλεινὸς ἀνὴρ ἢ χειρὸς ἐν ἔργμασιν ἠὲ νόοιο,
3.223	ἀσπασίως δʼ ὅ μιν εἶδεν ἐφέστιον, εὖ δέ ἑ δώροις
3.224	εὖ τέ μιν εἰλαπίναις τε φιλοφροσύναις τʼ ἀγαπάζει
3.225	παντοίαις· ἄμφω δὲ γεγηθότες ἀμφὶ τραπέζῃ 
3.226	τέρπονται κρητῆρος ἀμοιβαίοις δεπάεσσιν·
3.227	ὣς ὁ μὲν ἀσπαλιεὺς κεχαρημένος ἐλπωρῇσι
3.228	μειδιάᾳ, δείπνοις δὲ νέοις ἐπιτέρπεται ἰχθύς.
3.229	ἔνθεν ἔπειθʼ ὁ μὲν αἰὲν ἐπημάτιος ποτὶ πέτρην
3.230	στέλλεται, οὐδʼ ἀνίησιν ἑὸν πόνον οὐδʼ ἀπολείπει 
3.231	δαῖτα φέρων· οἱ δʼ αὐτίκʼ ἀολλέες ἀμφαγέρονται
3.232	δαιτυμόνες κατὰ χῶρον, ἅτε κλητῆρος ἄγοντος.
3.233	αἰεὶ δὲ πλεόνεσσιν ἑτοιμοτέροις τε παρίσχει
3.234	φορβὴν ἁρπαλέην· οὐδέ σφισιν ἄλλα κέλευθα
3.235	οὐδʼ ἄλλοι κεεθμῶνες ἐνὶ φρεσίν, ἀλλὰ μένοντες 
3.236	αὐτοῦ δηθύνουσιν, ἅτε σταθμοῖσι νομήων
3.237	πώεα χειμερίοισιν ἐν ἤμασιν αὐλίζονται,
3.238	οὐδʼ ὀλίγον σηκοῖο λιλαιόμενα προνέεσθαι.
3.239	οἱ δʼ ὅτʼ ἐσαθρήσωσιν ἀειρομένην ἀπὸ χέρσου
3.240	σπερχομένην τʼ ἐλάταις ἄκατον τρόφον, αὐτίκα πάντες 
3.241	ὀρθοὶ καγχαλόωντες ὑπεὶρ ἅλα δινεύοντες
3.242	ἱμερόεν παίζουσι καὶ ἀντιόωσι τιθήνῃ.
3.243	ὡς δʼ ὁπότʼ ἀπτήνεσσι φέρῃ βόσιν ὀρταλίχοισι
3.244	μήτηρ, εἰαρινοῦ ζεφύρου πρωτάγγελος ὄρνις,
3.245	οἱ δʼ ἁπαλὸν τρύζοντες ἐπιθρώσκουσι καλιῇ 
3.246	γηθόσυνοι περὶ μητρὶ καὶ ἱμείροντες ἐδωδῆς
3.247	χεῖλος ἀναπτύσσουσιν, ἅπαν δʼ ἐπὶ δῶμα λέληκεν
3.248	ἀνδρὸς ξεινοδόκοιο λίγα κλάζουσα νεοσσοῖς·
3.249	ὣς οἵ γε θρεπτῆρος ἐναντίον ἐρχομένοιο
3.250	γηθόσυνοι θρώσκουσι, χοροιτύπον ὥστʼ ἀνὰ κύκλον. 
3.251	τοὺς δʼ ἁλιεὺς βρώμῃσιν ἐπασσυτέρῃσι λιπαίνων
3.252	χειρί τʼ ἐπιψαύων χειρός τʼ ἄπο δῶρα τιταίνων
3.253	πρηΰνει φίλον ἦτορ· ἄφαρ δέ οἱ ἠΰτʼ ἄνακτι
3.254	πείθονται, καὶ χειρὸς ὅπη νεύσειε μύωπι
3.255	ῥίμφα διαΐσσουσιν· ὁ δʼ ἄλλοτε νηὸς ὄπισθεν 
3.256	ἄλλοτε δὲ πρόσσω, ποτὲ δὲ σχεδὸν ἠπείροιο
3.257	πέμπει δεξιτερήν· τοὺς δʼ ὄψεαι ἠΰτε παῖδας
3.258	ἀνδρὸς ἐπιφροσύνῃσι παλαισμοσύνης ἀνὰ χῶρον
3.259	τῇ καὶ τῇ θύνοντας, ἐπίσκοπος ἔνθα κελεύει.
3.260	ἀλλʼ ὅτε οἱ κομιδῆς μὲν ἅλις, θήρη δὲ μέληται, 
3.261	δή ῥα τόθʼ ὁρμιὴν μὲν ἀναψάμενος χερὶ λαιῇ
3.262	ἕζεται, ἀγκίστρου δὲ βέλος κρατερόν τε θοόν τε
3.263	ὁπλίζει, καὶ τοὺς μὲν ἀπέτραπε χειρὶ κελεύων
3.264	πάντας ὁμῶς ἢ λᾶαν ἑλὼν ἔρριψε καθʼ ὕδωρ·
3.265	οἱ δʼ ἐπὶ τῷ δύνουσιν, ὀϊόμενοι βόσιν εἶναι· 
3.266	τῶν δʼ ἕνα μοῦνον ἔλειπεν ἀπόκριτον, ὅν κʼ ἐθέλῃσι,
3.267	δύσμορον, ὑστατίοισι κεχαρμένον ἐν δείπνοισι·
3.268	ἄγκιστρον μὲν ὄρεξεν ὑπεὶρ ἁλός· αὐτὰρ ὅ γʼ ἄτην
3.269	καρπαλίμως ἥρπαξεν, ὁ δʼ ἔσπασεν ἀμφοτέρῃσι
3.270	θερμὸς ἀνήρ, ὠκεῖαν ἑλὼν καὶ ἐπίκλοπον ἄγρην· 
3.271	λήθει δʼ ἀνθιέων ἄλλον χορόν· ἤν γὰρ ἴδωνται
3.272	ἢ σμαραγὴν ἀΐωσι δυσαγρέος ἑλκομένοιο,
3.273	οὐκέτι οἱ τόσα δεῖπνα παρέσσεται, ὥς κεν ἵκοιντο
3.274	αὖτις ὑποτροπάδην, ἀπὸ δʼ ἔπτυσαν ἐχθήραντες
3.275	καὶ κομιδὴν καὶ χῶρον ὀλέθριον· ἀλλά τις εἴη 
3.276	ἴφθιμος, κρατερῶς δὲ βιησάμενός μιν ἀνέλκοι,
3.277	ἢ καὶ δεύτερος ἄλλος ἐφαπτέσθω καμάτοιο·
3.278	ὧδε γὰρ οὐ φρονέοντες ἑὴν δολομήχανον ἄτην
3.279	αὐτοὶ πιανθέντες ἐοικότα πιαίνουσιν·
3.280	αἰεὶ δʼ, εὖτʼ ἐθέλῃσθα, παρέσσεται εὔστοχος ἄγρη. 
3.281	ἄλλοι δʼ ἰφθίμῳ τε βίῃ καὶ κάρτεϊ γυίων
3.282	πειθόμενοι μέγαν ἆθλον ἐπʼ ἀνθίῃ ὁπλίζονται,
3.283	οὐ φιλίην, οὐ σῖτα πονεύμενοι, ἀλλʼ ἐς ἀκωκὴν
3.284	ἀγκίστρου σπεύδουσι καὶ ἠνορέῃ βιόωνται.
3.285	χαλκοῦ μὲν σκληροῖο τετυγμένον ἠὲ σιδήρου 
3.286	ἄγκιστρον πέλεται, δίχα δὲ γλωχῖνες ἔχουσιν
3.287	ἀμφίδυμοι μέγα πεῖσμα λινόστροφον· ἀμφὶ δʼ ἄρʼ αὐτῷ
3.288	λάβρακα ζώοντα παρήλασαν, εἴ σφι παρείη·
3.289	εἰ δὲ θάνοι, τάχα οἵ τις ὑπὸ στόμα θῆκε μόλιβδον,
3.290	δελφῖνʼ ὃν καλέουσιν· ὁ δὲ βρίθοντι μολίβδῳ 
3.291	κλίνει τʼ ἀγκλίνει τε κάρη ζώοντι ἐοικώς.
3.292	θώμιξ δὲ κρατερή τε καὶ εὔπλοκος· ἀλλʼ ὅτε δοῦπον
3.293	ἀνθίαι εἰσαΐοντες ἀναθρώξωσι θαλάσσης,
3.294	ἄλλοις μὲν μέλεται κώπης πόνος, αὐτὰρ ὅ γʼ ἄκρης
3.295	ἐκ πρύμνης ἁλιεὺς δόλον ἀγκύλον εἰς ἅλα πέμπει, 
3.296	ἦκʼ ἀναδινεύων· οἱ δʼ αὐτίκα πάντες ἕπονται
3.297	νηΐ τε καὶ φεύγοντι δεδορκότες εἴκελον ἰχθὺν
3.298	σπεύδοντες μετὰ δαῖτα παραφθαδὸν ἀΐσσουσιν
3.299	ἀλλήλων· φαίης κεν ἐπʼ ἀνέρα δήϊον ἄνδρα
3.300	γούνατʼ ἐλαφρίζειν πεφοβημένον· οἱ δʼ ἄρα νίκης 
3.301	ἐσθλῆς ἱμείρουσιν· ὁ δʼ ἔξοχον ὅν κεν ἴδηται
3.302	ἀσπαλιεύς, τῷ δαῖτα παρέσχεθεν· αὐτὰρ ὁ λάβρως
3.303	δῶρα χανὼν δύσδωρα μετέδραμεν· ἔνθεν ἔπειτα
3.304	ἀλκὴν ἀμφοτέρων θηήσεαι, οἷος ἄεθλος
3.305	μαρναμένων ἀνδρός τε καὶ ἰχθύος ἑλκομένοιο· 
3.306	τοῦ μὲν γὰρ σθεναροί τε βραχίονες ἠδὲ μέτωπα
3.307	ὦμοί τʼ αὐχένιοί τε παρασφύριοί τε τένοντες
3.308	ἀλκῇ κυμαίνουσι καὶ ἠνορέῃ τανύονται·
3.309	αὐτὰρ ὅ γʼ ἀσχαλόων ὀδύνης ὕπο μάρναται ἰχθύς,
3.310	ἕλκων αὖ ἐρύοντα, βιώμενος εἰς ἅλα δῦναι, 
3.311	ἄσχετα μαιμώων· ὁ δὲ κέκλεται ἄνδρας ἑταίρους
3.312	ἐμπίπτειν ἐλάτῃσι· διωκομένης δʼ ἀκάτοιο
3.313	ἔμπαλιν ἐκ πρύμνης ὅλος ἕλκεται ἰχθύος ὁρμῇ·
3.314	κλάζει δʼ ὁρμιή, χειρὸς δʼ ἀπολείβεται αἷμα
3.315	πριομένης· ὁ δʼ ἄρʼ οὔτι βαρύν μεθίησιν ἀγῶνα. 
3.316	ὡς δὲ δύω μεμαῶτες ὑπέρβιοι ἀνέρες ἀλκὴν
3.317	ἅμματʼ ἐπʼ ἀλλήλοισι τιταινόμενοι βιόωνται
3.318	ἑλκῦσαι, ῥιπῇσιν ὀπισθοφόροις ἐρύοντες,
3.319	δηρόν τʼ ἀμφότεροι καμάτων ἴσα μέτρα φέροντες
3.320	ἐμμενέως ἕλκουσι καὶ ἐμμενέως ἐρύονται· 
3.321	ὣς τοῖς, ἰχθυβόλῳ τε καὶ ἰχθύϊ, νεῖκος ὄρωρε,
3.322	τοῦ μὲν ἀπαΐξαι, τοῦ δʼ ἑλκέμεν ἱμείροντος.
3.323	οὐ μέν μιν λείπουσιν ἐν ἄλγεσιν ἰχθύες ἄλλοι
3.324	ἀνθίαι ἀλλʼ ἐθέλουσιν ἀμυνέμεν, ἐν δέ οἱ αὐτῷ
3.325	νῶτα βίῃ χρίμπτουσι καὶ ἐμπίπτουσιν ἕκαστος, 
3.326	ἄφρονες, οὐδʼ ἐνόησαν ἑὸν τείροντες ἑταῖρον.
3.327	πολλάκι καὶ θώμιγγα λιλαιόμενοι γενύεσσι
3.328	ῥῆξαι ἀμηχανόωσιν, ἐπεὶ στόμα τοῖσιν ἄοπλον.
3.329	ὀψὲ δέ μιν καμάτῳ τε καὶ ἄλγεσι μοχθίζοντα
3.330	πυκναῖς τʼ εἰρεσίῃσι βιώμενος ἔσπασεν ἀνήρ· 
3.331	εἰ δʼ ἄρα οἱ καὶ τυτθὸν ὑπείξεται, οὔ μιν ἔπειτα
3.332	ἐλεύσει· τοῖον γὰρ ὑπερφίαλον σθένος αὐτῷ.
3.333	πολλάκι δʼ ὀξύπρωρον ὑπὲρ ῥάχιν ἔτμαγε δάψας
3.334	ὁρμιήν, ἀπὸ δʼ ᾖξε λιπὼν κενὸν ἀγρευτῆρα.
3.335	τοῖον καὶ κάλλιχθυς ἔχει σθένος ἠδὲ γενέθλη 
3.336	ὀρκύνων ὅσσοι τε δέμας κητώδεες ἄλλοι
3.337	πλάζονται· τοίοις δὲ βραχίοσιν ἀγρώσσονται.
3.338	ἄλλους δʼ αὖ βρώμῃσι καὶ εἰλαπίνῃσι δολώσας
3.339	ἀγρώσσει ἁλιεύς· ἀγαθὸς δέ οἱ ἔσσεται ἰχθὺς
3.340	κάνθαρος, ὃς πέτρῃσιν ἀεὶ λεπρῇσι γέγηθε. 
3.341	κύρτον δὲ πλέξαιο περίδρομον ὅττι μέγιστον,
3.342	τεύχων ἢ σπάρτοισιν Ἰβηρίσιν ἠὲ λύγοισι,
3.343	ῥάβδους ἀμφιβαλών· λευρὴ δέ οἱ εἴσοδος ἔστω
3.344	γαστήρ τʼ εὐρυχανής· δέλεαρ δέ οἱ ἔνδον ἐνείης
3.345	πούλυπον ἑρπυστὴν ἢ κάραβον, ἐκ πυρὸς ἄμφω 
3.346	ὀπταλέους· κνίσση γὰρ ἐφέλκεται ἰχθύας εἴσω.
3.347	ὧδε μὲν ἐντύνας πλεκτὸν δόλον ἐγγύθι πέτρης
3.348	δόχμιον ἀγκλίνοις, ὕφαλον λόχον· αὐτίκα δʼ ὀδμὴ
3.349	κάνθαρον ὀτρυνέει τε καὶ ἵξεται ἔνδοθι κύρτου,
3.350	οὐ μάλα θαρσαλέος πρώτην ὁδόν, ἀλλὰ τάχιστα 
3.351	δαισάμενος παλίνορσος ἀπέδραμεν· ἔνθεν ἔπειτα
3.352	κυρτεὺς μὲν κείνοισιν ἀεὶ νεοτερπέα φορβὴν
3.353	ἐντίθεται· τοὺς δʼ αἶψα δυσώνυμος ἐντὸς ἀγείρει
3.354	γαστήρ, ἄλλον δʼ ἄλλος ἄγει σύνδορπον ἑταῖρον.
3.355	ἤδη δʼ ἀτρομέοντες ἀολλέες ἔνδοθι κύρτου 
3.356	ἀγρόμενοι πρόπαν ἦμαρ ἐνήμενοι, ὥστε μέλαθρον
3.357	κτησάμενοι, μίμνουσι, κακὴν δʼ εὕροντο καλιήν.
3.358	ὡς δʼ ὁπότʼ ὀρφανικοῖο μετʼ ἠιθέοιο μέλαθρον
3.359	οὔτι σαοφροσύνῃσι μεμηλότες ἥλικες ἄλλοι
3.360	κλητοί τʼ αὐτόμολοί τε πανήμεροι ἀγερέθωνται, 
3.361	κτῆσιν ἀεὶ κείροντες ἀσημάντοιο δόμοιο,
3.362	οἷα νέους ἀνίησι χαλίφρονας ἄκριτος ἥβη,
3.363	ἐν δὲ κακοφροσύνῃσι κακὴν εὕραντο τελευτήν·
3.364	ὣς τοῖς ἀγρομένοισι παρασχεδὸν ἵσταται ἄτη.
3.365	ἡνίκα γὰρ πολλοί τε καὶ εὐλιπέες τελέθωσι, 
3.366	δὴ τότʼ ἀνὴρ κύρτοιο περὶ στόμα πῶμα καλύπτει
3.367	εὖ ἀραρός· τοὺς δʼ ἔνδον ἐν ἕρκεϊ πεπτηῶτας
3.368	ὑστάτιον κνώσσοντας ἀνείρυσεν· ὀψὲ δʼ ὄλεθρον
3.369	φρασσάμενοι σπαίρουσι καὶ ἐκδῦναι μεμάασι,
3.370	νήπιοι, οὐδʼ ἔτι κύρτον ὁμῶς εὔοικον ἔχουσιν. 
3.371	Ἄδμωσιν δʼ ἐπὶ κύρτον ὀπωρινὸν ὁπλίζονται
3.372	ὀΐσυνον, μέσσοισι δʼ ἐν οἴδμασιν ὁρμίζουσι,
3.373	νέρθεν ἀναψάμενοι τρητὸν λίθον εὐναστῆρα·
3.374	φελλοὶ δʼ ὀχμάζουσιν ἄνω δόλον· ἐν δέ οἱ αἰεὶ
3.375	τέσσαρας ἀκταίους διεροὺς κάχληκας ἱεῖσι· 
3.376	τοῖς δὲ διαινομένοισι περιτρέφεται γλαγόεσσα
3.377	μύξα θαλασσαίη, τῆς ἵμερος ἰχθύας ἕλκει
3.378	βαιούς, οὐτιδανούς, λίχνον γένος· οἱ δʼ ἀγέρονται
3.379	κύρτον ἐπιπροθέοντες ἐν ἀγκοίνῃς τε μένουσιν.
3.380	ἄδμωες δʼ ὁρόωντες ἔσω κοίλοιο μυχοῖο 
3.381	ἀγρομένους τάχα πάντες ἐπί σφισιν ὡρμήθησαν,
3.382	δαιτὸς ἐελδόμενοι· τοὺς δʼ οὐ κίχον, ἀλλʼ ὑπόλισθον
3.383	ῥηϊδίως· οἱ δʼ οὔτι καὶ ἱέμενοί περ ἔχουσιν
3.384	αὖτις ὑπεκδῦναι πλεκτὸν λόχον, ἀλλʼ ἑτέροισι
3.385	πήματα πορσύνοντες ἐπί σφισιν εὗρον ὄλεθρον. 
3.386	ὡς δέ τις ἐν ξυλόχοισιν ὀρέστερος ἀγροιώτης
3.387	θηρὶ πάγην ἤρτυνεν, ἀπηνέϊ δʼ ἔνδοθι θυμῷ
3.388	δῆσε κυνὸς σφίγγων ἄπο μήδεα· τοῦ δʼ ὀδύνῃσιν
3.389	ἠχήεις ὀρυμαγδὸς ἀπόπροθι τειρομένοιο
3.390	ἔρχεται, ἀμφὶ δέ οἱ στένεται δρίος· ἡ δʼ ἀΐουσα 
3.391	πόρδαλις ἰάνθη τε καὶ ἔσσυται, ἴχνος ἀϋτῆς
3.392	μαιομένη· τάχα δʼ ἷξε καὶ ἔνθορε· τὸν μὲν ἔπειτα
3.393	ὑψόσʼ ἀναρπάζει κρυπτὸς δόλος, ἡ δʼ ἐνὶ βόθρῳ
3.394	εἰλεῖται προπεσοῦσα, μέλει δέ οἱ οὐκέτι δαιτός,
3.395	ἀλλὰ φόβου· τῇ δʼ οὔτις ὑπέκδυσίς ἐστιν ἑτοίμη· 
3.396	τοῖα καὶ ἄδμωες δειλοὶ πάθον, ἀντὶ δὲ φορβῆς
3.397	πότμον ἐφωρμήσαντο καὶ Ἄϊδος ἕρκος ἄφυκτον.
3.398	καὶ μέν τις θρίσσῃσιν ὁμῶς καὶ χαλκίσιν ἄγρην
3.399	φράσσατʼ ὀπωρινήν, καὶ λαρινὸν εἷλε καὶ ἔθνη
3.400	τραχούρων, κύρτον μὲν ὑπὸ σπάρτοισιν ὑφήνας 
3.401	εὐπαγέως, φρυκτῶν δʼ ὀρόβων ἐνεθήκατο μάζαν,
3.402	οἴνῳ μυδαλέην εὐώδεϊ, μίξε δὲ κούρης
3.403	δάκρυον Ἀσσυρίης Θειαντίδος, ἥν ποτέ φασι
3.404	πατρὸς ἐρασσαμένην δυσμήχανον ἔργον ἀνύσσαι
3.405	ἐλθεῖν τʼ ἐς φιλότητα χολωσαμένης Ἀφροδίτης· 
3.406	ἀλλʼ ὅτε μιν καὶ δένδρον ἐπώνυμον ἐρρίζωσεν
3.407	αἶσα θεῶν, γοάει τε καὶ ἣν ὀλοφύρεται ἄτην,
3.408	δάκρυσι δευομένη λέκτρου χάριν· ἧς ἐνιμίσγων
3.409	θεῖον ὀπὸν κύρτον μὲν ἐνορμίζει ῥοθίοισιν,
3.410	ὀδμὴ δʼ αἶψα θάλασσαν ἐπέδραμε λειριόεσσα, 
3.411	κικλήσκουσʼ ἀγέλας πολυειδέας· οἱ δʼ ἐφέπονται
3.412	πνοιῇ νηδυμίῃ δεδονημένοι, ὦκα δὲ κύρτος
3.413	πίμπλαται, ἀγρευτῆρι φέρων εὔθηρον ἀμοιβήν.
3.414	Σάλπαι δʼ ἰκμαλέοις μὲν ἀεὶ φύκεσσι μάλιστα
3.415	τέρπονται, κείνῃ δὲ καὶ ἀγρώσσονται ἐδωδῇ. 
3.416	πλώει μὲν προτέροισιν ἐν ἤμασιν εἰς ἕνα χῶρον
3.417	ἀσπαλιεύς, αἰεὶ δὲ μετʼ οἴδμασι λᾶας ἵησι
3.418	χερμάδας, ἁψάμενος πέρι φύκια τηλεθόωντα.
3.419	ἀλλʼ ὅτε δὴ πέμπτη μὲν ἴδῃ πόνον ἠριγένεια
3.420	σάλπαι δʼ ἀγρόμεναι κεῖνον πόρον ἀμφινέμωνται, 
3.421	τῆμος ἐπεντύνει κύρτου δόλον· ἐν δέ οἱ εἴσω
3.422	φύκεσιν εἰλομένους λᾶας βάλεν, ἀμφὶ δὲ ποίας
3.423	εἰναλίας στομίοισιν ἐδήσατο, τῇσι γάνυνται
3.424	σάλπαι τʼ ἠδʼ ὅσσοι βοτανηφάγοι ἰχθύες ἄλλοι·
3.425	οἳ τότʼ ἀγειρόμενοι ποίας φάγον, αὐτὰρ ἔπειτα 
3.426	ἐς μυχὸν ἠΐχθησαν· ὁ δʼ αὐτίκα κύρτον ἀνέλκει
3.427	ῥίμφα μεταπλώσας· σιγῇ δέ οἱ ἄνυται ἔργον,
3.428	ἀνδράσι τʼ ἀφθόγγοισι καὶ ἀσμαράγοις ἐλάτῃσι·
3.429	σιγὴ γὰρ πάσαις μὲν ὀφέλσιμος ἔπλετο θήραις,
3.430	ἔξοχα δʼ ἐν σάλπῃσιν· ἐπεὶ μάλα τῇσι νόημα 
3.431	πτοιαλέον· πτοίη δὲ πόνον δύσθηρον ἔθηκε.
3.432	τρίγλης δʼ οὔτινα, φημί, χερειοτέρῃσιν ἐδωδαῖς
3.433	τέρπεσθαι· πᾶσαν γὰρ ἄσιν ἁλός, ἥν κε κίχῃσι,
3.434	φέρβεται· ἱμείρει δὲ δυσαέος ἔξοχα δαιτός·
3.435	σώμασι δʼ ἐκπάγλως ἐπιτέρπεται ἀνδρομέοισι 
3.436	πυθομένοις, εὖτʼ ἄν τινʼ ἕλῃ στονόεσσα θάλασσα.
3.437	τῷ καί μιν δελέασσιν ἀποπνείουσιν ἀϋτμὴν
3.438	ῥηϊδίως ἕλκουσιν, ὅσα πνέει ἐχθρὸν ἄημα.
3.439	εἴκελα δὲ τρίγλῃσιν ὕεσσί τε, φημί, τετύχθαι
3.440	ἤθεα, φυρομένοισιν ἀεὶ περὶ γαστέρος ὁρμήν· 
3.441	ἄμφω δʼ αἱ μὲν ἔασι διάκριτοι ἐν νεπόδεσσιν,
3.442	οἱ δʼ ἐνὶ χερσαίῃσιν ἀριστεύουσʼ ἀγέλῃσιν.
3.443	οὐ μὲν δὴ μελάνουρον ἀποίσεαι οὔτʼ ἐνὶ κύρτῳ
3.444	ῥηϊδίως ἀπαφῶν οὔτʼ ἐν λινοεργέϊ κύκλῳ·
3.445	ἔξοχα γὰρ μελάνουρος ἐν ἰχθύσιν ἠμὲν ἄναλκις 
3.446	ἠδὲ σαοφρονέων, λίχνη δέ οἱ οὔποτʼ ἐδωδὴ
3.447	θυμήρης· αἰεὶ δὲ γαληναίης μὲν ἐούσης
3.448	κέκλιται ἐν ψαμάθοισι καὶ οὐκ ἀναδύεται ἅλμης·
3.449	ἀλλʼ ὅτε κυμαίνουσα περισπέρχῃσι θάλασσα
3.450	λάβρων ἐξ ἀνέμων, τότε δὴ μοῦνοι μελάνουροι 
3.451	κῦμα διαΐσσουσιν ἀολλέες, οὔτε τινʼ ἀνδρῶν
3.452	οὔτε τινʼ εἰναλίων πεφρικότες· οἱ μέν ἅπαντες
3.453	ἐς νεάτην κρηπῖδα φόβῳ δύνουσι θαλάσσης,
3.454	οἱ δὲ τότʼ ἠϊόνας τε πολυφλοίσβους ἐφέπουσι
3.455	πέτραις τʼ ἐμπελάουσιν ἀλήμονες, εἴ τινʼ ἐδητὺν 
3.456	κοπτομένη δείξειεν ὑπὸ ῥιπῇσι θάλασσα·
3.457	νήπιοι, οὐδʼ ἐδάησαν ὅσον πινυτώτεροι ἄνδρες,
3.458	οἳ κείνους καὶ πάμπαν ἀλευομένους ἕλον ἄγρῃ.
3.459	χειμερίη πλημμυρὶς ὅταν ζέῃ Ἀμφιτρίτης,
3.460	ἵστατʼ ἐπὶ προὔχουσαν ἀνὴρ ἁλιηγέα πέτρην, 
3.461	ὀξύτατον τόθι κῦμα περὶ σπιλάδεσσι μέμυκεν·
3.462	εἴδατα δʼ ἀγνυμένοισιν ἐπισπείρει ῥοθίοισι,
3.463	τυρὸν ὁμοῦ Δήμητρι μεμιγμένον· οἱ δʼ ἐπὶ φορβὴν
3.464	ἀσπασίην θρώσκουσιν ἐπειγόμενοι μελάνουροι.
3.465	ἀλλʼ ὅτε οἱ παρέασιν ἀολλέες ἐς βόλον ἄγρης, 
3.466	αὐτὸς μὲν τρέπεται λοξὸν δέμας, ὄφρα οἱ ὕδωρ
3.467	μήτι κατασκιάοιτο καὶ ἰχθύσι τάρβος ἐνείη·
3.468	ἔστι δέ οἱ λεπτός τε δόναξ μετὰ χερσὶν ἑτοῖμος
3.469	λεπτή θʼ ὁρμιὴ κούφης τριχός, ἄπλοκος αὔτως·
3.470	λεπτοῖς δʼ ἀγκίστροισιν ἀναπλέκεται θαμέεσσι· 
3.471	τοῖς ἐπέθηκε δέλετρον, ὃ καὶ πάρος ἧκε καθʼ ὕδωρ,
3.472	πέμπει δʼ ἐς βαθὺ κῦμα κυκώμενον· οἱ δʼ ὁρόωντες
3.473	αὐτίκʼ ἐπιθρώσκουσι καὶ ἁρπάζουσιν ὄλεθρον.
3.474	οὐδʼ ἁλιεὺς εὔκηλον ἔχει χέρα, πυκνὰ δʼ ἀνέλκει
3.475	ἐκ δίνης ἄγκιστρα, καὶ εἰ κενὰ πολλάκις εἴη· 
3.476	οὐ γὰρ βρασσομένης κεν ἐπιφράσσαιτο θαλάσσης
3.477	ἀτρεκέως, εἴτʼ οὖν τις ἐνίσχεται εἴτε μιν αὔτως
3.478	κύματʼ ἀνακλονέουσιν· ἐπὴν δέ τις ἀμφιχάνῃσι,
3.479	ῥίμφα μιν ἐξείρυσσε πάρος δόλον ἐν φρεσὶ θέσθαι,
3.480	πρὶν φόβον οὐτιδανοῖσιν ἐνιπλῆξαι μελανούροις. 
3.481	τοίην χειμερίην πανεπίκλοπον ἤνυσεν ἄγρην.
3.482	ναὶ μὴν καὶ κεστρῆα, καὶ οὐ λίχνον περ ἐόντα,
3.483	ἤπαφον, ἀγκίστροισι περὶ στεινοῖσιν ἕσαντες
3.484	εἶδαρ ὁμοῦ Δήμητρι μεμιγμένον ἠδὲ γάλακτος
3.485	πηκτοῖσι δώροισιν· ἐφυρήσαντο δὲ ποίην 
3.486	τοῖσιν ὁμοῦ μίνθην εὐώδεα, τήν ποτε κούρην
3.487	φασὶν ὑπουδαίην ἔμεναι, Κωκυτίδα Νύμφην·
3.488	κλίνατο δʼ εἰς εὐνὴν Ἀϊδωνέος· ἀλλʼ ὅτε κούρην
3.489	Περσεφόνην ἥρπαξεν ἀπʼ Αἰτναίοιο πάγοιο,
