4.407	αἰνὰ Ποσειδάωνος ἀμειλίκτοιο τυχοῦσαν,
4.408	δασσάμενον μέγα κῦμα διακριδὸν ἄλλοθεν ἄλλα
4.409	δοῦρα φέρῃ λώβῃσι πολυσχιδέεσσι λυθέντα.
4.410	τῆμος δʼ ἱππούρων ἀγέλαι πινάκεσσι θεούσαις 
4.411	ἑσπόμεναι μεθέπουσιν· ὁ δʼ ἐγκύρσας ἁλιήων
4.412	πολλὴν ῥηϊδίως ἄγρην ἕλεν ἠδʼ ἀμέγαρτον.
4.413	ἀλλὰ τὸ μὲν ναύτῃσιν ἀλεξήσειε Κρονίων
4.414	ἐμβύθιος, νῆες δὲ διὰ πλατὺ κῦμα θέοιεν
4.415	αὔραις εὐκήλοισιν ἀπήμονες ἠδʼ ἀτίνακτοι, 
4.416	φόρτον ἀμοιβαίοισι μετερχόμεναι καμάτοισιν,
4.417	ἱππούροις δʼ ἀλλοῖα νοήματα τεχνήσασθαι
4.418	ἐστίν, ἀπημοσύνῃ δὲ νεῶν μεταβαινέμεν ἄγρην.
4.419	Συμφερτοὺς δονάκων φακέλους ἅμα γυρώσαντες
4.420	δίναις ἐγκατέθηκαν, ἔνερθε δὲ λᾶαν ἔδησαν 
4.421	βριθὺν ὑφορμιστῆρα· τὰ μὲν μάλα πάντα καθʼ ὕδωρ
4.422	ἀτρέμα δινεύουσι· φιλόσκια δʼ αὐτίκα φῦλα
4.423	ἱππούρων ἀγεληδὸν ἀγείρεται, ἀμφὶ δὲ νῶτα
4.424	τερπόμενοι δονάκεσσιν ἀνατρίβουσι μένοντες·
4.425	τοῖς δὲ τότʼ ἀσπαλιῆες ἐπιπλώουσιν ἑτοίμην 
4.426	εἰς ἄγρην, ἄγκιστρα δʼ ὑπʼ εἴδασιν ὁπλίσσαντες
4.427	πέμπουσʼ, οἱ δʼ ἐρύουσιν ἅμα σπεύδοντες ὄλεθρον.
4.428	ὡς δὲ κύνας βρώμῃσιν ἀνὴρ ἐπὶ μῶλον ὀρίνει
4.429	δινεύων μέσσοισιν ἑλώρια, τοὶ δʼ ἐπὶ γαστρὶ
4.430	ἔξοχα μαργαίνοντες ὑποφθαδὸν ἅρπαγι λύσσῃ 
4.431	ἀλλήλους προθέουσι καὶ ἐς χέρα παπταίνουσιν
4.432	ἀνδρός, ὅπῃ ῥίψειεν, ἔρις δʼ ἀναφαίνετʼ ὀδόντων·
4.433	ὣς οἵ γʼ ἀγκίστροισιν ἐπαΐσσουσιν ἑτοίμως.
4.434	ῥηϊδίως δʼ ἀγρευτὸν ἐρύσσεαι ἄλλον ἐπʼ ἄλλῳ
4.435	κραιπνὸς ἐών· αὐτοὶ γὰρ ἐπισπεύδουσʼ ἁλιήων 
4.436	μᾶλλον, ὑπʼ ἀφραδίῃσιν ἑὸν μόρον ἐγκονέοντες.
4.437	Τοίῃ ἐπιφροσύνῃ καὶ πομπίλον ἀγρώσσονται·
4.438	καὶ γὰρ τοῖς ἴσον ἦτορ ἐπὶ σκιεροῖσι πόθοισι.
4.439	Τευθίσι δʼ ἄτρακτόν τις ἀνὴρ ἐπιμηχανόῳτο,
4.440	ἐντύνων κλωστῆρι πανείκελον· ἀμφὶ δʼ ἄρʼ αὐτῷ 
4.441	πυκνὰ καταζεύξειεν ἀνακλίνων γενύεσσιν
4.442	ἄγκιστρʼ ἀλλήλοισι παρασχεδόν, οἷς ἔπι σῶμα
4.443	ποικίλον ἐμπείρειεν ἰουλίδος, ὕπτια χαλκοῦ
4.444	δήγματʼ ἐπικρύπτων, γλαυκοῖς δʼ ἐνὶ βένθεσι λίμνης
4.445	τοῖον ἀναψάμενος σύροι δόλον· ἡ δʼ ἐσιδοῦσα 
4.446	τευθὶς ἐφωρμήθη τε καὶ ἀμφιέπουσα πιέζει
4.447	ἰκμαλέοις θυσάνοις, ἐπάγη δʼ ἐνὶ χείλεσι χαλκοῦ·
4.448	οὐδʼ ἔτι καὶ μεμαυῖα λιπεῖν δύνατʼ, ἀλλʼ ἀέκουσα
4.449	ἕλκεται, αὐτόπλεκτον ἑὸν δέμας ἀμφιβαλοῦσα.
4.450	καὶ μέν τις λιμένεσσι παρʼ ἀκλύστοισι θαλάσσης 
4.451	ἄγρην ἐγχελύων τεχνήσατο κοῦρος ἀθύρων.
4.452	ἔντερον οἰὸς ἑλὼν περιμήκετον ἧκε καθʼ ὕδωρ
4.453	ἐκτάδιον, δολιχῇσιν ἀλίγκιον ὁρμιῇσιν·
4.454	ἡ δʼ ἐσιδοῦσʼ ἐπόρουσε καὶ ἔσπασε· τὴν δὲ χανοῦσαν
4.455	ἔγνω καὶ μήλειον ἄφαρ κύρτωσεν ἀϋτμῇ 
4.456	ἔγκατον ἐμπνείων· τὸ δʼ ἀνίσταται ἄσθματι λάβρῳ
4.457	οἰδαλέον, πλῆσεν δὲ τιταινόμενον στόμα δειλῆς
4.458	ἐγχέλυος· πνοιῇ δὲ περιστένεται μογέουσα
4.459	ἀνδρομέῃ, δέδεται δὲ καὶ ἱεμένη περ ἀλύξαι,
4.460	εἰσόκεν οἰδαίνουσα καὶ ἄσχετον ἀσθμαίνουσα 
4.461	ὑψόσʼ ἀναπλώσῃ καὶ ὑπʼ ἀγρευτῆρι γένηται.
4.462	ὡς δʼ ὅτε τις πλείου πειρώμενος ἀμφιφορῆος
4.463	αὐλὸν ἔχων ἤρεισεν ὑπὸ στόμα φυσητῆρα,
4.464	ἄσθματι δʼ αὖ ἐρύει μέθυος ποτὸν ἔμπαλιν ἕλκων
4.465	χείεσιν ἀκροτάτοις, τὸ δʼ ἀνατρέχει ἀνδρὸς ἀϋτμῇ· 
4.466	ὣς αἵ γʼ ἐγχέλυες πνοιῆς ὕπο κυμαίνουσαι
4.467	ἕλκονται δολίοιο ποτὶ στόμα φυσητῆρος.
4.468	ἔστι δέ τις νεπόδων δειλὸς καὶ ἄκικυς ὅμιλος,
4.469	ἀβληχρῆς ἀφύης ἀδινὸν γένος, αἳ καλέονται
4.470	ἐγγραύλεις· ἀγαθὴ δὲ βόσις πάντεσσιν ἔασιν 
4.471	ἰχθύσιν· αἰεὶ δέ σφιν ἐνὶ φρεσὶ φῦζα δέδηε,
4.472	πάντα δʼ ὑποτρομέουσι, σὺν ἀλλήλαις δὲ χυθεῖσαι
4.473	σωρηδὸν μίμνουσι καὶ ἀθρόαι ἐμπεφύασιν,
4.474	ἠΰτʼ ἀναγκαίοιο βίην δεσμοῖο φέρουσαι·
4.475	οὐδέ κε μητίσαιο διάκρισιν εὐρέος ἐσμοῦ 
4.476	οὐδὲ λύσιν· τοῖον γὰρ ἐν ἀλλήλῃσιν ἔχονται.
4.477	πολλάκι μὲν καὶ νῆες ἐν ἕρμασιν ἠΰτʼ ἔκελσαν
4.478	κείναις, πολλάκι δέ σφιν ἐνιπλήσσουσιν ἐρετμοῖς
4.479	κληΐδων ἐλατῆρες, ἐνέσχετο δʼ ἱεμένη περ
4.480	κώπη, πετραίης ἅτε χοιράδος ἀντιτυχοῦσα· 
4.481	καί πού τις βουπλῆγα βαρύστομον ἰθὺς ἀείρας
4.482	ἐγγραύλεις ἐτίναξε καὶ οὐ διέκερσε σιδήρῳ
4.483	στῖφος ἅπαν, βαιὴν δʼ ἀγέλης ἀπεδάσσατο μοῖραν·
4.484	καὶ τῆς μὲν κεφαλὴν πέλεκυς τάμε, τὴν δʼ ἐκόλουσεν
4.485	οὐρῆς, τὴν δʼ ἤμησε μέσην, τὴν δʼ εἷλεν ἅπασαν. 
4.486	οἰκτρὸν ἰδεῖν μογεροῖσιν ἐοικότα σώματα νεκροῖς.
4.487	αἱ δʼ οὐδʼ ὣς ἐλάθοντο καὶ οὐκ ἀνέηκαν ἔχουσαι
4.488	δεσμὸν ἑόν· τοῖός τις ἐπί σφισι γόμφος ἄρηρε.
4.489	καί κέν τις παλάμῃσιν ἅτε ψαμάθοιο βαθείης
4.490	ἀντιάσας κείνῃσιν ἐπʼ ἰχθύσιν ἀμήσαιτο. 
4.491	τὰς δʼ ὁπότε φράσσωνται ἐπί σφισι πεπτηυίας
4.492	ἰχθυβόλοι, κοίλῃσι περιπτύσσουσι σαγήναις
4.493	ἀσπασίως, πολλὴν δὲ ποτὶ ῥηγμῖνας ἄγουσιν
4.494	ἄγρην νόσφι πόνοιο καὶ ἄγγεα πάντʼ ἀφύῃσιν
4.495	ἔν τʼ ἀκάτους ἔπλησαν, ἐπʼ ἠϊόσι δὲ βαθείαις 
4.496	θημῶνας νήησαν, ἀπειρεσίην χύσιν ἄγρης.
4.497	οἷον δʼ ἐργατίναι Δηοῦς πόνον ἐκτελέσαντες,
4.498	πνοιῇς χερσαίοις τε διακρίναντες ἐρετμοῖς
4.499	καρπόν, ἐϋτροχάλοιο μέσον κατὰ χῶρον ἀλωῆς
4.500	πολλὸν ἐνηήσαντο, περιπλήθουσα δὲ πάντῃ 
4.501	πυροδόκος στεφάνη λευκαίνεται ἔνδον ἀλωῆς·
4.502	ὣς τότʼ ἀπειρεσίῃσι περιπληθὴς ἀφύῃσιν
4.503	ὀφρὺς ἀγχιάλου λευκαίνεται αἰγιαλοῖο.
4.504	φῦλα δὲ πηλαμύδων ἐκ μὲν γένος εἰσὶ θαλάσσης
4.505	Εὐξείνου, θύννης δὲ βαρύφρονος εἰλείθυιαι· 
4.506	κεῖναι γάρ, Μαιῶτις ὅπῃ ξυμβάλλεται ἅλμῃ,
4.507	ἀγρόμεναι λιμναῖον ὑπὸ στόμα καὶ δονακῆας
4.508	ὑδρηλοὺς ὠδῖνος ἐπαλγέος ἐμνήσαντο·
4.509	καὶ τὰ μὲν ὅσσα κίχωσι μεταδρομάδην κατέδουσιν
4.510	ὠά, τὰ δʼ ἐν δονάκεσσι καὶ ἐν σχοίνοισι μένοντα 
4.511	πηλαμύδων ἀγέλας ὥρῃ τέκεν· αἱ δʼ ὅτε κῦμα
4.512	πρῶτον ἐπιψαίρωσι πόροιο τε πειρήσωνται,
4.513	ξεῖνον ἁλὸς σπεύδουσι μετὰ πλόον, οὐδʼ ἐθέλουσι
4.514	μίμνειν ἔνθʼ ἐγένοντο καὶ ἠβαιαί περ ἐοῦσαι.
4.515	Θρηΐκιος δέ τίς ἐστιν ἁλὸς πόρος, ὅντε βάθιστον 
4.516	φασὶ Ποσειδάωνος ἐνὶ κλήροισι τετύχθαι·
4.517	ἐκ τοῦ καί τε Μέλας κικλήσκεται, οὐδέ ἑ λάβροι
4.518	λίην οὐδʼ ὑπέροπλοι ἐπιθρώσκουσιν ἀῆται·
4.519	ἐν δʼ ἄρα οἱ κευθμῶνες ὑποβρύχιοι πεφύασι
4.520	κοῖλοι, πηλώεντες, ἀθέσφατοι, οἷς ἔνι πολλὰ 
4.521	τίκτεται, ἠβαιοῖσιν ὅσʼ ἰχθύσι δαῖτας ὀφέλλει.
4.522	ἔνθα καὶ ἀρτιγόνοισι πέλει πρώτιστα κέλευθα
4.523	πηλαμύδων ἑσμοῖσιν, ἐπεὶ περιώσιον ἄλλων
4.524	εἰναλίων φρίσσουσι δυσαέα χείματος ὁρμήν·
4.525	χεῖμα δὲ πηλαμύδεσσιν ἀπαμβλύνει φάος ὄσσων. 
4.526	ἔνθα δʼ ἐν εὐρωποῖσιν ἁλὸς λαγόνεσσι πεσοῦσαι
4.527	αὔτως δηθύνουσιν, ἀεξόμεναι δὲ μένουσι
4.528	λαρὸν ἔαρ· τῇ δέ σφι καὶ ἵμερος ἄνεται εὐνῆς·
4.529	πλησάμεναι δὲ τόκοιο παλίμποροι αὖτις ἵενται
4.530	πατρῷον μετὰ κῦμα, μόγον δʼ ἀπὸ γαστρὸς ἔθεντο. 
4.531	τὰς δʼ ἤτοι Μέλανος μὲν ὑπὲρ βαθὺ λαῖτμα πόροιο
4.532	Θρήϊκες ἀγρώσσουσιν ἀπηνέϊ χείματος ὥρῃ,
4.533	θήρην ἀργαλέην καὶ ἀτερπέα, δηϊοτῆτος
4.534	θεσμὸν ὑφʼ αἱματόεντα καὶ ἄγριον αἶσαν ὀλέθρου.
4.535	ἔστι τις οὐ δολιχὴ μὲν ἀτὰρ πάχος ὅττι μεγίστη, 
4.536	μῆκος ὅσον πῆχυς, στιβαρὴ δοκίς· ἐν δέ οἱ ἄκρῃ
4.537	πολλὴ μὲν μολίβοιο χύσις, πολλαὶ δὲ σιδήρου
4.538	αἰχμαὶ τριγλώχινες ἐπασσύτεραι πεφύασι·
4.539	πεῖσμα δέ μιν περίμηκες ἐΰπλοκον ἀμφιβέβηκε.
4.540	δουρὶ δʼ ἀναπλώσαντες, ἁλὸς πόρος ἔνθα βάθιστος, 
4.541	ἐς βυθὸν ἠερόεντα περικρατὲς ἧκαν ἔνερθε
4.542	πυθμένος εἰλατίνου κρατερὸν σθένος· αἶψα δὲ ῥιπῇ
4.543	σπερχόμενον, μολίβῳ τε καταρρεπὲς ἠδὲ σιδήρῳ,
4.544	σεύεται ἐς νεάτας ῥίζας ἁλός, ἔνθʼ ἀμενηναῖς
4.545	πηλαμύσι προὔτυψεν ἐν ἰλύσι πεπτηυίαις· 
4.546	σὺν δʼ ἕλε σύν τʼ ἐτόρησεν ὅσον κίχε δειλὸν ὅμιλον.
4.547	οἱ δὲ θοῶς ἀνέρυσσαν ἐληλαμένας περὶ χαλκῷ
4.548	παλλομένας ἐλεεινὰ σιδηρείῃς ὀδύνῃσι.
4.549	τὰς δέ τις εἰσορόων καί κεν θρασυκάρδιος ἀνὴρ
4.550	οἰκτείραι θήρης τε δυσαγρέος ἠδὲ μόροιο· 
4.551	τῆς μὲν γὰρ λαγόνεσσιν ἐλήλατο δουρὸς ἀκωκή,
4.552	τῆς δὲ κάρη ξυνέπειρε θοὸν βέλος, ἡ δʼ ὑπὲρ οὐρὴν
4.553	οὔτασται, νηδὺν δʼ ἑτέρης, ἄλλης δʼ ἕλε νῶτα
4.554	δριμὺς ἄρης, ἄλλη δὲ μέσον κενεῶνα πέπαρται.
4.555	ὡς δʼ ὁπότε, κρινθέντος ἐνυαλίοιο κυδοιμοῦ, 
4.556	δουριφάτους κονίης τε καὶ αἵματος ἐξανελόντες
4.557	εὐνὴν ἐς πυρόεσσαν ἑοὶ στέλλωσιν ἑταῖροι
4.558	μυρόμενοι· τὰ δὲ πολλὰ καὶ αἰόλα σώμασι νεκρῶν
4.559	ἕλκεα παντοῖαί τε βολαὶ πλήθουσιν Ἄρηος·
4.560	ὣς καὶ πηλαμύδεσσιν ἐπιπρέπει ἕλκεα πάντῃ, 
4.561	εἴδωλον πολέμοιο, φίλον γε μὲν ἀσπαλιεῦσιν.
4.562	ἄλλοι δʼ αὖ κούφοισι λίνοις ἕλον ἔθνε’ ἀφαυρῶν
4.563	πηλαμύδων· αἰεὶ γὰρ ἀνὰ κνέφας, ὅττι κεν ἅλμῃ
4.564	ἐμπίπτῃ, τρομέουσι, φόβον δʼ ὀρφναῖον ἔχουσιν·
4.565	ὄρφνῃ δʼ ἀγρώσσονται, ἀτυζόμεναι κατὰ βένθος. 
4.566	δίκτυα γὰρ μάλα κοῦφα λίνων στήσαντες ἐλαφρῶν
4.567	κυκλόσε δινεύουσι, βίῃ θείνοντες ἐρετμοῖς
4.568	νῶτον ἁλός, κοντοῖς τε καταΐγδην κτυπέουσιν·
4.569	αἱ δʼ ὑπό μαρμαρυγῆς ταχυήρεος ἠδʼ ὁμάδοιο
4.570	φυζαλέαι θρώσκουσι, λίνου δʼ εἰς κόλπον ἵενται 
4.571	ἀτρέμας ἑστηῶτος, ὀιόμεναι σκέπας εἶναι,
4.572	νήπιαι, αἳ δούποιο φόβῳ μόρον εἰσεπέρησαν.
4.573	ἔνθʼ οἱ μὲν σχοίνοισιν ἐπισπέρχουσʼ ἑκάτερθε,
4.574	δίκτυον ἐξερύοντες ἐπʼ ᾐόνας· αἱ δʼ ὁρόωσαι
4.575	σχοίνους κινυμένας, ἀνεμώλια δείματʼ ἔχουσαι, 
4.576	εἰλόμεναι πτήσσουσι καὶ ἀθρόαι ἐσπείρηνται.
4.577	πολλά κεν ἀγραίοισι τότʼ ἀρήσαιτο θεοῖσι
4.578	δικτυβόλος, μήτʼ οὖν τι θορεῖν ἔκτοσθε λίνοιο,
4.579	μήτε τι κινύμενον δεῖξαι πόρον· ἢν γὰρ ἴδωνται
4.580	πηλαμύδες, τάχα πᾶσαι ὑπὲρ κούφοιο λίνοιο 
4.581	ἐς βυθὸν ἀΐσσουσι καὶ ἄπρηκτον λίπον ἄγρην.
4.582	εἰ δʼ οὔ σφι μακάρων τις ἁλιπλάγκτων νεμεσήσει,
4.583	πολλάκι καὶ τραφερῆς ὑπὲρ ᾐόνος ἑλκυσθεῖσαι
4.584	ἔξαλοι οὐκ ἐθέλουσι λιπεῖν λίνον, ἀλλʼ ἐνέχονται,
4.585	αὐτὴν μήρινθον πολυδινέα πεφρικυῖαι. 
4.586	ὧδε καὶ ἐν ξυλόχοισιν ὀρέστεροι ἀγρευτῆρες
4.587	εἷλον ἀναλκείην ἐλάφων εὐαγρέϊ τέχνῃ,
4.588	μηρίνθῳ στέψαντες ἅπαν δρίος· ἀμφὶ δὲ κούφων
4.589	ὀρνίθων δήσαντο θοὰ πτερά· ταὶ δʼ ἐσορῶσαι
4.590	ἠλέματα πτώσσουσι κενὸν φόβον, οὐδὲ πελάσσαι 
4.591	μαψιδίως πτερύγεσσιν ἀτυζόμεναι μεμάασιν,
4.592	εἰσόκε θηρητῆρες ἐπαΐξαντες ἕλωσι.
4.593	καὶ μέν τις δύπτης ἁλίων εὐμήχανος ἔργων
4.594	νόσφι δόλου παλάμῃσιν ἐπαΐξας ἕλεν αὐταῖς
4.595	ἰχθῦς, ἠΰτε χέρσον ἀμειβόμενος πόρον ἅλμης, 
4.596	σαργόν τε τρέσσαντα φόβῳ δειλήν τε σκίαιναν.
4.597	σαργοὶ μὲν δείσαντες ἀολλέες ἐς μυχὸν ἅλμης
4.598	εἰλόμενοι πτήσσουσιν, ἐπʼ ἀλλήλαις δὲ κέχυνται,
4.599	δόχμιαι ἀμφιπεσόντες, ἀναφρίσσουσι δʼ ἀκάνθαις
4.600	νῶτα μετακλίνοντες, ἅτε σκολόπεσσιν ἁπάντῃ 
4.601	φραξάμενοι πυκινῇσι περίδρομον ἕρκος ἀλωῆς
4.602	ἀγρονόμοι, σίντῃσι μέγαν πόνον· οὐδέ κεν ἄν τις
4.603	ἐσβαίη· σκῶλοι γὰρ ἐρητύουσι κέλευθα·
4.604	ὣς κείνοις οὐκ ἄν τις ἐνιχρίμψειεν ἑτοίμως,
4.605	οὐδʼ ἐπὶ χεῖρα βάλοι· περὶ γὰρ φρίσσουσι κελαιναὶ 
4.606	πρόκροσσαι πυκινῇσιν ὑπὸ σταλίκεσσιν ἄκανθαι.
4.607	ἀλλά τις ἰδμοσύνῃσιν ἀνὴρ ὑπὸ κεύθεα πόντου
4.608	ἐσσυμένως δύοιτο, περιφράζοιτο δὲ πάντῃ
4.609	σαργούς, ἔνθα κάρη τε καὶ οὐραίη κλίσις αὐτῶν·
4.610	χεῖρα δʼ ὑπὲρ κεφαλῇσι βαλὼν καθύπερθεν ἀκάνθας 
4.611	ἦκα καταρρέξειεν ἐπικλίνοι τε πιέζων·
4.612	οἱ δʼ αὔτως μίμνουσιν ἀρηρότες ἀλλήλοισιν
4.613	ἀστεμφεῖς, προβολῇσι πεποιθότες ὀξείῃσιν·
4.614	ἔνθα δύω παλάμῃσιν ἀνὴρ ἑκάτερθεν ἀείρας
4.615	αὖτις ἀναπλώει τελέσας πανεπίκλοπον ἔργον. 
4.616	πετραίην δὲ σκίαιναν ἐπὴν φόβος ἦτορ ἵκηται,
4.617	ἐσσυμένως σπιλάδεσσιν ἐπέσσυτο καί τινα κοίλην
4.618	χειὴν εἰσεπέρησε περίδρομον ἠὲ χαράδρην,
4.619	ἢ ποίαις ἁλίῃσιν ὑπέδραμεν, ἠὲ καὶ ὑγροῖς
4.620	φύκεσιν· οὐ γάρ οἵ τι μέλει σκέπας, οἷον ἅπασαν 
4.621	δεξάμενον ῥύσαιτο, κάρη δʼ ἄρα δίζεται οἶον
4.622	φράξασθαι, κεφαλὴν δὲ κατακρύψασα καὶ ὄσσε
4.623	ἔλπεται οὐχ ὁρόωσα λαθεῖν ὁρόωντος ἐφορμήν.
4.624	ὡς δέ τις ὠμηστῆρος ἐπεσσυμένοιο λέοντος
4.625	βουβαλὶς ἐν λόχμῃσι κάτω τρέψασα κάρηνον 
4.626	μαψιδίην φυλακὴν προτιβάλλεται, οὔθʼ ὁράασθαι
4.627	ἔλπεται, εἰσόκε δή μιν ἐπαΐξας ὀλοὸς θὴρ
4.628	δαρδάψῃ· τῆς δʼ ἦτορ ὁμοίϊον, οὐδὲ κάρηνον
4.629	ἀγκλινει, δοκέει δὲ καὶ ὀλλυμένη περ ἀλύξαι.
4.630	τοῖα δὲ καὶ Λιβύης πτερόεν βοτὸν ἀγκυλόδειρον 
4.631	νήπια τεχνάζει· μελέη δέ οἱ ἔπλετο τέχνη·
4.632	ὣς ἀταλὴ μελέῃσιν ὑπʼ ἐλπωρῇσι σκίαινα
4.633	κέκρυπται· τάχα γάρ μιν ἐρυσσάμενος παλάμῃσιν
4.634	ἀγρευτὴρ ἀνέδυ τε καὶ ἀφραίνουσαν ἔφηνε.
4.635	τόσσα μὲν ἰχθυβόλων ἐδάην ἁλιεργέα τέχνης 
4.636	δήνεα, καὶ τόσσοισιν ἐπʼ ἰχθύσι πικρὸν ὄλεθρον·
4.637	τοὺς δʼ ἄλλους ξύμπαντας ὁμοίϊος αἶσα κιχάνει
4.638	κύρτων τʼ ἀγκίστρων τε βαθυπλεκέος τε λίνοιο
4.639	ῥιπῆς τε τριόδοντος, ὅσʼ ἀνδράσιν ἔντεα τέχνης.
4.640	τοὺς μὲν ὑπηματίους, τοὺς δʼ ἕσπερος εἷλε δαμέντας, 
4.641	εὖτʼ ἂν ὑπὸ πρῶτον νυκτὸς κνέφας ἀσπαλιῆες
4.642	πυρσὸν ἀναψάμενοι, γλαφυρὸν σκάφος ἰθύνοντες,
4.643	ἰχθύσιν ἀτρεμέουσιν ἀείδελον αἶσαν ἄγωσιν.
4.644	ἔνθʼ οἱ μέν πεύκης λιπαρῇ φλογὶ καγχαλόωντες
4.645	ἀμφʼ ἀκάτῳ θύνουσι, κακὸν δʼ ἴδον ἑσπέριον πῦρ, 
4.646	ῥιπῆς τριγλώχινος ἀμειλίκτοιο τυχόντες.
4.647	ἔστι δέ τις θήρης ἕτερος νόμος ἰχθυβόλοισι
4.648	φαρμάκταις, οἳ λυγρὸν ἐπʼ ἰχθύσι μητίσαντο
4.649	φάρμακον, ὠκύμορον δὲ τέλος νεπόδεσσιν ἔθηκαν.
4.650	οἱ δʼ ἤτοι πρῶτον μὲν ἐπασσυτέραις βολίδεσσι 
4.651	κοντῶν τε ῥιπῇσι καὶ αἰκίῃσιν ἐρετμῶν
4.652	εἱλεῦσιν νεπόδων δειλὰς στίχας εἰς ἕνα χῶρον
4.653	κοιλοφυῆ, κευθμῶσιν ὑπαγνύμενον θαμέεσσιν·
4.654	ἔνθʼ οἱ μὲν δύνουσιν ὑπὸ γλαφυρῇς σπιλάδεσσι,
4.655	τοὶ δὲ περιστήσαντο λίνων εὐερκέα πάντῃ 
4.656	δίκτυα κυκλώσαντες, ἅτʼ ἀνδράσι δυσμενέεσσι
4.657	διπλὰ περιπροβαλόντες ἀνάρσια τείχεα πέτρης.
4.658	καὶ τότʼ ἀνὴρ ἄργιλον ὁμοῦ πίειραν ἀείρας
4.659	ῥίζαν θʼ, ἣν κυκλάμινον ἐφήμισαν ἰητῆρες,
4.660	μίξας ἐν παλάμῃσι δύω φυρήσατο μάζας· 
4.661	πόντῳ δʼ ἐγκατέπαλτο λίνων ὕπερ, ἀμφὶ δʼ ἄρʼ αὐταῖς
4.662	κοιλάσι καὶ θαλάμῃσι δυσαέα φάρμακʼ ἄλειψε
4.663	χρίσματος ἐχθοδοποῖο καὶ ἐξεμίηνε θάλασσαν.
4.664	καὶ τὸν μὲν παλίνορσον ὀλέθρια φαρμάξαντα
4.665	δέξατο ναῦς· τοὺς δʼ αἶψα κακὴ καὶ ἀνάρσιος ὀδμὴ 
4.666	πρῶτα μὲν ἐν θαλάμῃσιν ἱκάνεται· ἀχλύϊ δʼ ὄσσε
4.667	καὶ κεφαλὴ καὶ γυῖα βαρύνεται, οὐδὲ δύνανται
4.668	μίμνειν ἐν κευθμῶσιν, ἀτυζόμενοι δὲ χέονται
4.669	ἐκτὸς ἀπὸ σπιλάδων· ἡ δέ σφισι πουλὺ θάλασσα
4.670	πικροτέρη· τοῖον γὰρ ἐν οἴδμασι πῆμα πέφυρται. 
4.671	οἱ δʼ ὥστʼ οἰνοβαρεῖς, ὀλοῇ μεθύοντες ἀϋτμῇ,
4.672	πάντῃ δινεύουσι καὶ οὔποθι χῶρον ἔχουσι
4.673	λειπόμενον κακότητος, ἐπαΐγδην δὲ λίνοισι
4.674	σπερχόμενοι πίπτουσι, διεκθορέειν μεμαῶτες·
4.675	ἀλλʼ οὔ τις χαλεπῆς ἄτης λύσις οὐδʼ ἀλεωρή· 
4.676	πολλῇ δὲ ῥιπῇ τε καὶ ἅλματι κυμαίνονται
4.677	τειρόμενοι· τὸ δὲ πολλὸν ἐπιτρέχει Ἀμφιτρίτῃ
4.678	ὀλλυμένων φύσημα, τό τʼ ἰχθύσιν ἔπλετο δειλοῖς
4.679	οἰμωγή· τοὶ δʼ ἐκτὸς ἐπʼ ἄλγεσιν ἀσπαλιῆες
4.680	τερπόμενοι μίμνουσιν ἀκηδέες, εἰσόκε σιγὴ 
4.681	πόντον ἕλῃ, φλοίσβου τε καὶ ἀργαλέοιο κυδοιμοῦ
4.682	παύσωνται, στονόεσσαν ἀποπνεύσαντες ἀϋτμήν.
4.683	καὶ τότʼ ἀπειρέσιον νεκύων ἐρύουσιν ὅμιλον
4.684	ξυνῷ τεθνηῶτας ὁμοῦ λωβήτορι πότμῳ.
4.685	ὡς δʼ ὅτε δυσμενέεσσιν ἐπιστήσωνται Ἄρηα, 
4.686	φροῦδον ἐελδόμενοι ῥαῖσαι πόλιν, οὐδʼ ἀνιεῖσι
4.687	πήματα βουλεύοντες ἐπί σφισιν, ἀλλὰ καὶ ὕδωρ
4.688	κρηνάων φάρμαξαν ὀλέθριον· οἱ δʼ ἐπὶ πύργοις
4.689	λιμῷ τʼ ἀργαλέῳ καὶ ὀϊζύϊ μοχθίζοντες
