1.1	ἔθνεά τοι πόντοιο πολυσπερέας τε φάλαγγας
1.2	παντοίων νεπόδων, πλωτὸν γένος Ἀμφιτρίτης,
1.3	ἐξερέω, γαίης ὕπατον κράτος, Ἀντωνῖνε·
1.4	ὅσσα τε κυματόεσσαν ἔχει χύσιν, ᾗχί θʼ ἕκαστα
1.5	ἐννέμεται, διερούς τε γάμους διεράς τε γενέθλας 
1.6	καὶ βίον ἰχθυόεντα καὶ ἔχθεα καὶ φιλότητας
1.7	καὶ βουλάς, ἁλίης τε πολύτροπα δήνεα τέχνης
1.8	κερδαλέης, ὅσα φῶτες ἐπʼ ἰχθύσι μητίσαντο
1.9	ἀφράστοις· ἀΐδηλον ἐπιπλώουσι θάλασσαν
1.10	τολμηρῇ κραδίῃ, κατὰ δʼ ἔδρακον οὐκ ἐπίοπτα 
1.11	βένθεα καὶ τέχνῃσιν ἁλὸς διὰ μέτρα δάσαντο
1.12	δαιμόνιοι. χλούνην μὲν ὀρίτροφον ἠδὲ καὶ ἄρκτον
1.13	θηρητὴρ ὁράᾳ τε καὶ ἀντιόωντα δοκεύει
1.14	ἀμφαδίην, ἕκαθέν τε βαλεῖν σχεδόθεν τε δαμάσσαι·
1.15	ἄμφω δʼ ἀσφαλέως γαίης ἔπι θήρ τε καὶ ἀνὴρ 
1.16	μάρνανται, σκύλακες δὲ συνέμποροι ἡγεμονῆες
1.17	κνώδαλα σημαίνουσι καὶ ἰθύνουσιν ἄνακτας
1.18	εὐνὴν εἰς αὐτὴν καὶ ἀρηγόνες ἐγγὺς ἕπονται.
1.19	οὐδʼ ἄρα τοῖς οὐ χεῖμα τόσον δέος, οὐ μὲν ὀπώρη
1.20	φλέγμα φέρει· πολλαὶ γὰρ ἐπακτήρων ἀλεωραὶ 
1.21	λόχμαι τε σκιεραὶ καὶ δειράδες ἄντρα τε πέτρης
1.22	αὐτορόφου· πολλοὶ δὲ τιταινόμενοι κατʼ ὄρεσφιν
1.23	ἀργύρεοι ποταμοί, δίψης ἄκος ἠδὲ λοετρῶν
1.24	ἀέναοι ταμίαι· παρὰ δὲ χλοάουσι ῥέεθροις
1.25	ποῖαί τε χθαμαλαί, μαλακὴ κλίσις ὕπνον ἑλέσθαι 
1.26	εὔδιον ἐκ καμάτοιο, καὶ ὥρια δόρπα πάσασθαι
1.27	ὕλης ἀγρονόμοιο, τά τʼ οὔρεσι πολλὰ φύονται.
1.28	τερπωλὴ δʼ ἕπεται θήρῃ πλέον ἠέ περ ἱδρώς.
1.29	ὅσσοι δʼ οἰωνοῖσιν ἐφοπλίζονται ὄλεθρον,
1.30	ῥηϊδίη καὶ τοῖσι πέλει καὶ ὑπόψιος ἄγρη· 
1.31	τοὺς μὲν γὰρ κνώσσοντας ἐληΐσσαντο καλιῆς
1.32	κρύβδην· τοὺς δὲ δόναξιν ὑπέσπασαν ἰξοφόροισιν·
1.33	οἱ δὲ τανυπλέκτοισιν ἐν ἕρκεσιν ἤριπον αὐτοὶ
1.34	εὐνῆς χρηΐζοντες, ἀτερπέα δʼ αὖλιν ἔκυρσαν.
1.35	τλησιπόνοις δʼ ἁλιεῦσιν ἀτέκμαρτοι μὲν ἄεθλοι, 
1.36	ἐλπὶς δʼ οὐ σταθερὴ σαίνει φρένας ἠΰτʼ ὄνειρος·
1.37	οὐ γὰρ ἀκινήτου γαίης ὕπερ ἀθλεύουσιν,
1.38	ἀλλʼ αἰεὶ κρυερῷ τε καὶ ἄσχετα μαργαίνοντι
1.39	ὕδατι συμφορέονται, ὃ καὶ γαίηθεν ἰδέσθαι
1.40	δεῖμα φέρει καὶ μοῦνον ἐν ὄμμασι πειρήσασθαι· 
1.41	δούρασι δʼ ἐν βαιοῖσιν ἀελλάων θεράποντες
1.42	πλαζόμενοι, καὶ θυμὸν ἐν οἴδμασιν αἰὲν ἔχοντες,
1.43	αἰεὶ μὲν νεφέλην ἰοειδέα παπταίνουσιν,
1.44	αἰεὶ δὲ τρομέουσι μελαινόμενον πόρον ἅλμης·
1.45	οὐδέ τι φοιταλέων ἀνέμων σκέπας, οὐδέ τινʼ ὄμβρων 
1.46	ἀλκήν, οὐ πυρὸς ἄλκαρ ὀπωρινοῖο φέρονται.
1.47	πρὸς δʼ ἔτι καὶ βλοσυρῆς δυσδερκέα δείματα λίμνης
1.48	κήτεα πεφρίκασι, τά τε σφίσιν ἀντιόωσιν,
1.49	εὖτʼ ἂν ὑποβρυχίης ἄδυτον περόωσι θαλάσσης·
1.50	οὐ μέν τις σκυλάκων ἁλίην ὁδὸν ἡγεμονεύει 
1.51	ἰχθυβόλοις· ἴχνη γὰρ ἀείδελα νηχομένοισιν·
1.52	οὐδʼ οἵ γʼ εἰσορόωσιν ὅπῃ σχεδὸν ἵξεται ἄγρης
1.53	ἀντιάσας, οὐ γάρ τι μίην ὁδὸν ἔρχεται, ἰχθύς·
1.54	θριξὶ δʼ ἐν ἠπεδανοῖσι παλιγνάμπτοιό τε χαλκοῦ
1.55	χείλεσι καὶ δονάκεσσι λίνοισί τε κάρτος ἔχουσιν. 
1.56	οὐ μὴν τερπωλῆς ἀπολείπεαι, αἴ κʼ ἐθέλῃσθα
1.57	τέρπεσθαι, γλυκερὴ δὲ πέλει βασιλήϊος ἄγρη.
1.58	νῆα μὲν εὐγόμφωτον, ἐΰζυγον, ἔξοχα κούφην,
1.59	αἰζηοὶ κώπῃσιν ἐπειγομένῃς ἐλόωσι,
1.60	νῶτον ἁλὸς θείνοντες· ὁ δʼ ἐν πρύμνῃσιν ἄριστος 
1.61	ἰθυντὴρ ἀλίαστον ἄγει καὶ ἀμεμφέα νῆα
1.62	χῶρον ἐς εὐρύαλόν τε καὶ εὔδια πορφύροντα·
1.63	ἔνθα δὲ δαιτυμόνων νεπόδων ἀπερείσια φῦλα
1.64	φέρβεται, οὓς θεράποντες ἀεὶ κομέουσιν, ἐδωδῇ
1.65	πολλῇ πιαίνοντες, ἑτοιμότατον χορὸν ἄγρης 
1.66	σοί τε, μάκαρ, καὶ παιδὶ μεγαυχέϊ, πώεα θήρης.
1.67	αὐτίκα γὰρ χειρὸς μὲν ἐΰπλοκον εἰς ἅλα πέμπεις
1.68	ὁρμιήν, ὁ δὲ ῥίμφα γένυν κατεδέξατο χαλκοῦ
1.69	ἰχθὺς ἀντιάσας, τάχα δʼ ἕλκεται ἐκ βασιλῆος
1.70	οὐκ ἀέκων, σέο δʼ ἦτορ ἰαίνεται, ὄρχαμε γαίης· 
1.71	πολλὴ γὰρ βλεφάροισι καὶ ἐν φρεσὶ τέρψις ἰδέσθαι
1.72	παλλόμενον καὶ ἑλισσόμενον πεπεδημένον ἰχθύν.
1.73	ἀλλά μοι ἱλήκοις μὲν ἁλὸς πόρῳ ἐμβασιλεύων
1.74	εὐρυμέδων Κρονίδης γαιηόχος, ἠδὲ Θάλασσα
1.75	αὐτή, καὶ ναετῆρες ἐριγδούποιο θαλάσσης 
1.76	δαίμονες, ὑμετέρας τʼ ἀγέλας καὶ ἁλίτροφα φῦλα
1.77	εἰπέμεν αἰνήσαιτε· σὺ δʼ ἰθύνειας ἕκαστα,
1.78	πότνα Θεά, καὶ πατρὶ καὶ υἱέϊ παμβασιλῆος
1.79	θυμήρη τάδε δῶρα τεῆς πόρσυνον ἀοιδῆς.
1.80	μυρία μὲν δὴ φῦλα καὶ ἄκριτα βένθεσι πόντου 
1.81	ἐμφέρεται πλώοντα· τὰ δʼ οὔ κέ τις ἐξονομήναι
1.82	ἀτρεκέως· οὐ γάρ τις ἐφίκετο τέρμα θαλάσσης·
1.83	ἀλλὰ τριηκοσίων ὀργυιῶν ἄχρι μάλιστα
1.84	ἀνέρες ἴσασίν τε καὶ ἔδρακον Ἀμφιτρίτην.
1.85	πολλὰ δʼ (ἀπειρεσίη γὰρ ἀμετροβαθής τε θάλασσα)
1.86	κέκρυπται, τά κεν οὔ τις ἀείδελα μυθήσαιτο
1.87	θνητὸς ἐών· ὀλίγος δὲ νόος μερόπεσσι καὶ ἀλκή.
1.88	οὐ μὲν γὰρ γαίης πολυμήτορος ἔλπομαι ἅλμην
1.89	παυροτέρας ἀγέλας οὔτʼ ἔθνεα μείονα φέρβειν.
1.90	ἀλλʼ εἴτʼ ἀμφήριστος ἐν ἀμφοτέρῃσι γενέθλη 
1.91	εἴθʼ ἑτέρη προβέβηκε, θεοὶ σάφα τεκμαίρονται,
1.92	ἡμεῖς δʼ ἀνδρομέοισι νοήμασι μέτρα φέροιμεν.
1.93	ἰχθύσι μὲν γενεή τε καὶ ἤθεα καὶ πόρος ἅλμης
1.94	κέκριται, οὐδέ τι πᾶσι νομαὶ νεπόδεσσιν ὁμοῖαι·
1.95	οἱ μὲν γὰρ χθαμαλοῖσι παρʼ αἰγιαλοῖσι νέμονται, 
1.96	ψάμμον ἐρεπτόμενοι καὶ ὅσʼ ἐν ψαμάθοισι φύονται,
1.97	ἵπποι κόκκυγές τε θοοὶ ξανθοί τʼ ἐρυθῖνοι
1.98	καὶ κίθαροι καὶ τρίγλα καὶ ἀδρανέες μελάνουροι
1.99	τραχούρων τʼ ἀγέλαι βούγλωσσά τε καὶ πλατύουροι
1.100	ταινίαι ἀβληχραὶ καὶ μορμύρος, αἰόλος ἰχθύς, 
1.101	σκόμβροι κυπρῖνοί τε καὶ οἳ φίλοι αἰγιαλοῖσιν.
1.102	ἄλλοι δʼ αὖ πηλοῖσι καὶ ἐν τενάγεσσι θαλάσσης
1.103	φέρβονται, βατίδες τε βοῶν θʼ ὑπέροπλα γένεθλα
1.104	τρυγών τʼ ἀργαλέη καὶ ἐτήτυμον οὔνομα νάρκη,
1.105	ψῆτται καλλαρίαι καὶ τριγλίδες ἔργα τʼ ὀνίσκων 
1.106	σαῦροί τε σκέπανοί τε καὶ ὅσσʼ ἐνιτέτροφε πηλοῖς.
1.107	θῖνα δʼ ἀνὰ πρασόεσσαν ὑπὸ χλοεραῖς βοτάνῃσι
1.108	βόσκονται μαινῖδες ἰδὲ τράγοι ἠδʼ ἀθερῖναι
1.109	καὶ σμαρίδες καὶ βλέννος ἰδὲ σπάροι ἀμφότεροί τε
1.110	βῶκες ὅσοις τʼ ἄλλοισι φίλον πράσον ἀμφινέμεσθαι. 
1.111	Κεστρέες αὖ κέφαλοί τε, δικαιότατον γένος ἅλμης,
1.112	λάβρακές τʼ ἀμίαι τε θρασύφρονες ἠδὲ χρέμητες
1.113	πηλαμύδες γόγγροι τε καὶ ὃν καλέουσιν ὄλισθον
1.114	γείτονα ναιετάουσιν ἀεὶ ποταμοῖσι θάλασσαν
1.115	ἢ λίμναις, ὅθι λαρὸν ὕδωρ μεταπαύεται ἅλμης, 
1.116	πολλή τε πρόχυσις συμβάλλεται ἰλυόεσσα,
1.117	ἑλκομένη δίνῃσιν ἀπὸ χθονός· ἔνθα νέμονται
1.118	φορβὴν ἱμερτὴν γλυκερῇ θʼ ἁλὶ πιαίνονται.
1.119	λάβραξ δʼ οὐδʼ αὐτῶν ποταμῶν ἀπολείπεται ἔξω,
1.120	ἐκ δʼ ἁλὸς ἐς προχοὰς ἀνανήχεται· ἐγχέλυες δὲ 
1.121	ἐκ ποταμῶν πλαταμῶσιν ἐνιχρίμπτουσι θαλάσσης.
1.122	πέτραι δʼ ἀμφίαλοι πολυειδέες· αἱ μὲν ἔασι
1.123	φύκεσι μυδαλέαι, περὶ δὲ μνία πολλὰ πέφυκε·
1.124	τὰς ἦτοι πέρκαι καὶ ἰουλίδες ἀμφί τε χάννοι
1.125	φέρβονται σάλπαι τε μετὰ σφίσιν αἰολόνωτοι 
1.126	καὶ κίχλαι ῥαδιναὶ καὶ φυκίδες οὕς θʼ ἅς θ᾽ MSS. And schol. ἁλιῆες
1.127	ἀνδρὸς ἐπωνυμίην θηλύφρονος ηὐδάξαντο.
1.128	ἄλλαι δὲ χθαμαλαὶ ψαμαθώδεος ἄγχι θαλάσσης
1.129	λεπράδες, ἅς κίρρις τε σύαινά τε καὶ βασιλίσκοι
1.130	ἐν δὲ μύλοι τρίγλης τε ῥοδόχροα φῦλα νέμονται. 
1.131	ἄλλαι δʼ αὖ ποιῇσιν ἐπίχλοοι ὑγρὰ μέτωπα
1.132	πέτραι σαργὸν ἔχουσιν ἐφέστιον ἠδὲ σκίαιναν
1.133	χαλκέα καὶ κορακῖνον ἐπώνυμον αἴθοπι χροιῇ,
1.134	καὶ σκάρον, ὃς δὴ μοῦνος ἐν ἰχθύσι πᾶσιν ἀναύδοις
1.135	φθέγγεται ἰκμαλέην λαλαγὴν καὶ μοῦνος ἐδητὺν 
1.136	ἄψορρον προΐησιν ἀνὰ στόμα, δεύτερον αὖτις
1.137	δαινύμενος, μήλοισιν ἀναπτύσσων ἴσα φορβήν.
1.138	Ὅσσαι δʼ αὖ χήμῃσι περίπλεοι ἢ λεπάδεσσιν,
1.139	ἐν δέ σφιν θαλάμαι τε καὶ αὔλια δύμεναι ἰχθῦς,
1.140	τῇσι δὲ καὶ φάγροι καὶ ἀναιδέες ἀγριόφαγροι 
1.141	κέρκουροί τε μένουσι καὶ ὀψοφάγοι καὶ ἀνιγραὶ
1.142	μύραιναι σαῦροί τε καὶ ὀψιμόρων γένος ὀρφῶν,
1.143	οἳ πάντων περίαλλα κατὰ χθόνα δηθύνουσι
1.144	ζωοὶ καὶ τμηθέντες ἔτι σπαίρουσι σιδήρῳ.
1.145	ἄλλοι δʼ ἐν βένθεσσιν ὑπόβρυχα μιμνάζουσι 
1.146	φωλειοῖς, πρόβατόν τε καὶ ἥπατοι ἠδὲ πρέποντες,
1.147	ἴφθιμοι μεγάλοι τε φυήν, νωθροὶ δὲ κέλευθα
1.148	εἱλεῦνται· τὸ καὶ οὔποθʼ ἑὴν λείπουσι χαράδρην,
1.149	ἀλλʼ αὐτοῦ λοχόωσι παραὶ μυχόν, ὅς κε πελάσσῃ,
1.150	χειροτέροις ἀΐδηλον ἐπʼ ἰχθύσι πότμον ἄγοντες· 
1.151	ἐν καὶ ὄνος κείνοις ἐναρίθμιος, ὅς περὶ πάντων
1.152	πτήσσει ὀπωρινοῖο κυνὸς δριμεῖαν ὁμοκλήν,
1.153	μίμνει δʼ ἐγκαταδὺς σκότιον μυχόν, οὐδὲ πάροιθεν
1.154	ἔρχεται, ὅσσον ἄησιν ἐπὶ χρόνον ἄγριος ἀστήρ.
1.155	ἔστι δέ τις πέτρῃσιν ἁλικλύστοισι μεμηλώς, 
1.156	ξανθὸς ἰδεῖν, κεστρεῦσι φυὴν ἐναλίγκιος ἰχθύς,
1.157	τὸν μερόπων ἕτεροι μὲν ἐπικλείουσιν ἄδωνιν,
1.158	ἄλλοι δʼ ἐξώκοιτον ἐφήμισαν, οὕνεκα κοίτας
1.159	ἐκτὸς ἁλὸς τίθεται, μοῦνος δʼ ἐπὶ χέρσον ἀμείβει,
1.160	ὅσσοι γε βράγχη, στόματος πτύχας, ἀμφὶς ἔχουσιν. 
1.161	εὖτε γὰρ εὐνήσῃ χαροπῆς ἁλὸς ἔργα γαλήνη,
1.162	αὐτὰρ ὅ γʼ ἐσσυμένοισι συνορμηθεὶς ῥοθίοισι,
1.163	πέτραις ἀμφιταθεὶς ἀμπαύεται εὔδιον ὕπνον.
1.164	ὀρνίθων δʼ ἁλίων τρομέει γένος, οἵ οἱ ἔασι
1.165	δυσμενέες· τῶν ἤν τινʼ ἐσαθρήσῃ πελάσαντα, 
1.166	πάλλεται ὀρχηστῆρι πανείκελος, ὄφρα ἑ πόντου
1.167	προπροκυλινδόμενον σπιλάδων ἄπο χεῦμα σαώσῃ.
1.168	οἱ δὲ καὶ ἐν πέτρῃσι καὶ ἐν ψαμάθοισι νέμονται,
1.169	ἀγλαΐῃ χρύσοφρυς ἐπώνυμος ἠδὲ δράκοντες
1.170	σῖμοί τε γλαῦκοί τε καὶ ἀλκησταὶ συνόδοντες, 
1.171	σκορπίος ἀϊκτήρ, δίδυμον γένος, ἀμφότεραί τε
1.172	σφύραιναι δολιχαὶ ῥαφίδες θʼ ἅμα τῇσιν ἀραιαί·
1.173	ἐν δὲ χάραξ κοῦφοί τε κυβιστητῆρες ἔασι
1.174	κωβιοί· ἐν δὲ μυῶν χαλεπὸν γένος, οἳ περὶ πάντων
1.175	θαρσαλέοι νεπόδων καί τʼ ἀνδράσιν ἀντιφέρονται, 
1.176	οὔτι τόσοι περ ἐόντες· ἐπὶ στερεῇ δὲ μάλιστα
1.177	ῥινῷ καὶ πυκινοῖσι πεποιθότες ἔνδον ὀδοῦσι,
1.178	ἰχθύσι καὶ μερόπεσσιν ἀρειοτέροισι μάχονται.
1.179	οἱ δʼ ἐν ἁμετρήτοισιν ἄλην πελάγεσσιν ἔχουσι,
1.180	τηλοῦ ἀπὸ τραφερῆς οὐδʼ ᾐόσιν εἰσὶν ἑταῖροι, 
1.181	θύννοι μὲν θύνοντες, ἐν ἰχθύσιν ἔξοχοι ὁρμήν,
1.182	κραιπνότατοι, ξιφίαι τε φερώνυμοι ἠδʼ ὑπέροπλος
1.183	ὀρκύνων γενεὴ καὶ πρημάδες ἠδὲ κυβεῖαι,
1.184	καὶ κολίαι σκυτάλαι τε καὶ ἱππούροιο γένεθλα.
1.185	ἐν τοῖς καὶ κάλλιχθυς ἐπώνυμος, ἱερὸς ἰχθύς· 
1.186	ἐν κείνοις νέμεται καὶ πομπίλος, ὃν πέρι ναῦται
1.187	ἅζονται, πομπῇ δʼ ἐπεφήμισαν οὔνομα νηῶν·
1.188	ἔξοχα γὰρ νήεσσι γεγηθότες ὑγρὰ θεούσαις
1.189	ἕσπονται πομπῆες ὁμόστολοι, ἄλλοθεν ἄλλος
1.190	ἀμφιπερισκαίροντες ἐΰξυγον ἅρμα θαλάσσης 
1.191	τοίχους τʼ ἀμφοτέρους περί τε πρυμναῖα χαλινὰ
1.192	οἰήκων, ἄλλοι δὲ περὶ πρώρην ἀγέρονται·
1.193	οὐδέ κεν αὐτόμολον κείνων πλόον, ἀλλʼ ὑπὸ δεσμῷ
1.194	φαίης εὐγόμφοισιν ἐνισχομένους πινάκεσσιν
1.195	ἑλκομένους ἀέκοντας ἀναγκαίῃσιν ἄγεσθαι. 
1.196	τόσσον ἔρως γλαφυρῇσιν ἐφʼ ὁλκάσιν ἑσμὸν ἀγείρει.
1.197	οἷον δὴ βασιλῆα φερέπτολιν ἠέ τινʼ ἄνδρα
1.198	ἀθλοφόρον, θαλλοῖσι νεοστέπτοισι κομῶντα,
1.199	παῖδές τʼ ἠΐθεοί τε καὶ ἀνέρες ἀμφιέποντες
1.200	ὃν δόμον εἰσανάγουσι καὶ ἀθρόοι αἰὲν ἕπονται, 
1.201	εἰσόκεν εὐερκῆ μεγάρων ὑπὲρ οὐδὸν ἀμείψῃ·
1.202	ὣς οἵ γʼ ὠκυπόροισιν ἀεὶ νήεσσιν ἕπονται,
1.203	ὄφρʼ οὔτις γαίης ἐλάει φόβος· ἀλλʼ ὅτε χέρσον
1.204	φράσσωνται, τραφερὴν δὲ μέγʼ ἐχθαίρουσιν ἄρουραν,
1.205	αὖτις ἀφορμηθέντες ἀολλέες ἠΰτε νύσσης 
1.206	πάντες ἀποθρώσκουσι καὶ οὐκέτι νηυσὶν ἕπονται.
1.207	σῆμα τόδε πλωτῆρσιν ἐτήτυμον ἐγγύθι γαίης
1.208	ἔμμεναι, εὖτε λιπόντας ὁμοπλωτῆρας ἴδωνται.
1.209	πομπίλε, ναυτιλίῃσι τετιμένε, σοὶ δέ τις ἀνὴρ
1.210	εὐκραεῖς ἀνέμων τεκμαίρεται ἐλθέμεν αὔρας· 
1.211	εὔδια γὰρ στέλλῃ τε καὶ εὔδια σήματα φαίνεις.
1.212	καὶ μὲν δὴ πελάγεσσιν ὁμῶς ἐχενηῒς ἑταίρη·
1.213	ἡ δʼ ἦτοι ταναὴ μὲν ἰδεῖν, μῆκος δʼ ἰσόπηχυς,
1.214	χροιὴ δʼ αἰθαλόεσσα, φυὴ δέ οἱ ἐγχελύεσσιν
1.215	εἴδεται, ὀξὺ δέ οἱ κεφαλῆς στόμα νέρθε νένευκε 
1.216	καμπύλον, ἀγκίστρου περιηγέος εἴκελον αἰχμῇ.
1.217	θαῦμα δʼ ὀλισθηρῆς ἐχενηΐδος ἐφράσσαντο
1.218	ναυτίλοι· οὐ μὲν δή τις ἐνὶ φρεσὶ πιστώσαιτο
1.219	εἰσαΐων· αἰεὶ γὰρ ἀπειρήτων νόος ἀνδρῶν
1.220	δύσμαχος, οὐδʼ ἐθέλουσι καὶ ἀτρεκέεσσι πιθέσθαι· 
1.221	νῆα τιταινομένην ἀνέμου ζαχρηέος ὁρμῇ,
1.222	λαίφεσι πεπταμένοισιν ἁλὸς διὰ μέτρα θέουσαν,
1.223	ἰχθὺς ἀμφιχανὼν ὀλίγον στόμα νέρθεν ἐρύκει,
1.224	πᾶσαν ὑποτρόπιος βεβιημένος· οὐδʼ ἔτι τέμνει
1.225	κῦμα καὶ ἱεμένη, κατὰ δʼ ἔμπεδον ἐστήρικται, 
1.226	ἠΰτʼ ἐν ἀκλύστοισιν ἐεργομένη λιμένεσσι.
1.227	καὶ τῆς μὲν λίνα πάντα περὶ προτόνοισι μέμυκε,
1.228	ῥοχθεῦσιν δὲ κάλωες, ἐπημύει δὲ κεραίη,
1.229	ῥιπῇ ἐπειγομένη, πρύμνῃ δʼ ἔπι πάντα χαλινὰ
1.230	ἰθυντὴρ ἀνίησιν, ἐπισπέρχων ὁδὸν ἅλμης· 
1.231	ἡ δʼ οὔτʼ οἰήκων ἐμπάζεται οὔτʼ ἀνέμοισι
1.232	πείθεται, οὐ ῥοθίοισιν ἐλαύνεται, ἀλλὰ παγεῖσα
1.233	μίμνει τʼ οὐκ ἐθέλουσα καὶ ἐσσυμένη πεπέδηται,
1.234	ἰχθύος οὐτιδανοῖο κατὰ στόμα ῥιζωθεῖσα·
1.235	ναῦται δὲ τρομέουσιν, ἀείδελα δεσμὰ θαλάσσης 
1.236	δερκόμενοι καὶ θάμβος ἴσον λεύσσοντες ὀνείρῳ.
1.237	ὡς δʼ ὅτʼ ἐνὶ ξυλόχοισιν ἀνὴρ λαιψηρὰ θέουσαν
1.238	θηρητὴρ ἔλαφον δεδοκημένος ἄκρον ὀϊστῷ
1.239	κῶλον ὑπὸ πτερόεντι βαλὼν ἐπέδησεν ἐρωῆς·
1.240	ἡ δὲ καὶ ἐσσυμένη περ ἀναγκαίῃς ὀδύνῃσιν 
1.241	ἀμφιπαγεῖσʼ ἀέκουσα μένει θρασὺν ἀγρευτῆρα·
1.242	τοίην νηΐ πέδην περιβάλλεται αἰόλος ἰχθὺς
1.243	ἀντιάσας· τοίων δὲ φερωνυμίην λάχεν ἔργων.
1.244	Χαλκίδες αὖ θρίσσαι τε καὶ ἀβραμίδες φορέονται
1.245	ἀθρόαι, ἄλλοτε δʼ ἄλλον ἁλὸς πόρον, ἢ περὶ πέτρας 
1.246	ἢ πελάγη, δολιχοῖσί τʼ ἐπέδραμον αἰγιαλοῖσιν,
1.247	αἰέν ἀμειβόμεναι ξείνην ὁδὸν ἠΰτ’ ἀλῆται.
1.248	Ἀνθιέων δὲ μάλιστα νομαὶ πέτρῃσι βαθείαις
1.249	ἔμφυλοι· ταῖς δʼ οὔτι παρέστιοι αἰὲν ἔασι,
1.250	πάντῃ δὲ πλάζονται, ὅπῃ γένυς, ἔνθα κελεύει 
1.251	γαστὴρ καὶ λαίμαργος ἔρως ἀκόρητος ἐδωδῆς·
1.252	ἔξοχα γὰρ παρὰ πάντας ἀδηφάγος οἶστρος ἐλαύνει
1.253	κείνους καὶ νωδόν περ ὑπὸ στόμα χῶρον ἔχοντας.
1.254	τέσσαρα δʼ ἀνθιέων μεγακήτεα φῦλα νέμονται,
1.255	ξανθοί τʼ ἀργεννοί τε τὸ δὲ τρίτον αἷμα αἷμα· εἷμα Koechly κελαινοί· 
1.256	ἄλλους δʼ εὐωπούς τε καὶ αὐλωποὺς καλέουσιν,
1.257	οὕνεκα τοῖς καθύπερθεν ἑλισσομένη κατὰ κύκλον
1.258	ὀφρὺς ἠερόεσσα περίδρομος ἐστεφάνωται.
1.259	δοιοὶ δὲ σκληροῖσιν ἀρηρότα γυῖα χιτῶσι
1.260	φραξάμενοι κόλποισιν ἐνιπλώουσι θαλάσσης, 
1.261	κάραβος ὀξυπαγὴς ἠδʼ ἀστακός· οἱ δὲ καὶ ἄμφω
1.262	πέτραις ἐνναίουσι καὶ ἐν πέτρῃσι νέμονται.
1.263	ἄστακος αὖ πέρι δή τι καὶ οὐ φατὸν οἷον ἔρωτα
1.264	οἰκείης θαλάμης κεύθει φρεσίν, οὐδέ ποτʼ αὐτῆς
1.265	λείπεθʼ ἑκών, ἀλλʼ εἴ μιν ἀναγκαίῃ τις ἐρύσσας 
1.266	τῆλε φέρων ἑτέρωσε πάλιν πόντονδε μεθείη,
1.267	αὐτὰρ ὅγʼ οὐ μετὰ δηρὸν ἑὴν νόστησε χαράδρην
1.268	σπεύδων, οὐδʼ ἐθέλει ξεῖνον μυχὸν ἄλλον ἑλέσθαι,
1.269	οὐδʼ ἑτέρης πέτρης ἐπιβάλλεται, ἀλλὰ διώκει
1.270	καὶ δόμον ὃν κατέλειπε καὶ ἤθεα καὶ νομὸν ἅλμης 
1.271	κείνης ἥ μιν ἔφερβε καὶ οὐκ ἤχθηρε θάλασσαν,
1.272	τῆς μιν ἀπεξείνωσαν ἁλίπλοοι ἀγρευτῆρες.
1.273	ὣς ἄρα καὶ πλωτοῖσιν ἑὸς δόμος ἠδὲ θάλασσα
1.274	πατρῴη καὶ χῶρος ἐφέστιος, ἔνθʼ ἐγένοντο,
1.275	στάζει ἐνὶ κραδίῃ γλυκερὸν γάνος, οὐδʼ ἄρα μούνοις 
1.276	πατρὶς ἐφημερίοισι πέλει γλυκερώτατον ἄλλων·
1.277	οὐδʼ ἀλεγεινότερον καὶ κύντερον, ὅς κεν ἀνάγκῃ
1.278	φυξίπολιν πάτρης τελέσῃ βίον ἀλγινόεντα,
1.279	ξεῖνος ἐν ἀλλοδαποῖσιν ἀτιμίης ζυγὸν ἕλκων.
1.280	ἐν κείνῃ γενεῇ καὶ καρκίνοι εἰσὶν ἀλῆται 
1.281	καρίδων τε νομαὶ καὶ ἀναιδέα φῦλα παγούρων,
