2.47	πότμον ἄγων, ἕτερος δʼ ἑτέρῳ πόρσυνεν ἐδωδήν.
2.48	οἱ μὲν γὰρ γενύεσσι καὶ ἠνορέῃ βιόωνται
2.49	χειροτέρους· τοῖς δʼ ἰὸν ἔχει στόμα· τοῖσι δʼ ἄκανθαι
2.50	τύμμασι λευγαλέοισιν ἀμυνέμεναι πεφύασι, 
2.51	πικραί τʼ ὀξεῖαί τε χόλου πυρόεντος ἀκωκαί.
2.52	ὅσσοις δʼ οὔτε βίην θεὸς ὤπασεν οὔτε τι κέντρον
2.53	θήγεται ἐκ μελέων, τοῖς δʼ ἐκ φρενὸς ὅπλον ἔφυσε
2.54	βουλὴν κερδαλέην, πολυμήχανον, οἵ τε δόλοισι
2.55	πολλάκι καὶ κρατερόν καὶ ὑπέρτερον ὤλεσαν ἰχθύν. 
2.56	οἷον καὶ νάρκῃ τερενόχροϊ φάρμακον ἀλκῆς
2.57	ἕσπεται αὐτοδίδακτον ἐν οἰκείοισι μέλεσσιν.
2.58	ἡ μὲν γὰρ μαλακή τε δέμας καὶ πᾶσʼ ἀμενηνὴ
2.59	νωθής τε βραδυτῆτι βαρύνεται, οὐδέ κε φαίης
2.60	νηχομένην ὁράαν· μάλα γὰρ δύσφραστα κέλευθα 
2.61	εἱλεῖται πολιοῖο διʼ ὕδατος ἑρπύζουσα·
2.62	ἀλλά οἱ ἐν λαγόνεσσιν ἀναλκείης δόλος ἀλκή·
2.63	κερκίδες ἐμπεφύασι παρὰ πλευραῖς ἑκάτερθεν
2.64	ἀμφίδυμοι· τῶν εἴ τις ἐπιψαύσειε πελάσσας,
2.65	αὐτίκα οἱ μελέων σθένος ἔσβεσεν, ἐν δέ οἱ αἷμα 
2.66	πήγνυται, οὐδʼ ἔτι γυῖα φέρειν δύνατʼ, ἀλλά οἱ ἀλκὴ
2.67	ἦκα μαραινομένοιο παρίεται ἄφρονι νάρκῃ.
2.68	ἡ δʼ εὖ γινώσκουσα θεοῦ γέρας οἷον ἔδεκτο,
2.69	ὕπτιον ἀγκλίνασα μένει δέμας ἐν ψαμάθοισι·
2.70	κεῖται δʼ ἀστεμφὴς οἵη νέκυς· ὃς δέ κεν ἰχθὺς 
2.71	ἐγχρίμψῃ λαγόνεσσιν, ὁ μὲν λύτο, κάππεσε δʼ αὕτως
2.72	ἀδρανίης βαθὺν ὕπνον, ἀμηχανίῃσι πεδηθείς·
2.73	ἡ δὲ θοῶς ἀνόρουσε καὶ οὐ κραιπνή περ ἐοῦσα,
2.74	γηθοσύνη, ζωὸν δὲ κατεσθίει ἶσα θανόντι.
2.75	πολλάκι καὶ κατὰ λαῖτμα μετʼ ἰχθύσιν ἀντιάσασα 
2.76	νηχομένοις κραιπνὴν μὲν ἐπειγομένων σβέσεν ὁρμὴν
2.77	ἐγγὺς ἐπιψαύσασα καὶ ἐσσυμένους ἐπέδησεν·
2.78	ἔσταν δʼ αὐαλέοι καὶ ἀμήχανοι, οὔτε κελεύθων
2.79	δύσμοροι οὔτε φυγῆς μεμνημένοι· ἡ δὲ μένουσα
2.80	οὐδὲν ἀμυνομένους καταδαίνυται οὐδʼ ἀΐοντας. 
2.81	οἷον δʼ ὀρφναίοισιν ἐν εἰδώλοισιν ὀνείρων
2.82	ἀνδρὸς ἀτυζομένοιο καὶ ἱεμένοιο φέβεσθαι
2.83	θρώσκει μὲν κραδίη, τὰ δὲ γούνατα παλλομένοιο
2.84	ἀστεμφὴς ἅτε δεσμὸς ἐπειγομένοιο βαρύνει,
2.85	τοίην γυιοπέδην τεχνάζεται ἰχθύσι νάρκη. 
2.86	Βάτραχος αὖ νωθὴς μὲν ὁμῶς καὶ μαλθακὸς ἰχθύς,
2.87	αἴσχιστος δʼ ἰδέειν· στόμα δʼ οἴγεται εὐρὺ μάλιστα·
2.88	ἀλλʼ ἄρα καὶ τῷ μῆτις ἀνεύρατο γαστέρι φορβήν.
2.89	αὐτὸς μὲν πηλοῖο κατʼ εὐρώεντος ἐλυσθεὶς
2.90	κέκλιται ἀτρεμέων, ὀλίγην δʼ ἀνὰ σάρκα τιταίνει, 
2.91	ἥ ῥά οἱ ἐκ γένυος νεάτης ὑπένερθε πέφυκε
2.92	λεπτή τʼ ἀργεννή τε, κακὴ δέ οἱ ἐστὶν ἀϋτμή·
2.93	τὴν θαμὰ δινεύει, δόλον ἰχθύσι βαιοτέροισιν·
2.94	οἵ ῥά μιν εἰσορόωντες ἐφορμώωσι λαβέσθαι.
2.95	αὐτὰρ ὁ τὴν ἂψ αὖτις ἐφέλκεται ἀτρέμας εἴσω, 
2.96	ἦκα μάλʼ ἀσπαίρουσαν ὑπὸ στόμα, τοὶ δʼ ἐφέπονται
2.97	οὐδὲν ὀϊόμενοι κρυπτὸν δόλον, ὄφρα λάθωσι
2.98	βατράχου εὐρείῃσιν ἔσω γενύεσσι μιγέντες.
2.99	ὡς δʼ ὅτε τις κούφοισι πάγην ὄρνισι τιτύσκων,
2.100	πυροὺς τοὺς μὲν ἔρηνε δόλου προπάροιθε πυλάων, 
2.101	ἄλλους δʼ ἔνδον ἔθηκεν, ὑπεστήριξε δὲ τέχνην·
2.102	τοὺς δὲ λιλαιομένους ἕλκει πόθος ὀξὺς ἐδωδῆς,
2.103	εἴσω δὲ προγένοντο, καὶ οὐκέτι νόστος ἑτοῖμος
2.104	ἐκδῦναι, δαιτὸς δὲ κακὴν εὕραντο τελευτήν·
2.105	ὣς κείνους ἀμενηνὸς ἐπέσπασεν ἠπεροπεύσας 
2.106	βάτραχος, οὐδʼ ἐνόησαν ἑὸν σπεύδοντες ὄλεθρον.
2.107	τοῖα καὶ ἀγκυλόμητιν ἐπέκλυον ἐντύνασθαι
2.108	κερδώ· ὅτʼ οἰωνῶν ἀγέλην πλήθουσαν ἴδηται,
2.109	δοχμίη ἀγκλινθεῖσα, τανυσσαμένη θοὰ κῶλα,
2.110	ὄμματʼ ἐπιμύει, σὺν δὲ στόμα πάμπαν ἐρείδει· 
2.111	φαίης κʼ εἰσορόων ἤ μιν βαθὺν ὕπνον ἰαύειν,
2.112	ἠὲ καὶ ἀτρεκέως κεῖσθαι νέκυν· ὧδε γὰρ ἄπνους
2.113	αἰόλα βουλεύουσα παραβλήδην τετάνυσται·
2.114	οἱ δέ μιν εἰσορόωντες ἀολλέες ἰθὺς ἴενται
2.115	ὄρνιθες, λάχνην δὲ διαψαίρουσι πόδεσσιν, 
2.116	ἠΰτε κερτομέοντες· ἐπὴν δέ οἱ ἐγγὺς ὀδόντων
2.117	ἔλθωσιν, τότʼ ἔπειτα δόλου πετάσασα θύρετρα,
2.118	ἐξαπίνης συνέμαρψε καὶ ἔσπασεν εὐρὺ χανοῦσα
2.119	ἄγρην κερδαλέην, ὅσσην ἕλεν οἰμήσασα.
2.120	καὶ μὲν δὴ δολόμητις ἐπίκλοπον εὕρατο θήρην 
2.121	σηπίη· ἐκ γάρ οἱ κεφαλῆς πεφύασιν ἀραιοὶ
2.122	ἀκρέμονες προτενεῖς, ὥστε πλόκοι, οἷσι καὶ αὐτὴ
2.123	ὥστε περ ὁρμιῇσιν ἐφέλκεται ἰχθύας ἄγρῃ,
2.124	πρηνὴς ἐν ψαμάθοισιν ὑπʼ ὀστράκῳ εἰλυθεῖσα.
2.125	κείναις δὲ πλοκαμῖσι καὶ ἡνίκα κύματα θύει 
2.126	χείματι πετράων ἀντίσχεται, ἠΰτε τις νηῦς
2.127	πείσματʼ ἐπʼ ἀκταίῃσιν ἀναψαμένη σπιλάδεσσι.
2.128	Καρῖδες δʼ ὀλίγαι μὲν ἰδεῖν, ἴση δὲ καὶ ἀλκὴ
2.129	γυίοις, ἀλλὰ δόλοισι καὶ ἄλκιμον ὤλεσαν ἰχθύν,
2.130	λάβρακα, σφετέρῃσιν ἐπικλέα λαβροσύνῃσιν. 
2.131	οἱ μὲν γὰρ σπεύδουσι καὶ ἰθύουσι λαβέσθαι
2.132	καρίδων, ταῖς δʼ οὔτε φυγεῖν σθένος οὔτε μάχεσθαι,
2.133	ὀλλύμεναι δʼ ὀλέκουσι καὶ οὓς πέφνουσι φονῆας.
2.134	εὖτε γὰρ ἀμφιχανόντες ἔσω μάρψωσιν ὀδόντων,
2.135	αἵδε θαμᾶ θρώσκουσι καὶ ἐς μεσάτην ὑπερῴην 
2.136	ὀξὺ κέρας χρίμπτουσι, τό τε σφίσι τέλλεται ἄκρης
2.137	ἐκ κεφαλῆς· λάβραξ δὲ φίλης κεκορημένος ἄγρης
2.138	νύγματος οὐκ ἀλέγει· τὸ δέ μιν νέμεταί τε καὶ ἕρπει,
2.139	εἰσόκε τρυχόμενόν μιν ἕλῃ μόρος ἐξ ὀδυνάων·
2.140	ὀψὲ δὲ γινώσκει νέκυος δεδαϊγμένος αἰχμῇ. 
2.141	ἔστι δέ τις πηλοῖσιν ἐφέστιος ὠμοφάγος βοῦς,
2.142	εὐρύτατος πάντεσσι μετʼ ἰχθύσιν· ἦ γάρ οἱ εὖρος
2.143	πολλάκις ἑνδεκάπηχυ δυωδεκάπηχύ τʼ ἐτύχθη·
2.144	οὐτιδανὸς δὲ βίην καί οἱ δέμας ἄμμορον ἀλκῆς,
2.145	μαλθακόν· ἐν δέ οἱ εἰσὶν ἀείδελοι ἔνδον ὀδόντες 
2.146	βαιοί τʼ οὐ κρατεροί τε· βίῃ δέ κεν οὔτι δαμάσσαι,
2.147	ἀλλὰ δόλῳ καὶ φῶτας ἐπίφρονας εἷλε πεδήσας·
2.148	δαιτὶ γὰρ ἀνδρομέῃ ἐπιτέρπεται, ἔξοχα δʼ αὐτῷ
2.149	ἀνθρώπων κρέα τερπνὰ καὶ εὐάντητος ἐδωδή.
2.150	εὖτέ τινʼ ἀθρήσῃ νεάτην ὑπὸ βύσσαν ἰόντα 
2.151	ἀνθρώπων, ὅσσοισιν ὑποβρύχιος πόνος ἅλμης
2.152	μέμβλεται, αὐτὰρ ὁ κοῦφος ὑπὲρ κεφαλῆφιν ἀερθεὶς
2.153	νήχεται ἀστεμφής, μεγάρων ὀρόφοισιν ἐοικώς,
2.154	ἄτροπος ἀμφιταθείς, σὺν δʼ ἔρχεται, ᾗ κεν ἴῃσι
2.155	δειλὸς ἀνήρ, μίμνοντι δʼ ἐφίσταται ἠΰτε πῶμα. 
2.156	ὡς δὲ πάϊς δολόεντα μόρον λίχνοισι μύεσσιν
2.157	ἔστησεν· τὸν δʼ οὔτι πάγης λόχον ὁρμαίνοντα
2.158	γαστὴρ ἔνδον ἔλασσε, θοῶς δέ οἱ ἄγγος ὕπερθε
2.159	κοῖλον ἐπεσμαράγησεν, ὁ δʼ οὐκέτι πολλὰ μενοινῶν
2.160	ἐκφυγέειν δύναται στιβαρὸν σκέπας, ὄφρα ἑ κοῦρος 
2.161	μάρψῃ τε κτείνῃ τε, γέλων δʼ ἐπιθήσεται ἄγρῃ·
2.162	ὣς ὅ γʼ ὑπὲρ κεφαλῆς βροτέης ὀλοφώϊος ἰχθὺς
2.163	πέπτατʼ ἐρητύων ἀναδύμεναι, εἰσόκʼ ἀϋτμὴ
2.164	φῶτα λίπῃ, ψυχὴν δὲ μετεκπνεύσῃ ῥοθίοισιν·
2.165	ἔνθα ἑ τεθνηῶτα δυσώνυμος ἀμφιέπει βοῦς 
2.166	δαινύμενος, τέχνῃσιν ἑλὼν δυσμήχανον ἄγρην.
2.167	καὶ μέν τις μνιαροῖσιν ἐπὶ πλαταμῶσι νοήσας
2.168	καρκίνον αἰνήσει καὶ ἀγάσσεται εἵνεκα τέχνης
2.169	κερδαλέης· καὶ τῷ γὰρ ἐπιφροσύνην πόρε δαίμων
2.170	ὄστρεα φέρβεσθαι, γλυκερὴν καὶ ἄμοχθον ἐδωδήν. 
2.171	ὄστρεα μὲν κληῗδας ἀναπτύξαντα θυρέτρων
2.172	ἰλὺν λιχμάζουσι καὶ ὕδατος ἰσχανόωντα
2.173	πέπταται, ἀγκοίνῃσιν ἐφήμενα πετραίῃσι·
2.174	καρκίνος αὖ ψηφῖδα παρὰ ῥηγμῖνος ἀείρας
2.175	λέχριος ὀξείῃσι φέρει χηλῇσι μεμαρπώς, 
2.176	λάθρη δʼ ἐμπελάει, μέσσῳ δʼ ἐνεθήκατο λᾶαν
2.177	ὀστρέῳ· ἔνθεν ἔπειτα παρήμενος εἰλαπινάζει
2.178	δαῖτα φίλην· τὸ δʼ ἄρʼ οὔτι καὶ ἱέμενόν περ ἐρεῖσαι
2.179	ἀμφιδύμους πλάστιγγας ἔχει σθένος, ἀλλʼ ὑπʼ ἀνάγκης
2.180	οἴγεται, ὄφρα θάνῃ τε καὶ ἀγρευτῆρα κορέσσῃ. 
2.181	τῷ δʼ ἴσα τεχνάζουσι καὶ ἀστέρες ἑρπυστῆρες
2.182	εἰνάλιοι· καὶ τοῖς γὰρ ἐπʼ ὄστρεα μῆτις ὀπηδεῖ·
2.183	ἀλλʼ οὐ λᾶαν ἄγουσι συνέμπορον οὐδʼ ἐπίκουρον
2.184	κεῖνοι, τρηχὺ δὲ κῶλον ἐνηρείσαντο μέσοισι
2.185	πεπταμένοις· τὰ μὲν ὧδε πιέζεται, οἱ δὲ νέμονται. 
2.186	ὄστρακον αὖ βυθίας μὲν ἔχει πλάκας, ἐν δέ οἱ ἰχθὺς
2.187	πίννη ναιετάει κεκλημένος· ἡ μὲν ἄναλκις
2.188	οὔτε τι μητίσασθαι ἐπίσταται οὔτε τι ῥέξαι,
2.189	ἀλλʼ ἄρα οἱ ξυνόν τε δόμον ξυνήν τε καλύπτρην
2.190	καρκίνος ἐνναίει, φέρβει δέ μιν ἠδὲ φυλάσσει· 
2.191	τῷ καὶ πιννοφύλαξ κικλήσκεται· ἀλλʼ ὅτε κόχλου
2.192	ἰχθὺς ἔνδον ἵκηται, ὁ δʼ οὐ φρονέουσαν ἀμύξας
2.193	δήγματι κερδαλέῳ πίννην ἕλεν· ἡ δʼ ὀδύνῃσιν
2.194	ὄστρακα συμπλατάγησε καὶ ἔνδον ἐφράσσατο ἄγρην
2.195	αὑτῇ τʼ ἠδʼ ἑτάρῳ, ξυνόν θʼ ἅμα δεῖπνον ἕλοντο. 
2.196	ὣς ἄρα καὶ πλωτῆρσιν ἐν ὑγροπόροισιν ἔασι
2.197	τοὶ μὲν κερδαλέοι, τοὶ δʼ ἄφρονες, οἷα καὶ ἡμῖν
2.198	ἀνδράσιν, οὐδέ τι πᾶσιν ἐναίσιμόν ἐστι νόημα.
2.199	φράζεο δʼ ἀφραδίῃ προφερέστατον ἡμεροκοίτην
2.200	ἰχθύν, ὃν παρὰ πάντας ἀεργότατον τέκεν ἅλμη. 
2.201	τοῦ δʼ ἤτοι κεφαλῆς μὲν ἄνω τέτραπται ὕπερθεν
2.202	ὄμματα, καὶ στόμα λάβρον ἐν ὀφθαλμοῖσι μέσοισιν·
2.203	αἰεὶ δʼ ἐν ψαμάθοισι πανημέριος τετάνυσται
2.204	εὕδων, νυκτὶ δὲ μοῦνον ἀνέγρεται ἠδʼ ἀλάληται·
2.205	τοὔνεκα κέκληται καὶ νυκτερίς· ἀλλά μιν ἄτη 
2.206	γαστρὸς ἀτεκμάρτοιο κακὴ λάχεν· οὐ γὰρ ἐδωδῆς
2.207	ἢ κόρον ἠέ τι μέτρον ἐπίσταται, ἀλλʼ ἀτέλεστον
2.208	λυσσομανῆ βούβρωστιν ἀναιδέϊ γαστρὶ φυλάσσει·
2.209	οὐδέ ποτʼ ἂν λήξειεν ἐδητύος ἐγγὺς ἐούσης,
2.210	εἰσόκεν οἱ νηδύς τε μέση διὰ πᾶσα ῥαγείη, 
2.211	αὐτός τε προταθεὶς πέσῃ ὕπτιος, ἠέ τις ἄλλος
2.212	πέφνῃ μιν νεπόδων πυμάτης ἔμφορτον ἐδωδῆς.
2.213	σῆμα δέ τοι τόδε γαστρὸς ἀειμάργοιο πιφαύσκω·
2.214	εἰ γάρ τίς μιν ἑλὼν θήρης ἀποπειρήσαιτο
2.215	χειρὶ βορὴν ὀρέγων, ὁ δὲ δέξεται, εἰσόκεν αὐτοῦ 
2.216	λαβροτάτου στόματος νηήσεται ἄχρις ἐδωδή.
2.217	κλῦτε, γοναὶ μερόπων, οἶον τέλος ἀφραδίῃσι
2.218	λαιμάργοις, ὅσον ἄλγος ἀδηφαγίῃσιν ὀπηδεῖ·
2.219	τῷ τις ἀεργίην δυστερπέα τῆλε διώκοι
2.220	καὶ κραδίης καὶ χειρός, ἔχοι δέ τι μέτρον ἐδωδῆς· 
2.221	μηδʼ ἐπὶ πανθοίνοισι νόον τέρποιτο τραπέζαις·
2.222	πολλοὶ γὰρ τοῖοι καὶ ἐν ἀνδράσιν, οἶσι λέλυνται
2.223	ἡνία, γαστρὶ δὲ πάντας ἐπιτρωπῶσι κάλωας·
2.224	ἀλλά τις εἰσορόων φεύγοι τέλος ἡμεροκοίτου.
2.225	ἔστι καὶ ὀξυκόμοισι νόος καὶ μῆτις ἐχίνοις, 
2.226	οἴ τʼ ἀνέμων ἴσασι βίας ζαμενεῖς τε θυέλλας
2.227	ὀρνυμένας, νώτοισι δʼ ἀνοχλίζουσιν ἕκαστος
2.228	λᾶαν, ὅσον βαρύθοντα περὶ σφετέρῃσιν ἀκάνθαις
2.229	ῥηϊδίως φορέοιεν, ἴνʼἀντία κύματος ὁρμῇ
2.230	βριθόμενοι μίμνωσι· τὸ γὰρ τρομέουσι μάλιστα, 
2.231	μὴ σφὰς ἐπʼ ἠιόνεσσι κυκώμενον οἶμα κυλίσῃ·
2.232	Πουλυπόδων δʼ οὔπω τινʼ ὀΐομαι ἔμμενʼ ἄπυστον
2.233	τέχνης, οἳ πέτρῃσιν ὁμοίϊοι ἰνδάλλονται,
2.234	τήν κε ποτιπτύξωσι περὶ σπείρῃς τε βάλωνται.
2.235	ἄνδρας δʼ ἀγρευτῆρας ὁμῶς καὶ κρέσσονας ἰχθῦς 
2.236	ῥηϊδίως ἀπάτῃσι παραπλάγξαντες ἄλυξαν.
2.237	ἀλλʼ ὅτε χειρότερός τις ἐπισχεδὸν ἀντιβολήσῃ,
2.238	αὐτίκα πουλύποδές τε καὶ ἰχθύες ἐξεφάνησαν,
2.239	μορφῆς πετραίης ἐξάλμενοι, ἐκ δὲ δόλοιο
2.240	φορβήν τʼ ἐφράσσαντο καὶ ἐξήλυξαν ὄλεθρον. 
2.241	χείματι δʼ οὔποτε φασὶν ἐπιστείχειν ἁλὸς ὕδωρ
2.242	πουλύποδας· ζαμενεῖς γὰρ ὑποτρομέουσιν ἀέλλας·
2.243	ἀλλʼ οἵ γε γλαφυρῇσιν ἐνιζόμενοι θαλάμῃσι
2.244	πτήξαντες δαίνυνται ἑοὺς πόδας, ἠΰτε σάρκας
2.245	ἀλλοτρίας· οἱ δʼ αὖτις ἑοὺς κορέσαντες ἄνακτας 
2.246	φύονται· τόδε πού σφι Ποσειδάων ἐπένευσε.
2.247	τοῖον καὶ βλοσυρῇσιν ἀειμάργοισι νόημα
2.248	ἄρκτοις· χειμερίην γὰρ ἀλυσκάζουσαι ὁμοκλήν,
2.249	δῦσαι φωλειοῖο μυχὸν κατὰ πετρήεντα
2.250	ὃν πόδα λιχμάζουσιν, ἐδητύος ἔργον ἄπαστον, 
2.251	μαιόμεναι δαίτην ἀνεμώλιον, οὐδʼ ἐθέλουσι
2.252	προβλώσκειν, εὐκραὲς ἕως ἔαρ ἡβήσειεν.
2.253	ἔξοχα δʼ ἀλλήλοισιν ἀνάρσιον ἔχθος ἔχουσι
2.254	κάραβος ἀϊκτὴρ μύραινά τε πουλύποδές τε,
2.255	ἀλλήλους δʼ ὀλέκουσιν ἀμοιβαίοισι φόνοισιν. 
2.256	αἰεὶ δʼ ἰχθυόεσσα μετὰ σφίσιν ἵστατʼ ἐνυὼ
2.257	καὶ μόθος, ἄλλου δʼ ἄλλος ἑὴν ἐνεπλήσατο νηδύν.
2.258	ἡ μὲν ὑπὲκ πέτρης ἁλιμυρέος ὁρμηθεῖσα
2.259	φοιταλέη μύραινα διέσσυται οἴδματα πόντου,
2.260	φορβὴν μαιομένη, τάχα δʼ εἴσιδε πούλυπον ἀκτῆς 
2.261	ἄκρα διερπύζοντα καὶ ἀσπασίην ἐπί θήρην
2.262	ἔσσυτο γηθομένη· τὸν δʼ οὐ λάθεν ἐγγὺς ἐοῦσα·
2.263	ἀλλʼ ἤτοι πρῶτον μὲν ἀτυζόμενος δεδόνηται
2.264	ἐς φόβον, οὐδʼ ἄρα μῆχος ἔχει μύραιναν ἀλύξαι
2.265	ἕρπων νηχομένην τε καὶ ἄσχετα μαιμώωσαν. 
2.266	αἶψα δέ μιν κατέμαρψε γένυν τʼ ἐνέρεισε δαφοινήν· 
2.267	πούλυπος αὖτʼ ἀέκων ὀλοῆς ὑπὸ μάρνατʼ ἀνάγκης,
2.268	ἀμφὶ δέ οἱ μελέεσσιν ἑλίσσεται, ἄλλοτε ἄλλας
2.269	παντοίας στροφάλιγγας ὑπὸ σκολιοῖσιν ἱμᾶσι
2.270	τεχνάζων, εἴ πώς μιν ἐρητύσειε βρόχοισιν 
2.271	ἀμφιβαλών· ἀλλʼ οὔτι κακῶν ἄκος οὔτʼ ἀλεωρή·
2.272	ῥεῖα γὰρ ἀμφιπεσόντος ὀλισθηροῖς μελέεσσιν
2.273	ὀτραλέη μύραινα διαρρέει οἷάπερ ὕδωρ·
2.274	αὐτὰρ ὅ γʼ ἄλλοτε νῶτα παναίολα, ἄλλοτε δειρὴν
2.275	οὐρήν τʼ ἀκροτάτην περιβάλλεται, ἄλλοτε δʼ αὖτε 
2.276	ἐμπίπτει στόματός τε πύλαις γενύων τε μυχοῖσιν.
2.277	ὡς δὲ παλαισμοσύνης γυιαλκέος ἴδμονες ἄνδρες
2.278	δηρὸν ἐπʼ ἀλλήλοισιν ἑὴν ἀναφαίνετον ἀλκήν,
2.279	ἤδη δʼ ἐκ μελέων λιαρὸς καὶ ἀθέσφατος ἱδρὼς
2.280	χεύεται ἀμφοτέροισι· τὰ δʼ αἰόλα κέρδεα τέχνης 
2.281	πλάζονται, χεῖρές τε περὶ χροῒ κυμαίνονται·
2.282	ὣς καὶ πουλύποδος κοτυληδόνες οὐ κατὰ κόσμον
2.283	πλαζόμεναι κενεῇσι παλαισμοσύναις μογέουσιν.
2.284	ἡ δέ μιν ὀξυτόμοισιν ὑπὸ ῥιπῇσιν ὀδόντων
2.285	δαρδάπτει· μελέων δὲ τὰ μὲν κατεδέξατο γαστήρ, 
2.286	ἄλλα δʼ ἔτʼ ἐν γενύεσσι θοοὶ τρίβουσιν ὀδόντες,
2.287	ἄλλα δέ τʼ ἀσπαίρει καὶ ἑλίσσεται ἡμιδάϊκτα,
2.288	εἰσέτι παιφάσσοντα καὶ ἐκφυγέειν ἐθέλοντα.
2.289	ὡς δʼ ὅτʼ ἀνὰ ξυλόχους ὀφίων στίβον ἐξερεείνων
2.290	βριθόκερως ἔλαφος ῥινήλατον ἴχνος ἀνεῦρε, 
2.291	χειὴν δʼ εἰσαφίκανε καὶ ἑρπετὸν εἴρυσεν ἔξω
2.292	δάπτει τʼ ἐμμενέως· ὁ δʼ ἐλίσσεται ἀμφί τε γοῦνα,
2.293	δειρήν τε στέρνον τε· τὰ δʼ ἡμίβρωτα κέχυνται
2.294	ἅψεα, πολλὰ δʼ ὀδόντες ὑπὸ στόμα δαιτρεύουσιν·
2.295	ὣς καὶ πουλύποδος δνοπαλίζεται αἰόλα γυῖα 
2.296	δυσμόρου· οὐδέ ἑ μῆτις ἐπιφροσύνης ἐσάωσε
2.297	πετραίης· εἰ γάρ ποτʼ ἀλευόμενος περὶ πέτρην
2.298	πλέξηται, χροιήν τε πανείκελον ἀμφιέσηται,
2.299	ἀλλʼ οὐ μυραίνης ἔλαθεν κέαρ, ἀλλά ἑ μούνη
2.300	φράζεται, ἄπρηκτον δὲ πέλει κείνοιο νόημα. 
2.301	ἔνθα μιν οἰκτείρειας ἀκοσμοτάτοιο μόροιο,
2.302	ὡς ὁ μὲν ἐν πέτρῃσιν ὑφέξεται, ἡ δέ οἱ ἄγχι
2.303	ἠΰτʼ ἐπεγγελόωσα παρίσταται· ὧδέ κε φαίης
2.304	μυθεῖσθαι μύραιναν ἀπηνέα κερτομέουσαν·
2.305	τί πτώσσεις δολομῆτα; τίνʼ ἔλπεαι ἠπεροπεύειν; 
2.306	ἦ τάχα καὶ πέτρης πειρήσομαι, ἤν σε καὶ εἴσω
2.307	δέξηται σπιλὰς ἥδε καὶ ἠμύσασα καλύψῃ.
2.308	αὐτίκα δʼ ἀγκύλον ἕρκος ἐνιπλήξασα λαφύσσει,
2.309	χοιράδος αὖ ἐρύουσα περίτρομον· αὐτὰρ ὅ γʼ οὔτι,
2.310	οὐδὲ δαϊζόμενος, λείπει πάγου οὐδʼ ἀνίησιν, 
2.311	ἀλλʼ ἔχεται πέτρης εἱλιγμένος, εἰσόκεν αὐταὶ
2.312	λείπωνται μοῦναι κοτυληδόνες ἐμπεφυυῖαι.
2.313	ὡς δʼ ὅτε περθομένης δηΐων ὑπὸ χερσὶ πόληος,
2.314	ἑλκομένων παίδων τε δορυκτήτων τε γυναικῶν,
2.315	κοῦρον ἀνὴρ δειρῇ τε καὶ ἀγκάσιν ἐμπεφυῶτα 
2.316	γειναμένης ἐρύσῃ πολέμου νόμῳ, αὐτὰρ ὁ χεῖρας
2.317	πλέγδην οὐκ ἀνίησιν ἀπʼ αὐχένος, οὐδέ ἑ μήτηρ
2.318	κωκυτῷ προΐησιν, ὁμοῦ δέ οἱ ἕλκεται αὐτή·
2.319	ὣς καὶ πουλύποδος δειλὸν δέμας ἑλκομένοιο
2.320	λισσάδι μυδαλέῃ περιφύεται, οὐδʼ ἀνίησι. 
2.321	Κάραβος αὖ μύραιναν ἀπηνέα περ μάλʼ ἐοῦσαν
2.322	ἐσθίει, αὐτοφόνοισιν ἀγηνορίῃσι δαμεῖσαν.
2.323	ἦ γὰρ ὁ μὲν πέτρης σχεδὸν ἵσταται, ᾗ ἔνι ναίει
2.324	ὀτραλέη μύραινα· δύω δʼ ἀνὰ κέντρα τιτήνας
2.325	δήϊα φυσιόων προκαλίζεται ἐς μόθον ἐλθεῖν, 
2.326	ἶσος ἀριστῆϊ προμάχῳ στρατοῦ, ὅς ῥά τε χειρῶν
2.327	ἠνορέῃ πολέμου τε δαημοσύνῃσι πεποιθὼς
2.328	ἔντεσι καρτύνας βριαρὸν δέμας, ὀξέα πάλλων
